code,name,mv_mean,amount_mean,num_days,profit,主营产品名称,主营产品类型,公司简介
002396.SZ,星网锐捷,1381911.9910878092,379484.3771535269,241,550406616.52,NBR系列路由器、RG-ACE系列应用控制引擎、RG-EG系列易网关、RG-IDS入侵检测系统、RG-iS-16FSAS智能存储系统、RG-iS2000D智能存储系统、RG-iS2000智能存储系统、RG-iS6000智能存储系统、RG-iS-LAB智能存储系统、RG-NPE系列网络出口引擎、RG-RIIL-BMC、RG-S5760系列交换机、RG-S7600系列交换机、RG-S8600系列交换机、RG-S9600系列交换机、RG-SAP安全与攻防实验平台、RG-SMP 2.X桌面管理与审计组件、RG-USG统一安全网关、RG-WALL V系列安全网关、RG-WALL防火墙、RG-WG系列、RSR-E系列路由器、RSR系列可信多业务路由器、汇聚交换机、接入交换机、企业级交换机、锐捷流量分析系统、无线管理软件、无线控制器、智能无线接入点、自治型无线接入点,传输设备、存储设备、防火墙软件、行业专用软件、交换设备、通信终端设备,公司是国内领先的ICT应用方案提供商，是国家首批技术创新示范企业。公司多次承接和入选国家火炬计划、国家863计划项目、国家核高基重大专项，形成大批具有国内和国际领先水平的核心技术。公司在网络通讯、交换机、云计算终端(瘦客户机)、支付终端、桌面云、无线接入、宽带接入、融合视讯、视频信息应用等各产品领域均形成了独特的领先优势，同时也致力于在智慧网络、智慧云、智慧社区、智慧通讯、智慧娱乐、智慧物联等应用领域为客户带来前瞻的应用解决方案，并成功进军欧洲、美洲、非洲、大洋洲等近百个国家和地区。
002123.SZ,梦网科技,1368127.916489419,374405.82091701246,241,-238113811.08,节能大功率电力电子产品、移动信息服务,环保机械、专业咨询服务,公司是中国较大的企业云通信服务商，目前在运营和扩展中国最大的B2C企业短信平台的同时，进一步布局功能更为强大的基于现有网络环境和面向5G网络的大型富媒体及物联网云通信平台，让梦网云通信高效强大的通信能力成为推动各项移动互联网应用快速发展的重要力量，未来打造云通信的全球第一平台是梦网的愿景。公司在B2C即时通信领域中已经成为了中国行业龙头，并形成了一定的竞争优势，目前客户数和发送数还在规模化扩张。未来，移动通信技术巨大变革，产业浪潮正扑面而来。梦网将全面变革和升级产品与服务，面向5G，丰富产品线，创新推出新的技术产品和业务，打造出梦网云通信全新的模式。公司当前主营中国最大规模之一的企业云通信平台，是中国领先的云通信服务商，构建以IM云、视频云、物联云三位一体的企业云通信服务生态，为企业提供全方位的移动互联网云通信服务。公司持有工信部颁发的跨地区增值电信业务许可证，包含IDC、ISP、呼叫中心和SP业务，是同时获得ISO27001、ISO9001和CMMI认证的移动互联网增值技术企业。
002544.SZ,杰赛科技,1290302.299912448,231327.8874688797,241,141574557.21,201控制卡、301控制卡、ADSL Modem、AnyShow601控制器、Cable Modern、GPS车载终端、GSM远程车辆防盗报警器、IPTV机顶盒、JS1000内网安全管理产品、JS-LCM-501型控制系统、VoIP产品、电子系统工程、动态身份认证、干线放大器、高清RM播放器、高清数字电视机顶盒、功率分配器、互教通电子家校沟通平台、环境监测信息系统、基站、勘察设计、可行性研究、耦合器、平安钟、普通型数字电视机顶盒、腔体功率分配器、腔体耦合器、手机游戏、双向数字电视机顶盒、天线、网络规划产品、网络优化、网络运维、无线城域网、无线接入点、无线局域网、无线网卡、无线网桥、校园安全产品定制、信息系统安全测评、学生出入管理系统、印制电路板、用户站、直放站、直放站网管系统、智能卡管理系统、自动化监控系统,传输设备、电信增值服务、电子测试和测量仪器、电子元器件、行业专用软件、集成电路、接入设备、其他消费电子产品、通信系统与平台、通信终端设备、卫星制造及应用、系统集成服务、专业咨询服务,公司是信息网络建设技术服务及产品的综合提供商，从技术解决方案、建设解决方案和相关网络产品等多个维度，为电信运营商(中国联通、中国移动、中国电信)、广电运营商、政府机构、公共事业部门及企事业单位提供信息网络建设综合解决方案服务及相关网络产品。公司业务领域资质齐全、拥有众多核心技术和丰富的经验积累，具备涵盖电子/通信工程设计、勘察、咨询、承包、信息系统集成等业务的国家甲级或壹级业内最高等级资质7项。公司是国家高新技术企业、省级软件企业、WAPI产业联盟主要发起单位、中国数字家庭产业联盟、中国宽带无线多媒体项目组成员单位和广东省信息网络安全服务指定单位。
300166.SZ,东方国信,1220504.5961553112,597787.1759294606,241,301962926.86,企业数据平台、数据分析平台,行业专用软件,公司主营业务是致力于为客户提供企业级大数据及云平台整体解决方案，基于大数据、云计算、人工智能和机器学习等世界前沿技术提供包括数据采集、数据存储计算、数据分析挖掘、数据应用、数据治理管控、云基础服务与应用开发平台、智慧城市等相关产品、服务与解决方案，帮助客户发掘数据深层次价值，提升IT资源利用率及服务能力，从而获得更高的生产效率和经营效益。公司构建了云化架构的大数据产品线，形成了体系化、自主化的大数据核心产品体系，涵盖了大数据采集设备、大数据处理专用设备、大数据存储及计算、大数据管控、大数据分析、私有云平台、大数据展现及移动应用等各个方面。通过多年的自主研发，公司对标国内外优秀软件与产品打造了大数据及云计算的核心产品能力，这些产品已经在众多行业客户中得到了广泛与成功的应用。
002815.SZ,崇达技术,1186200.1210646431,140252.41525311203,241,553871774.83,HDI板、刚挠结合板、高多层板、挠性板、特种板,电子元器件,公司是全球领先的印制线路板服务企业。公司拥有成熟的线路板生产制造技术，掌握着行业先进的产品生产工艺和生产过程控制技术，以及专业技术极强的产品生产技术开发团队，产品覆盖2-50层、HDI、厚铜、刚挠结合、埋容等线路板，可一站式满足客户的多种需求。产品广泛应用于通信设备、计算机、工业控制、电源电子、家用电器、汽车、医疗仪器、安防电子、航天航空等高科技领域，产品70%外销到欧洲、美洲、日本、亚太等地区。公司是中国电子元器件百强企业、全球印制电路百强企业、中国年度最佳雇主(深圳地区)30强企业、中国500最具价值品牌，“崇达”为广东省著名商标。
300079.SZ,数码视讯,1138979.357987527,902428.4908049792,241,104785206.43,ASI切换器系列、BNSAS双向网络安全访问系统、CAS条件接收系统、CMMB产品、CMMB系统软件产品、DRM数字版权管理系统、DVB编、解码器系列、EIS节目信息系统、EPG电子节目指南系统、MPEG-2/DVB 网络适配器系列、PUSH VOD、SUMAVISION 10K511 IPQAM、SUMAVISION媒体综合处理平台EMR、TS流转发器系列、VOD系统、边缘调制器IPQAM、电视彩信系统、电视购物、电视广告系统、电视商务系统、电视游戏、发送采集卡、复用器系列、联网监控平台硬件、马赛克节目导视系统、平台核心处理机SMR、切换矩阵10KA01系列、数字加扰器系列、数字调制、解调器系列、统一Loader系统、统一机顶盒软件平台(OSP)、业务与广告推荐系统、在线支付系统,电声器件、监控器材及系统、视频点播系统,公司是中国数字电视软件及系统提供商，产品覆盖DVB-C/DVB-T/DVB-S前端硬件系统、CA系统、中间件系统、EPG系统，电视彩信、马赛克节目导视等增值服务系统，编解码、光传输以及CMMB手机电视等，其领先优势已经扩展到IPTV、高清监控等多个领域。公司是多项数字电视行业标准的制订单位之一，也是中国数字音视频标准(AVS)组织的主要成员。产品已经进入全国三十几个省区，产品及系统广泛应用于广电、政府、电信、军队等多个领域，并且参与了2004年雅典奥运会直播，2008年奥运圣火传递直播等重大项目。2008年成为“国家火炬计划重点高新技术企业”，荣获“北京市企业技术中心”。2011年，被福布斯评为“中国最具潜力上市企业”。
300394.SZ,天孚通信,1133381.3681696472,223719.41393361,241,306391954.55,光收发接口组件、光纤适配器、陶瓷套管,变电设备、输电设备、专用设备与零部件,公司是光通信精密元器件一站式解决方案提供商，形成了多个产品系列齐头并进，互促发展的综合布局，为下游客户提供一站式、组合式产品解决方案，为全球光网络提供优质连接。公司主营业务包括光通信领域光器件的研发设计、高精密制造和销售业务，高速光器件封装ODM/OEM业务等，具体产品线包括陶瓷套管、光纤适配器、光收发组件、OSA ODM高速率光器件、光隔离器、MPO高密度线缆连接器、光纤透镜阵列(LENS ARRAY)、光学镀膜、插芯、Mux/Demux耦合、BOX封装OEM等。公司产品广泛应用于电信通信、数据通信、物联网等领域。公司成立十多年以来，始终坚持高端市场定位和高品质产品理念，目前已发展成为全球光器件领域光纤连接细分行业的领先企业。作为拥有“江苏省企业技术中心”和“江苏省工程技术研究中心”荣誉称号的国家级高新技术企业，公司持续加大研发投入，先后承担了科技部创新基金项目、国家火炬计划项目等数项省部级科技计划项目，获得了多项国家授权专利，产品被评为“江苏省名牌产品”，公司被评为“江苏省科技小巨人企业”和“江苏省隐形冠军企业”。
603881.SH,数据港,1132512.717388693,311626.30591286306,241,111004195.9,定制数据中心、交钥匙数据中心、客户迁入服务、数据中心规划咨询、运营和管理支持,专业咨询服务,公司的主营业务为数据中心服务，并以批发型数据中心服务为主，零售型数据中心服务和数据中心增值服务为辅。其中，批发型数据中心服务主要系根据大型数据中心用户(如，大型互联网企业或金融机构)复杂多样化的应用部署需求特点，通过提供定制化的规划、设计、系统集成、运营管理服务来满足最终用户的独特数据中心服务需求，从而实现数据中心从整体上做到端到端系统化地与最终用户行业承载的服务保持最佳的适配，在能源效率以及总体效率方面大大优于传统数据中心。
300735.SZ,光弘科技,961574.8023435684,133726.2889045643,241,352538235.41,LED背光源、OBD、PCBA、行车记录仪、基站定位终端、继电器、平板电脑、网络路由器、智能手机、智能眼镜,传输设备、电脑整机、集成电路、智能商用设备、专用设备与零部件,公司的主营业务为专业从事消费电子类、网络通讯类、汽车电子类等电子产品的PCBA和成品组装，并提供制程技术研发、工艺设计、采购管理、生产控制、仓储物流等完整服务的电子制造服务(EMS)。公司提供电子制造服务的主要产品包括消费电子类(智能手机、平板电脑)；网络通讯类(网络路由器、基站定位终端)；物联网、汽车电子类(OBD、行车记录仪)等电子产品。公司的品质管控能力得到了监督机构和客户的高度认可，公司已通过ISO多项管理体系认证，并于2017年11月顺利通过ISO9001、14001及IATF16949三体系换版审核，建立了质量、环境及职业健康安全一体化管理体系。公司连续荣获“中国质量诚信企业”、被授予中国质量认证中心“A类企业”、获“广东省先进电子制造工程技术研究中心”称号。
002194.SZ,武汉凡谷,770460.9993946722,166072.0850207469,241,227718903.92,凡谷低噪声放大器、凡谷隔离器、凡谷功分器、凡谷合路器、凡谷滤波器、凡谷射频子系统、凡谷双工器、凡谷驻波比报警器,电子元器件、通信终端设备,公司是跻身国际一流的移动通信天馈系统射频器件独立供应商。公司长期专注于发展移动通信天馈系统射频器件的核心技术，主要产品和解决方案有滤波器系列(双工器、合路器、塔顶放大器等)、介质材料、毫米波雷达系列(交通、安防、工业控制等)、行业网平台系列(公安、交通以及政府政务云等)，凭借自有知识产权和强大的软件和硬件研发平台，快速响应客户定制产品需求。凭借专业化产品研发平台、纵向集成的大规模生产能力、低成本结构以及优秀的客户协作能力，为全球领先的移动通信系统集成商提供基站天馈系统射频子系统和器件的定制产品及专业服务。公司长期专注于发展移动通信天馈系统射频器件的核心技术，凭借自有知识产权和强大的研发平台，快速响应客户定制产品需求。公司旨在创造一个“以不断满足客户需求为拉动力，以不断激发员工成功愿望为推动力”、以“不断发展壮大、始终奉献社会”为经营理念的全球化卓越型企业。公司坚持“技术创新，服务通信，核心业务，集中取胜，相邻业务，优选发展”的技术发展路线，稳健地在市场中捕捉机遇，实现可持续发展。
