code,name,mv_mean,amount_mean,num_days,profit,主营产品名称,主营产品类型,公司简介
002475.SZ,立讯精密,27862520.89590987,2790774.655842324,241,7070520386.57,Charge Cable Assembly、CN Series Cable Assembly、DMS TO 2DVI Cable Assembly、Download Cable Assembly、D-SUB25 Serise Cable Assembly、Earphone、LAN Cable Assembly、LCD Cable Assembly、LVDS Cable Assembly、Micro Coaxial Cable Assembly、NB Wireharness Cable Assembly、RCA Cable Assembly、REAR COM Cable Assembly、REAR USB Cable Assembly、RJ45 RJ11 Cable Assembly、SCSI Cable Assembly、Speaker Cable Assembly、USB Cable Assembly,电子元器件,"公司是一家技术导向公司，公司专注于连接线、连接器的研发、生产和销售，产品主要应用于3C(计算机、通讯、消费电子)和汽车、医疗等领域。产品主要应用于3C(电脑、通讯、消费电子)、汽车和通讯等领域，核心产品电脑连接器已树立了优势地位，台式电脑连接器覆盖全球20%以上的台式电脑，并快速扩大笔记本电脑连接器的生产，公司已经开发出DP、eDP、USB3.0、ESATA等新产品，同时公司正逐步进入汽车连接器、通讯连接器和高端消费电子连接器领域，拓展新的产品市场,确立了自身的竞争优势。公司是USB、HDMI、SATA等协会的会员。公司拥有自主产品的核心技术和知识产权，已申请多项发明专利，实用新型专利及外观设计专利超过百项。后公司实验室通过国家认可委认证，并获“深圳市测试平台”称号。"
601138.SH,工业富联,23044159.140371617,329624.2194149377,241,20009751000.0,存储设备、服务器设备、工业机器人、光传输设备、行动基站设备、机顶盒、金刚石工具、路由器、数据中心设备、网络电信设备高精密机构件、网络服务器、网络交换机、微细丝锥、钨钢工具、无线设备、云服务设备高精密机构件、智能家庭网关、智能手机高精密高分子聚合物机构件、智能手机高精密金属机构件,传输设备、存储设备、电脑配件、专用设备与零部件,公司是全球领先的通信网络设备、云服务设备、精密工具及工业机器人专业设计制造服务商，为客户提供以工业互联网平台为核心的新形态电子设备产品智能制造服务。公司致力于为企业提供以自动化、网络化、平台化、大数据为基础的科技服务综合解决方案，引领传统制造向智能制造的转型；并以此为基础构建云计算、移动终端、物联网、大数据、人工智能、高速网络和机器人为技术平台的“先进制造+工业互联网”新生态。公司主要从事各类电子设备产品的设计、研发、制造与销售业务，依托于工业互联网为全球知名客户提供智能制造和科技服务解决方案。公司主要产品涵盖通信网络设备、云服务设备、精密工具和工业机器人。相关产品主要应用于智能手机、宽带和无线网络、多媒体服务运营商的基础建设、电信运营商的基础建设、互联网增值服务商所需终端产品、企业网络及数据中心的基础建设以及精密核心零组件的自动化智能制造等。
002241.SZ,歌尔股份,14698161.320954638,2813015.5835435684,241,4274702999.38,歌尔便携式音频产品、歌尔蓝牙系列产品、歌尔微型麦克风、歌尔微型受话器、歌尔微型扬声器,电声器件,公司主要从事声学、传感器、光电、3D封装模组等精密零组件，以及虚拟/增强现实、智能穿戴、智能音频、机器人等智能硬件的研发、制造和品牌营销。目前已在多个领域建立了全球领先的综合竞争力。自上市以来，歌尔保持高速成长，年复合增长率达40%以上。秉持一站式服务为客户创造更大价值的理念，歌尔深耕产业价值链上下游，已与消费电子领域的国际一流客户达成稳定、紧密、长期的战略合作关系。从上游精密元器件、模组，到下游的智能硬件，从模具、注塑、表面处理，到高精度自动线的自主设计与制造，歌尔打造了在价值链高度垂直整合的精密加工与智能制造的平台，为客户提供全方位服务。歌尔研发布局全球。在美国、日本、韩国、丹麦、瑞典、北京、青岛、深圳、上海、南京、中国台湾等地分别设立了研发中心，以声光电为主要技术方向，通过集成跨领域技术提供系统化整体解决方案。
600703.SH,三安光电,14034947.266106756,2659682.409966805,241,1313021414.22,三安光电LED外延片、三安光电PIN光电二极管、三安光电氮化镓LED芯片、三安光电砷化镓LED芯片、三安光电太阳能电池,半导体分立器件、半导体太阳能光伏、集成电路,公司是国家发改委批准的“国家高科技产业化示范工程”企业、工业和信息化部认定的“国家技术创新示范企业”，承担了国家“863”、“973”计划等多项重大课题，拥有国家人事部颁发的博士后科研工作站及国家认定的企业技术中心。公司主要从事全色系超高亮度LED外延片、芯片、Ⅲ-Ⅴ族化合物半导体材料、微波通讯集成电路与功率器件、光通讯元器件等的研发、生产与销售，产品性能指标居国际先进水平。公司凭借强大的企业实力，继2014年扩大LED外延芯片研发与制造产业化规模、同时投资集成电路产业，建设砷化镓高速半导体与氮化镓高功率半导体项目之后，2018年三安光电在福建泉州南安高新技术产业园区，斥资333亿元投资Ⅲ-Ⅴ族化合物半导体材料、LED外延、芯片、微波集成电路、光通讯、射频滤波器、电力电子、SIC材料及器件、特种封装等产业。
600745.SH,闻泰科技,12962410.165504526,1546942.2611286307,241,2611542317.51,笔记本电脑、车联网、汽车电子、虚拟现实、移动终端、智能硬件、智能终端,电脑整机、电子设备及加工、互联网服务、移动通讯设备与配件、智能商用设备,闻泰科技是中国A股上市公司，主营业务包括半导体IDM、光学模组、通讯产品集成三大业务板块，已经形成从半导体芯片设计、晶圆制造、封装测试，到光学模组、通讯终端、服务器、笔记本电脑、IoT、汽车电子产品研发制造于一体的全产业链布局。旗下的安世半导体是全球知名的半导体IDM公司，是原飞利浦半导体标准产品事业部，有60多年半导体研发和制造经验，总部位于荷兰奈梅亨，晶圆制造工厂在德国汉堡和英国曼彻斯特，封装测试工厂位于中国东莞、菲律宾卡布尧和马来西亚芙蓉。安世半导体设备公司ITEC致力为全球半导体制造商带来经久耐用的创新性制造解决方案，提供半导体、RFID和MiniLED制造设备和系统，以高生产率水平的组装、测试、检测和智能制造平台为客户助力，帮助客户在质量、生产率和可持续性方面取得优势地位，同时把总体拥有成本降到低位。旗下的得尔塔科技在光学模组领域是主流供应商。公司采用flip-chip技术，实现更稳定的性能，更强的抗干扰、更小的产品尺寸，以满足特定客户的产品需求。得尔塔科技拥有FTIR、X-Ray、TBR、酸碱化学试验等解析和信赖试验设备一百多台，专注光学领域的研发和生产分析实验，聚焦摄像头模组的同时，积极布局新技术、新产品和新服务。公司以多年专业经验铸就有利竞争优势，未来随着摄像头高端化、双摄、三摄等技术的创新，其将不断向手机、IoT、智能汽车等领域延伸，从而实现高速增长。
000063.SZ,中兴通讯,12305414.148049254,1843938.0718298757,241,6812941000.0,中兴xDSL终端、中兴刀片服务器、中兴多业务节点设备、中兴机架服务器、中兴基站、中兴基站监控系统、中兴计费结算系统、中兴家庭网关、中兴宽带网关、中兴宽带网络机顶盒、中兴路由交换机、中兴路由器、中兴模块电源、中兴手机、中兴通讯终端&业务管理平台（ZXCSM）系统、中兴网管系统、中兴小容量中继网关、中兴综合接入设备（IAD）,传输设备、电子元器件、服务器与工作站、计费结算系统、交换设备、接入设备、其他消费电子产品、通信系统与平台、通信终端设备、网管软件、移动通讯设备与配件,公司是全球领先的综合性通信制造业上市公司，是近年全球增长快速的通信解决方案提供商。公司拥有通信业界完整的、端到端的产品线和融合解决方案，通过全系列的无线、有线、业务、终端产品和专业通信服务，灵活满足全球不同运营商和企业网客户的差异化需求以及快速创新的追求。公司通过为全球多个国家和地区的电信运营商和企业网客户提供创新技术与产品解决方案，让全世界用户享有语音、数据、多媒体、无线宽带等全方位沟通。公司坚持以持续技术创新为客户不断创造价值。公司在美国、加拿大、瑞典、中国等地设立全球研发机构，凭借不断增强的创新能力、突出的灵活定制能力、日趋完善的交付能力赢得全球客户的信任与合作。公司在全球范围内开展社区公益和救助行动，参加了印尼海啸、海地及汶川地震等重大自然灾害救助，并成立了中国规模最大的“关爱儿童专项基金”。
300782.SZ,卓胜微,11332512.471116023,1445771.5803360995,241,2134834604.14,IP授权、低功耗蓝牙微控制器芯片、射频低噪声放大器、射频开关,电子元器件,公司由硅谷留学人员创办于张江高科技园区，在知名风险投资红杉资本和盈富泰克的支持下，已迅速成长为一家在射频器件及无线连接专业方向上具有顶尖的技术实力和不凡市场竞争力的芯片设计公司。公司专注于移动互联领域，致力于开发无线通信的射频，射频与数字soc芯片产品，并为客户提供基于公司芯片的完整软硬件解决方案。经过8年多的研发积累，公司已拥有丰富的产品线，在行业内树立了领先的地位，销售方面亦已快速扩张，目前的产品已经得到诸如三星、华为、联想、展讯等***客户的采用。目前，公司已成为国内领先的射频器件及无线连接领域的专家，曾经推出或现有的产品线，如cmmb项目产品mxd0265、硅调谐器产品mxd1516、gps低噪放大器芯片mxdln16g及lte switch芯片mxd8650等。
300433.SZ,蓝思科技,10639924.66343918,825100.6785228215,241,2070242934.38,平板电脑防护玻璃、手机防护玻璃,玻璃,公司是全球领先的消费电子与高端智能汽车领域智能终端视窗与防护功能组件的ODM企业，凭借各项领先的技术和工艺、先进自研量产的自动化智能生产线、深厚的行业资源、宏大的生产规模、优质的品牌口碑，以及强大的研发储备与实力等优势，在消费电子产品、智能汽车、智能家居家电等领域的市场地位、市场占有率均全球领先，拥有全球优质、稳定的知名品牌客户资源，包括苹果、三星、华为、OPPO、vivo、小米、摩托罗拉、特斯拉、亚马逊等。公司的高精度玻璃、蓝宝石、精密陶瓷、金属、模组、贴合、组装等各类核心产品与业务均已被深度用于智能手机、可穿戴设备、平板电脑、笔记本电脑、一体式电脑、中控屏幕等智能终端，在5G商用场景、人工智能、工业互联网、智慧城市、教育医疗、智能汽车、智能家居等领域的得到广泛的应用，未来市场前景广阔。
603986.SH,兆易创新,10454467.230912024,2490691.240547718,241,2336793535.26,闪存芯片,集成电路,公司成立于2005年4月，是一家以中国为总部的全球化芯片设计公司。公司致力于各类存储器、控制器及周边产品的设计研发，已通过SGS ISO9001及ISO14001等管理体系的认证，在上海、合肥、中国香港设有全资子公司、在深圳设有分公司，在中国台湾地区设有办事处，并在韩国、美国、日本等地通过产品分销商为客户提供优质便捷的本地化服务。公司核心管理团队由来自世界各地的高级管理人员组成，每一位都曾在硅谷、韩国、台湾等各地著名IC企业工作多年，有着丰富的研发及管理经验。公司产品为NOR Flash、NAND Flash及MCU，广泛应用于手持移动终端、消费类电子产品、个人电脑及周边、网络、电信设备、医疗设备、办公设备、汽车电子及工业控制设备等各个领域。公司先后被评为“重大科技成果产业化突出贡献单位”、“创新型试点企业”。
002179.SZ,中航光电,9486674.08597054,761874.1778547718,241,1990997442.19,光电科技光无源器件、光电科技接线端子、光电科技矩形电连接器、光电科技滤波电连接器、光电科技射频同轴电连接器、光电科技特种连接器、光电科技圆形电连接器,电子元器件、通信终端设备,公司是中国专业为军工防务及高端制造领域提供互连技术解决方案的高科技企业。公司产品广泛应用于航空航天和军事领域、通讯网络与数据中心、轨道交通、新能源汽车、电力、石油装备、医疗设备以及智能装备等民用高端制造领域；产品远销欧洲、美国、以色列、澳大利亚、韩国、印度等海外多个国家和地区。公司总部拥有“国家认定企业技术中心”、“博士后科研工作站”以及国家和国防认可实验室，专业从事中高端光、电、流体连接技术与设备的研究与开发。公司通过了AS9100国际航空航天质量管理体系认证、ISO9001(2000)质量体系认证、TS16949体系认证、ISO14001环境体系认证、OHSAS18001职业健康安全管理体系认证等。公司多项重点产品通过了UL、CUL、CE、TUV、CB等安规认证。
300413.SZ,芒果超媒,8784979.877933975,664697.5422946058,241,2114090171.85,互联网视频业务、家庭消费业务、快乐购电视购物、快乐购外呼购物、快乐购网络购物、内容制作和运营、社交电商业务、消费金融业务、艺人经纪、游戏及IP内容互动营销、运营商业务,互联网服务、经纪业务、视频点播系统、无线增值业务、影视制作发行,公司是湖南广播电视台旗下统一的新媒体产业及资本运营平台，与湖南卫视共同构成芒果生态内的双平台驱动、全媒体融合发展格局。公司聚焦媒体主业，以芒果TV融合媒体平台为主阵地，秉持平台精准内容与核心自主技术双轮驱动理念，充分发挥研发、生产、发行、牌照、政策优势，服务全国及海外亿级新媒体用户，持续打造A股市场第一家以融合发展为标志，具有引领力、传播力和影响力的国有新媒体上市公司，全力向国内最具创新活力和有全球影响力的新型主流媒体集团战略目标迈进。
002938.SZ,鹏鼎控股,8056190.980578258,380949.5638174274,241,3317274178.23,其他领域用板、通讯用板、消费电子及计算机用板,电子元器件,公司由原富葵精密组件(深圳)有限公司整体变更设立。公司成立于1999年4月29日，主要从事各类印制电路板的设计、研发、制造与销售业务。多年来，公司以“发展科技、造福人类，精进环保、让地球更美好”为使命，遵循“稳增长、调结构、促创新、控风险”的经营策略，致力于与世界一流客户合作，运用先进的研发技术，配合高效率、低成本的运营手段，构建体系完善、布局合理的产供销体系，打造“效率化、合理化、自动化、无人化”的四个现代化制造工程。目前，公司的制造基地分布于深圳、秦皇岛、淮安及营口，服务半径覆盖中国大陆、中国台湾、日本、韩国、美国及越南等地，可以为全球客户提供快速、高效的优质服务，已成为业内极具影响力的重要厂商之一。
300661.SZ,圣邦股份,6915231.479874067,656868.0477344398,241,699389578.69,DC/DC转换器、LED驱动器、MOSFET 驱动、POP音抑制器、比较器、耳机驱动器、负载开关、过压保护器件、锂电池充电管理芯片、模拟信号开关、视频驱动器、特殊开关系列、微处理器复位芯片、线性稳压器、小逻辑门、音频功率放大器、音频驱动器、运算放大器,电子元器件,公司是一家专注于高性能、高品质模拟集成电路芯片设计及销售的高新技术企业。公司产品涵盖信号链和电源管理两大领域，包括运算放大器、比较器、音/视频放大器、模拟开关、电平转换及接口电路、小逻辑芯片、AFE、LDO、DC/DC转换器、OVP、负载开关、LED驱动器、微处理器电源监控电路、马达驱动、MOSFET驱动及电池管理芯片等。公司产品可广泛应用于消费类电子、手机与通讯、工业控制、医疗仪器、汽车电子等领域，以及物联网、新能源、可穿戴设备、人工智能、智能家居、无人机、机器人和共享单车等新兴电子产品领域。
600845.SH,宝信软件,6681015.667524559,339913.48166666663,240,1818835200.72,宝信eCan办公信息化平台、宝信eCan中小企业协同交流平台、宝信eCop网络接入与综合管理平台（V5）、宝信MES BM2 V2.2、宝信采购管理系统、宝信车辆监控系统 VMCS、宝信钢铁企业统计系统、宝信高炉智能专家系统、宝信过程控制计算机应用系统开发平台、宝信基于B/S环保自动报表系统、宝信集中监控系统、宝信监控软件、宝信警务通eMobile、宝信企业资产管理产品化软件、宝信石化行业应急联动处置平台 iCV4.4P、宝信铁区MES产品化软件、宝信信息系统平台 iPlat4j & iPlat4net、宝信一体化监控指挥平台iCentroView、宝信一体化质量监控平台 iQualityView、宝信增强型高清晰闯红灯电子警察、宝信资源规划系统,ERP软件、OA软件、行业专用软件,"公司系宝钢股份控股的上市软件企业。历经多年发展,公司在推动信息化与工业化深度融合、支撑中国制造企业发展方式转变、提升城市智能化水平等方面作出了突出的贡献，成为中国领先的工业软件行业应用解决方案和服务提供商。公司产品与服务业绩遍及钢铁、交通、医药、有色、化工、装备制造、金融、公共服务、水利水务等多个行业。公司紧紧围绕“互联网+”、“中国制造2025”等国家战略，致力于推动新一代信息技术与制造技术融合发展，引领中国工业化与信息化的深度融合，促进制造企业从信息化、自动化向智慧制造迈进；同时，公司还持续强化智慧城市相关领域的开拓，在智能交通、智慧楼宇、公共服务等领域也拥有强大实力，努力推动智慧城市创新。"
000938.SZ,紫光股份,6597171.792351037,830172.3817095436,241,2147646278.03,紫光IBM IT产品销售、紫光IPv4／v6双栈核心路由器、紫光笔记本电脑、紫光耗材、紫光红外测温仪、紫光惠普IT产品销售、紫光家用消毒机、紫光刻录光盘、紫光苹果IT产品销售、紫光扫描仪、紫光数码相机、紫光台式电脑、紫光投影仪,IT产品销售、传输设备、存储设备、电脑配件、电脑整机、电气仪器仪表、光学设备、清洁器具、扫描仪、投影仪,公司是主营信息电子产业的中国高科技A股上市公司。公司的核心业务基本覆盖IT服务的重要领域：硬件方面提供智能网络设备、存储系统、全系列服务器等为主的面向未来计算架构的先进装备。公司结合全球信息产业的发展趋势及自身优势业务的特点，将公司战略聚焦于IT服务领域，致力于打造一条完整而强大的“云―网―端”产业链，向云计算、移动互联网和大数据处理等信息技术的行业应用领域全面深入，并成为集现代信息系统研发、建设、运营、维护于一体的全产业链服务提供商。公司源自清华，依托清华大学的综合性人才和科技资源优势，健康可持续发展，是国家重点高新技术企业、国家863计划成果产业化基地、历年入选中国电子信息“百强”企业。
002920.SZ,德赛西威,6270356.89980083,490292.6388962656,241,832922008.36,车载信息娱乐系统、驾驶信息显示系统、空调控制器、显示模组与系统、智能驾驶辅助系统,电子设备及加工、行业专用软件、汽车及零配件经销、专用设备与零部件,公司是国际领先的汽车电子企业之一，是智能网联技术积极推动者。德赛西威专注于人、机器和生活方式的无缝整合，为智能驾驶舱、智能驾驶以及车联网技术提供创新、智能、具有竞争力的产品解决方案和服务。德赛西威多年来在开发设计、质量管理和智能制造领域的专业能力，确保公司能够满足汽车制造厂商的多元需求，为客户提供卓越的产品和服务，与国内外汽车制造商建立了良好的合作关系。
300496.SZ,中科创达,5571394.396636275,784582.928792531,241,647269132.32,平板电脑、智能电视软件BigDroid、智能电视软件SmartDroid、智能电视软件TVDroid、智能手机,操作系统软件、电子设备及加工、通信终端设备,公司是全球领先的智能平台技术提供商。自2008年成立以来，公司致力于提供卓越的智能终端操作系统平台技术及解决方案，助力并加速智能手机、智能物联网、智能汽车等领域的产品化与技术创新。源于多年在Android、Linux、Windows和HTML5等操作系统技术的研发与创新，中科创达形成了从硬件驱动、操作系统内核、中间件到上层应用全面的技术体系。积累了丰富的研发经验和众多自有知识产权，具备强有力的技术开发和服务能力。核心技术涵盖了通信协议栈、深度学习、图形图像算法、操作系统优化和安全技术等多个方面。中科创达与智能终端产业链中的芯片、元器件、终端、软件与互联网厂商以及运营商等全球领先企业拥有紧密的合作关系，具有独特的垂直整合优势。
002555.SZ,三七互娱,5125870.869157813,766210.2052946058,241,2875575877.62,广汽AC燃油箱、奇瑞A3燃油箱、网络游戏、英伦帝华TX4II燃油箱,发动机设备、网络游戏,公司主要从事互动娱乐业务以及汽车塑料燃油箱制造、销售业务，其中互动娱乐业务以手机游戏和网页游戏的研发、发行和运营为主，同时布局影视、动漫、音乐、VR及直播等泛娱乐业务。公司核心团队由经验丰富的手机游戏、网页游戏发行团队，以及技术领先的研发团队组成。公司自主研发的一系列性能优异、稳定性强的游戏引擎、游戏框架等核心技术，能够支持开发高性能、可玩性强的大型精品网络游戏，是公司持续推出高质量精品游戏的重要保障。公司于2017年5月完成对上海墨d公司以及江苏智铭公司整体收购，增强了公司游戏研发实力以及发行能力。
600183.SH,生益科技,5086217.813951328,586973.0828672198,241,2829683547.57,生益覆铜板、生益硅微粉、生益陶瓷电子元件、生益印刷线路板、生益粘结片,半导体材料、电子设备及加工、电子元器件,公司始终立足于高标准、高品质、高性能、高可靠性，自主生产覆铜板、半固化片、绝缘层压板、金属基覆铜箔板、涂树脂铜箔、覆盖膜类等高端电子材料。产品主要供制作单、双面线路板及高多层线路板，广泛用于家电、手机、汽车、电脑、航空航天工业、通讯设备以及各种中高档电子产品中。公司的主导产品已获得华为、中兴、诺基亚、博世、联想、索尼、三星、飞利浦等国际知名企业的认证，拥有较大的竞争优势，产品销美洲、欧洲、韩国、日本、东南亚等世界多个国家和地区。
002916.SZ,深南电路,5018442.784498689,389561.0313153527,241,1480637000.32,PCBA板级、背板、处理器芯片封装基板、存储芯片封装基板、多功能金属基板、刚挠结合板、高频微波板、高速多层板、高速通信封装基板、功能性模块、厚铜板、射频模块封装基板、微机电系统封装基板、整机产品/ 系统总装,专用设备与零部件,公司始终专注于电子互联领域，致力于“打造世界级电子电路技术与解决方案的集成商”，拥有印制电路板、封装基板及电子装联三项业务，形成了业界独特的“3-In-One”业务布局：即以互联为核心，在不断强化印制电路板业务领先地位的同时，大力发展与其“技术同根”的封装基板业务及“客户同源”的电子装联业务。公司具备提供“样品→中小批量→大批量”的综合制造能力，通过开展方案设计、制造、电子装联、微组装和测试等全价值链服务，为客户提供专业高效的一站式综合解决方案。公司系国家火炬计划重点高新技术企业、印制电路板行业首家国家技术创新示范企业及国家企业技术中心；同时，公司系中国电子电路行业协会(CPCA)的理事长单位及标准委员会会长单位，主导、参与了多项行业标准的制定。
