code,name,mv_mean,amount_mean,num_days,profit,主营产品名称,主营产品类型,公司简介
002600.SZ,领益智造,4852232.107203482,530259.3285518672,241,1180093116.13,MnZn软磁铁氧体、按键系列、车制件类、导热片、电池胶、干式异方性铁氧体永磁、光学胶、焊接工艺屏蔽罩  一体式屏蔽罩、键盘胶、金属件与胶，泡棉组合零件、金属手机内置结构件、镜头环系列、螺母类、螺丝类、镍锌软磁铁氧体、泡棉、屏蔽片、热熔胶、声学模组五金结构件（手机用MESH钢网）、声学丝网、湿式异方性铁氧体永磁、铁铜基粉末冶金件、橡胶垫片、橡胶铁氧体永磁、粘结钕铁硼永磁、支撑板、指纹环模组、转轴布,磁性材料、胶粘剂、专用设备与零部件,公司是国内大型铁氧体磁性材料元件制造商之一。主要产品包括铁氧体永磁元件、铁氧体软磁元件。2018年，公司通过重大资产重组，购买领益科技100%股权，公司的主营业务将由原来的磁性材料生产和销售变更为新型电子元器件、手机及电脑配件的生产和销售，公司成为拥有磁性材料、贸易及物流服务、平板显示、精密结构件、精密功能器件等业务并行的上市公司。领益科技的主营业务为新型电子元器件、导电材料、导热绝缘材料、屏蔽防辐射材料的技术开发、生产经营新型电子元器件、手机及电脑配件。
002384.SZ,东山精密,3612559.443266415,687336.2347593361,241,1862481138.84,钣金辅助设备、钣金柔性加工系统、表面处理、电子装配、激光切割、精密压铸、精密铸造设备、数控冲床、折弯机、质量控制,五金加工机械,公司是中国最大的专业从事精密钣金结构件工艺设计、制造服务企业，全球最大的基站天线精密钣金零部件提供商。公司集研发、生产、销售、服务业务为一体，为客户提供精密钣金件和精密铸件的制造与服务，已形成了产品结构研发、精密钣金制造、精密铸件制造、表面处理、精密组装、及时配送等在内的完整精密金属制造服务体系。通过了通讯设备制造商爱立信、朗讯、波尔威、安德鲁、安弗施，精密机床制造商沙迪克、阿奇夏米尔，核能设备制造商阿海珐，金融设备制造商NCR等客户严格的认证考核，并与其建立长期稳定的合作关系，为其全球分支机构提供可靠的产品和专业服务。
601231.SH,环旭电子,3204506.093164946,166842.42543983404,241,1857968074.82,背光源模块控制板、磁盘阵列系统(Array)、电脑主机板、客户端无线网络设备(CPE)、网络存储设备(NAS)、无线通讯模组(WM)、无线网卡(NIC)、销售终端设备(POS)、液晶面板控制板(VPD)、智能手持终端设备(SHD),存储设备、电子设备及加工、电子元器件、通信终端设备,公司是电子产品领域提供专业设计制造服务及解决方案的大型设计制造服务商。公司主要为国内外的品牌厂商提供各类电子产品的开发设计、物料采购、生产制造、物流、维修等专业服务，产品涵盖通讯类产品、电脑及存储类产品、消费电子类产品、工业类产品及其他类产品等。公司以资讯、通讯、消费电子及汽车电子等高端电子产品ODM、JDM、EMS为主，与许多国际电子产品品牌商，如苹果、友达光电、联想、英特尔、IBM等，建立了长期稳定的供应链合作关系。
300308.SZ,中际旭创,2762542.304000419,286604.81183817424,241,876977126.32,绑扎机、插入机、绝缘成形机、嵌线机、全自动流水线、绕线机、线圈压紧机、预整形机、中间形机、最终整形机,机床机械,公司是全球领先的数据中心光模块供应商，主要致力于高端光通信收发模块的研发、设计、封装、测试和销售，产品服务于云计算数据中心、数据通信、5G无线网络、电信传输和固网接入等领域的国内外客户。公司注重技术研发，并推动产品向高速率、小型化、低功耗、低成本方向发展，为云数据中心客户提供100G、200G、400G和800G的高速光模块，为电信设备商客户提供5G前传、中传和回传光模块，应用于城域网、骨干网和核心网传输光模块以及应用于固网FTTX光纤接入的光器件等高端整体解决方案，在行业内保持了出货量和市场份额的领先优势。根据市场权威机构LightCounting的报告，2017年、2018年，旭创科技连续两年位列全球光模块市场份额第二位；并预测有望在2020年排名全球光模块市场份额第一位。
002138.SZ,顺络电子,2723341.913494656,365815.37548132776,241,784625535.57,顺络电子NTC热敏电阻器、顺络电子SMT功率电感、顺络电子叠层片式LC滤波器、顺络电子叠层片式天线、顺络电子叠层片式铁氧体磁珠、顺络电子共模轭流线圈、顺络电子片式磁珠、顺络电子片式叠层介质滤波器、顺络电子片式高频电感、顺络电子片式三端EMI滤波器、顺络电子片式陶瓷体电感、顺络电子片式陶瓷体绕线电感、顺络电子片式铁氧体电感、顺络电子片式铁氧体绕线电感、顺络电子片式压敏电阻器、顺络电子绕线贴片功率电感,电子元器件,公司是一家专业从事各类片式电子元件研发、生产和销售的高新技术企业，主要产品包括叠层片式电感器、绕线片式电感器、共模扼流器、压敏电阻器、NTC热敏电阻器、LC滤波器、各类天线、NFC磁片、无线充电线圈组件、电容、电子变压器等电子元件。产品广泛应用于通讯、消费类电子、计算机、LED照明、安防、智能电网、医疗设备以及汽车电子等领域。秉承“遵疟曜肌⒖萍即葱隆⒊中改进，向全球客户提供优异的产品和完善的服务”的经营理念，凭借先进的管理体系、雄厚的开发能力、优异的产品质量和完善的服务，公司已成为众多国内知名企业的电子元件供应商。在电感细分领域内，公司在中国市场以及国际市场上均占有较高的市场占用率，技术和规模处于领先地位，公司的客户遍布全球，已成为国际电子产业链中不可或缺的供应商，为中国电子信息产业作出了贡献。
002463.SZ,沪电股份,2612719.1389894187,464633.113,241,1063500828.0,Linecard、背板、高密度集成板、厚铜板、混压板、埋被动元器件、企业通讯市场板、汽车板、散热板(背面连接金属块)、射频/微波/基站天线板、无卤素板,电子元器件,公司自成立以来一直立足于印制电路板的研发设计和生产制造。在全体员工的努力下，经过多年的市场拓展和品牌经营，现已发展成为是印制电路板行业内的重要品牌之一，在行业内享有盛誉。目前，公司主导产品为应用于通讯、通信设备以及汽车的印制电路板。公司专注于各类印制电路板的生产、销售及相关售后服务。目前公司主导产品为14-38层企业通讯市场板、中高阶汽车板，并以工业设备板等为有力补充，可广泛应用于通讯设备、汽车、工业设备、微波射频等多个领域。在激烈的市场竞争中，公司已经在技术、质量、成本、品牌、规模等方面形成竞争优势，居行业领先地位，连续多年入选行业研究机构N.T.Information发布的世界PCB制造企业百强以及中国印制电路行业协会(CPCA)发布的中国PCB百强企业，并被CPCA评为优秀民族品牌企业。
000988.SZ,华工科技,2520244.5546758715,427477.73595850624,241,760983179.01,华工激光打标机、华工激光雕刻竹简、华工激光焊接机、华工激光加工机、华工激光切割机、华工激光全息防伪产品、华工激光治疗仪、华工精密温度传感器、华工镭射电化铝、华工镭射防伪标识、华工热敏电阻、华工专用锯片,电子测试和测量仪器、电子设备及加工、电子元器件、发动机设备、其他工业用铝、轻型工程机械、诊断治疗设备,公司是华中地区一家高校背景的上市企业，也是一家以激光为主业的高科技企业。公司以“激光技术及其应用”为主业，在已形成的激光装备制造、光通信器件、激光全息仿伪、传感器、信息追溯的产业格局基础上，针对全球“再工业化”发展趋势以及自身特点，集中优势资源发展智能制造关键产品及解决方案。秉承“为制造的更高荣耀”的企业使命，公司旗下企业华工激光、华工正源、华工高理、华工图像、华工赛百的产品广泛应用于机械制造、航空航天、汽车工业、钢铁冶金、船舶工业、通信网络等重要领域，市场占有率处于行业领先地位。依托国家级企业技术中心、激光国家工程激光技术国家重点实验室、激光加工国家工程中心、教育部敏感陶瓷工程研究中心，公司与国内外科研院所、研究机构开展多层次技术交流和合作，与国际先进技术零距离对接，并先后承担国家“863”计划项目、国家高技术产业化示范工程项目、国家科技支撑计划项目、高档数控机床国家重大专项等多项。
002456.SZ,欧菲光,2446519.3764610253,377958.9657759336,241,-2624971644.78,保护玻璃及组件、层电阻式纯平触摸屏、光纤镀膜产品、光学低通滤波器、红外截止滤光片及组件,光学辅材,公司的主营业务为触控显示类业务、摄像通讯类业务和生物识别类业务，主营业务产品有触控和液晶显示模组、微摄像头模组和指纹识别模组等，同时大力布局智能汽车、车联网和智慧城市领域。公司产品广泛应用于以智能手机、平板电脑、智能汽车、智能可穿戴电子产品等为代表的消费电子领域。公司拥有垂直一体化的全产业链布局，具备为客户大规模稳定供货能力，高效的嵌入式研发模式和自主创新的核心技术使公司生产具备高度的灵活性和及时应变能力。作为全球触控行业龙头，公司和国内外知名品牌企业建立了长期稳定合作关系，以此为基础，微摄像头模组和指纹识别模组产品在近年来呈爆发式增长，目前跻身国内市场前列。公司积极布局智能汽车和车联网领域，充分利用自有核心技术，在智能中控、自动驾驶、车身电子等核心领域打造汽车智能化一站式解决方案，提供高质量、高性价比的产品和服务，力争成为汽车智能化的核心供应商及有竞争力的国际一流品牌。
603236.SH,移远通信,2439653.046899494,277069.36228630703,241,358060203.5,移远通信安全监控应用方案、移远通信车载应用方案、移远通信能源应用方案、移远通信无线支付应用方案、移远通信线网关应用方案、移远通信医疗健康应用方案,专业咨询服务,"公司主要从事物联网领域蜂窝通信模块及其解决方案的设计,研发与销售服务.主要产品包括GSM/GPRS(2G类别)系列,WCDMA/HSPA(3G类别)系列,LTE(4G类别)系列,NB-IoT系列等蜂窝通信模块,以及GNSS系列定位模块系列,EVB工具系列,目前公司产品主要应用于无线支付,车载运输,智慧能源,智慧城市,智能安防,无线网关,工业应用,医疗健康和农业环境等领域.公司是专业的物联网(M2M)技术的研发者和无线模块的供应商，提供物联网无线通信模块解决方案的一站式服务。"
603228.SH,景旺电子,2345169.560573245,140332.89234439834,241,935254514.42,金属基电路板、柔性电路板、双面及多层刚性电路板,集成电路,公司是专业从事印刷电路板及高端电子材料研发、生产和销售的国家高新技术企业，公司产品类型覆盖多层板、厚铜板、高频高速板、铝基电路板、双面多层柔性线路板、细密线路柔性线路板、HDI板、刚挠结合板、特种材料PCB、高端电子材料等。公司总部设立在深圳，是国内少数产品类型覆盖刚性电路板、柔性电路板和金属基电路板的厂商，为客户提供多样化的产品选择和一站式服务。公司产品广泛应用于通讯设备、计算机及网络设备、消费电子、汽车电子、工业控制等行业，是世界著名的电子电路供应商，产品销往全球各地。公司在深圳宝安、广东龙川、江西吉水均建设有大型现代化环保花园式生产基地，实现了跨区域的企业资源整合，不断优化卓越的管理体系，建立了集团化的产业发展规模，树立了稳健的国际化品牌形象，已成为行业最具成长性的高新技术企业。
300136.SZ,信维通信,2338412.6576646725,486595.3831991701,241,505097360.06,AP天线、接触弹片、模块天线、手机电视天线、手机天线、无线网卡天线,电子元器件、通信线缆,公司是国内小型天线行业发展的领跑者，集研发、制造、销售于一体，主要致力于研发和生产移动通信设备终端各类型天线，包括手机天线/GPS/WIFI/手机电视/无线网卡/AP天线等。公司积极围绕射频技术为核心，一方面不断夯实自身产品研发与制造能力；另一方面拓展高性能射频连接器及为解决整机EMC/EMI的精密五金部件、LDS产品、音频产品及音/射频模组等，新材料天线零部件如NFC、无线充电、无线支付模组等新品已批量交货，公司的产品线不断丰富，全方位为客户提供一站式解决方案服务，进一步加强与客户合作广度和深度，提升公司综合的竞争实力。公司拥有具备国家CNAS和国际CTIA认证资质的国际化标准的研发测试中心以及5G毫米波实验室。
300383.SZ,光环新网,2308736.6354201,378462.1749460581,241,836208334.39,光环新网CDN业务、光环新网IDC业务、光环新网PCM接入业务、光环新网VoIP业务、光环新网VPN虚拟专网、光环新网安全自动化、光环新网东环广场互联网数据中心、光环新网负载均衡业务、光环新网光纤接入业务、光环新网广域网/城域网、光环新网互联网接入服务、光环新网建筑智能化、光环新网酒仙桥互联网数据中心、光环新网楼宇自动化、光环新网企业ERP解决方案、光环新网企业互联网一体化解决方案、光环新网数据存储\备份、光环新网通信自动化、光环新网网络安全、光环新网网络系统集成、光环新网消防自动化、光环新网燕郊数据中心、光环新网增值业务,ERP软件、互联网服务、系统集成服务,公司是业界领先的互联网综合服务提供商，主营业务为互联网数据中心服务(IDC及其增值服务、IDC运营管理服务)、互联网宽带接入服务(ISP)以及云计算等互联网综合服务，是北京最具影响力的互联网服务商之一。公司累计服务企业客户逾万家，为用户提供更加高速、稳定、安全的互联网环境，聚拢优质资源和技术，赢得了良好的商业信誉，尤其在面向商企用户数据通讯及增值服务领域取得了长足的发展。公司致力于以先进技术、优质资源和高品质服务推动互联网创新发展，为用户提供更加高速、稳定、安全的互联网环境，聚拢优质资源和技术，在市场上享有领先的市场份额和较高的品牌知名度。公司建设的IDC机房相对于基础运营及其他网络资源，更能适应商企用户的高端需求，几大数据中心无论在地理位置上还是在硬件设施上均具有突出优势。随着国家“互联网+”行动计划的深入开展，公司主营业务具有更为广阔的市场空间。
600498.SH,烽火通信,2025431.801946672,179464.69855186724,241,287975372.16,烽火通信IBAS综合接入系统、烽火通信传输网网元级网管系统OTNM2000、烽火通信电缆、烽火通信电力光缆、烽火通信光传输设备、烽火通信光端机、烽火通信光节点、烽火通信光纤带光缆、烽火通信海底光缆、烽火通信集成电路、烽火通信接入路由器、烽火通信宽带接入服务器、烽火通信特种光缆、烽火通信特种光纤、烽火通信以太网交换机、烽火通信以太网收发器,传输设备、服务器与工作站、集成电路、交换设备、接入设备、输电设备、通信系统与平台、通信线缆、通信终端设备、网管软件,公司是国际知名的信息通信网络产品与解决方案提供商。自1999年成立至今，烽火通信始终专注于全球信息与通信事业的进步与发展，积累了对人类信息通信生活的深刻理解和创造力。始终以“造福人类社会”为使命，积极构建新一代的信息基础设施，积极推动CT向ICT的产业结构转型，致力于持续的科技创新。未来，公司将坚持自主创新和人才强企两大战略，积极把握网络强国、大数据、“互联网+”行动等战略，沿着数据传输、计算、存储、治理、分析、应用的价值链，深入布局自主可控的生态系统，推动产品和服务为越来越多的客户所认识和肯定。
002273.SZ,水晶光电,1916011.193425984,664700.2483609958,241,442179153.57,水晶光单反数码相机用光学低通滤波器、水晶光电波片、水晶光电分光片、水晶光电光学窗口片、水晶光电光学低通滤波器、水晶光电红外截止滤光片、水晶光电散热板,电子元器件,公司是国内专业从事精密薄膜光学产品研发、生产和销售的知名光电元器件制造的企业，是浙江省高新技术企业和国家火炬计划重点高新技术企业。公司主要产品应用于数码相机、可拍照手机摄像头、安防监控摄像头、电脑摄像头及其它数字摄像镜头、半导体照明、微型投影仪、视频眼镜、公路交通标志、安全防护等产品，主导产品光学低通滤波器(OLPF)和红外截止滤光片(IRCF)两大产品产销量居全球前列。公司是数码产业及手机通讯产业多家国际知名企业或行业龙头企业的主要配套供应商。公司拥有精密光学冷加工技术、超硬材料光学加工技术、精密光学薄膜、半导体加工、涂覆、植珠等核心技术，光学低通滤波器、红外截止滤光片及组立件、窄带滤光片、投影机散热板、LED蓝宝石衬底、微型投影、反光材料等系列产品均具有国内、国际领先水平。
300638.SZ,广和通,1886711.971815017,226187.1174102564,234,401345401.68,2G产品、3G产品、4G产品、GPS 产品,寻呼通信服务,公司自成立以来一直致力于物联网与移动互联网无线通信技术和应用的推广及其解决方案的应用拓展，在通信技术、射频技术、数据传输技术、信号处理技术上形成了较强的研发实力，是无线通信技术领域拥有自主知识产权的专业产品与方案提供商。公司在物联网产业链中处于网络层，并涉及与感知层的交叉领域，主要从事无线通信模块及其应用行业的通信解决方案的设计，研发与销售服务，主要产品包括2G、3G、4G、NB―IOT技术的无线通信模块以及基于其行业应用的通信解决方案，通过集成到各类物联网和移动互联网设备使其实现数据的互联互通和智能化，产品主要应用于移动支付、移动互联网、车联网、智能电网、安防监控等领域。
300115.SZ,长盈精密,1884086.8965944063,441334.3744979253,241,-604596722.65,IO 连接器、LCDMLED 端子、SIM 卡连接器、USB 连接器、板对板连接器、表面贴装式LED精密支架、电池连接器、各种小五金端子、精密连接器端子、射频连接器、手机电池金手指、手机耳机插座、手机复合屏蔽件、手机滑轨、手机屏蔽件、手机转轴、数码产品五金零件、通信设备卡接簧片、小型记忆卡,移动通讯设备与配件,公司是国内领先的精密电子零组件制造商，主要从事手机机构配套件，LED精密支架，精密模具等的开发、设计、制造、销售，如手机系列连接器、屏蔽件、滑轨、转轴、金属外观件：表面贴装式LED精密支架;电子产品包装材料。公司聚集了一批行业技术精英，技术开发实力强大。公司拥有精密的模具制造、高速精密冲压、精密塑胶成型以及精密连接器自动化生产设备开发所需全系列引进生产设备和实验测试仪器。公司已通过ISO9001：2000、ISO14001：2004、ISO16949、QC080000等多项体系认证，产品全面符合欧盟RoHS环保指令，并拥有多项自主产品专利。
300502.SZ,新易盛,1718286.761538083,521363.2936182572,241,661926139.05,PON光模块、点对点光模块,专用设备与零部件,公司是领先的光收发器解决方案和服务提供商，一直专注于光模块的研发、制造和销售；光模块在光纤终端完成光电信号转换，是光纤传输的最核心部件；光模块广泛应用于数据宽带、电信通讯、数据中心等行业。公司致力于围绕主业实施垂直整合，实现光器件芯片制造、光器件芯片封装、光器件封装和光模块制造环节全覆盖，力争抓住未来5G及数据中心市场良好的发展机会，努力开拓国内外市场，加强与主流通信设备制造商、经销商合作，实现公司产品升级转型，成为光通信模块、组件和子系统的核心供应商。目前，公司产品型号超过几千种，产品涵盖了多种标准的通信网络接口、传输速率、光波波长等技术指标，应用领域覆盖了数据宽带、电信通讯、数据中心、安防监控和智能电网等行业，产品销往全球各个国家和地区。公司有着严格的内控程序，并通过了ISO9001：2008质量体系认证。
300679.SZ,电连技术,1686325.7576763486,282955.4354813278,241,371586103.87,弹性接触件连接器、电磁屏蔽件、精密五金、射频微同轴线缆组件、射频信号互连传输解决方案、天线、微型射频测试连接器、微型射频同轴连接器,电子元器件,公司专业从事微型电连接器及互连系统相关产品的技术研究、设计、制造和销售服务。公司具备高可靠、高性能产品的设计、制造能力，自主研发的微型射频连接器具有显著技术优势，已达到国际一流连接器厂商同等技术水平，产品广泛应用在以智能手机为代表的智能移动终端产品以及车联网终端、智能家电等新兴产品中。公司凭借领先的技术水平，已成为深圳市企业技术中心、深圳市质量强市骨干企业、广东省创新型试点企业和国家级高新技术企业。公司坚持不断开拓创新，成功开发出一系列新产品并成功推向市场，多项产品获得“广东省高新技术产品”称号。
002281.SZ,光迅科技,1572480.0417899585,213087.6232572614,241,567266618.25,光讯科技波分复用器、光讯科技光波长/模式转换器、光讯科技光集成器件、光讯科技光连接器、光讯科技光纤放大器、光讯科技光线路保护子系统、光讯科技光转发器,传输设备、通信系统与平台,公司是中国最大光通信器件供货商，是目前中国唯一一家有能力对光电子器件进行系统性，战略性研究开发的高科技企业，是中国光电子器件行业最具影响的实体之一。国家高技术研究发展计划成果产业基地武汉光通信与光传感材料及器件成果产业化基地的主要建设单位之一，并被国家科学技术部火炬高技术产业开发中心认定为“国家火炬计划重点高新技术企业”，主要从事光通信领域内光电子器件的研究、开发、制造和技术服务。先后承担国家“863”、“973”、国家科技攻关等项目数十余项。中兴通讯、华为技术、烽火通信为代表的国内通信系统设备厂商已成为公司稳定的客户。
300017.SZ,网宿科技,1490276.587969137,347375.0695809128,241,165240702.33,网宿科技CDN服务、网宿科技IDC服务、网宿科技商品销售,互联网服务、软件销售,"公司是一家互联网业务平台提供商，知识和技术密集型的高新技术企业，公司服务的中大型客户包括互联网企业、政府、传统企业及电信运营商。针对客户在IT部署及数据计算、传输、安全等方面的需求，公司总结多年来服务各行业的经验和行业特点，推出针对手机直播、媒体、家电、汽车、电商、快消、金融、消费电子、游戏、政务、教育等行业的整体解决方案，并为客户提供定制化服务。公司通过多年积累的运营经验为客户提供专业服务，帮助客户提升自身互联网服务质量、简化维护管理流程、降低运维成本。公司主要产品包括：CDN,IDC,云计算,云安全。"
