code,name,mv_mean,amount_mean,num_days,profit,主营产品名称,主营产品类型,公司简介
603658.SH,安图生物,3475659.5866357638,257135.22917012445,241,973663074.64,板式化学发光检测试剂、磁微粒化学发光检测试剂、检验仪器、胶体金检测试剂、酶联免疫检测试剂、免疫荧光检测试剂、微生物诊断试剂,生物诊断试剂、专用设备与零部件,公司专业从事体外诊断试剂及仪器的研发、生产和销售，形成了以免疫诊断产品为主、微生物检测产品特色发展的格局，产品品种齐全，能够为临床诊断提供一系列解决方案。公司产品覆盖了传染病到非传染病应用的各类检测领域，能够满足终端用户的各种检测需求。试剂品种涉及传染病、肿瘤、生殖内分泌、甲状腺功能、肝纤维化、优生优育、糖尿病、高血压、心脏病、泌尿生殖道疾病、呼吸系统疾病以及细菌分离培养、鉴定和药敏分析等多个检测领域。此外，公司一直坚持试剂与仪器共同发展，相关配套仪器涵盖了化学发光免疫分析仪、酶标仪、洗板机、联检分析仪、全自动样品处理系统、全自动化学发光测定仪等产品。公司努力打造具有全球品牌影响力的体外诊断产业公司。
300677.SZ,英科医疗,3432967.155505535,1044407.1639751038,241,7430075719.0,标签电极(TAB)、冰冰贴、超级冰袋、电刀笔、电极纸、丁腈手套、防护服、负极板、负极板连接线、冷热敷、冷热理疗袋、轮椅车、手杖、心电电极片、一次性PVC手套、一次性冰/热理疗袋、医用床边桌、助步器、助行器,医用耗材,公司是中国领先的一次性医疗耗材和医疗耐用设备制造商。主营业务涵盖医疗防护、康复护理、保健理疗、检查耗材等板块，主要产品包括一次性手套、轮椅、冷热敷、电极片等多种类型的护理产品，产品广泛应用于医疗机构、养老护理机构、家庭日用及其他相关行业。经历多年发展，英科医疗在全球已拥有多家子公司，在上海、美国洛杉矶、加拿大、马来西亚、德国等地分别设有销售办公室。公司战略定位于高端一次性PVC手套、丁腈手套(医疗级手套)的生产，是中国能够高比例持续稳定生产医疗级手套的极少数企业之一，拥有全球主要目标市场准入资质认证(如美国510K认证、NSF食品体系认证、加拿大CMDCAS认证、欧盟CE认证)等，产品质量达到并超过FDA和CE标准。
002223.SZ,鱼跃医疗,3297562.5850117053,458025.5316680498,241,1482421641.48,鱼跃2000轮椅车、鱼跃402AI超声雾化器、鱼跃403C压缩空气式雾化器、鱼跃7D电动洗胃机、鱼跃7E-D交直流吸痰器、鱼跃7F-3型氧护士制氧机、鱼跃7F-5制氧机(带雾化)、鱼跃AI型家庭保健药箱（不附器材）、鱼跃A型颈椎牵引器、鱼跃B型家庭保健药箱（不附器材）、鱼跃H032轮椅车、鱼跃H100轮椅车、鱼跃IN-615P单用听诊器(白金版)、鱼跃IN-747GPF双用听诊器(黄金版)、鱼跃XY-98BⅢ氧气吸入器、鱼跃XY-98BII墙式氧气吸入器、鱼跃YU821手杖、鱼跃便携式压缩氧自救器、鱼跃单用新型铝合金听诊器、鱼跃防护眼罩、鱼跃人工流产器械箱、鱼跃三用听诊器、鱼跃双翼阴道扩张器（检查小号）、鱼跃血压表、鱼跃血压计,医用辅助设备、医用耗材、诊断治疗设备,公司是一家以提供家用医疗器械、医用临床器械和互联网医疗服务为主要业务的公司，而研发、制造和销售医疗器械产品是公司目前的核心业务，也是目前公司主要业绩来源。公司器械产品主要集中在呼吸供氧、康复护理、手术器械、高值耗材、中医诊疗器械、药用贴膏及高分子卫生辅料等领域。公司紧紧把握科技发展趋势，以专业的临床医学为基础，为患者提供远程慢病管理、远程医学诊断等云端医疗服务，颠覆传统的医疗模式，为医患之间的沟通提供便利，有效缓解稀缺的医疗资源。同时并积极联动数字云技术，在医疗专业领域实现大数据价值延伸。公司矢志于投身生命健康事业，将专业的健康管理理念与先进的产品方案带入万千家庭，打造了由家庭医疗、临床医疗、互联网医疗组成的大健康生态圈，组建一个全面覆盖医疗器械的专业化服务平台。
688202.SH,美迪西,3147097.089888614,337547.4365145228,241,282222910.23,蛋白靶标验证、毒理学安全性评价研究、化合物活性筛选及优化、化学合成、结构生物学、药代动力学、药效学、原料药与制剂工艺研究、质量标准和稳定性研究,化学试剂、生物诊断试剂、药品经销,公司是一家专业的生物医药临床前综合研发服务CRO，为全球的医药企业和科研机构提供全方位的符合国内及国际申报标准的一站式新药研发服务。公司的CRO服务涵盖药物发现、药学研究以及临床前研究。公司为国内大型制药企业及众多新兴的知名创新生物技术企业提供全方位新药临床前研发服务，是少数拥有国内领先、国际先进、符合国际临床前研究标准的综合性技术服务平台的临床前CRO企业之一。公司主要通过接受客户的委托，开展新药研究服务，并按照合同约定将研究成果和数据等资料移交给客户，从而向客户收取研究服务费来实现盈利。公司拥有全面的临床前新药研发能力及丰富的研发经验，公司创始人CHUN-LIN CHEN先生是“千人计划”国家特聘专家，各业务板块主要管理人员都在医药研发领域经验丰富，公司的研究质量控制体系达到国际先进水平。
002044.SZ,美年健康,3089125.9476880957,459886.0320788382,241,64136014.05,电话预约、个检服务、健康沙龙、健康信使、绿色就医、团检服务、中医体检、专家面对面、专项体检,医院、专业咨询服务,公司是一家以健康体检为核心，集健康咨询、健康评估、健康干预于一体的专业体检和医疗服务集团，也是目前中国最大的个人健康大数据平台。公司拥有“美年大健康”、“慈铭体检”、“慈铭奥亚”、“美兆体检”等多个健康体检品牌，将贯彻“多品牌、多层次”的经营战略，在品牌定位上实现差异化和互补。其中：“美年大健康”和“慈铭体检”定位于服务大众健康体检的专业连锁品牌；“慈铭奥亚”定位于服务中高端团体健康体检及综合医疗服务的专业连锁品牌；“美兆体检”定位于服务高端个人健康体检专业连锁品牌。通过实施多品牌战略，为客户提供多层次、全方位、精准化、个性化的健康服务。
688139.SH,海尔生物,2948851.5510286805,175002.5039211618,241,845035305.76,-30℃自动化冷库/血浆库、BIMS生物样本库信息管理系统、U-Cool冷链监控系统、冰衬疫苗冷藏箱/冷冻箱、超低温保存箱、低温保存箱、低温防爆保存箱、低温风冷保存箱、洁净台、生物安全柜、太阳能疫苗冷藏箱/冷冻箱、物联网 恒温转运箱、物联网接种台疫苗冷藏箱、物联网冷链室疫苗冷藏箱、物联网试剂冷藏箱、物联网血液冷藏箱、物联网云芯超低温保存箱、血液冷藏箱、液氮罐,行业专用软件、金属包装制品、制冷器具、专用设备与零部件,公司是基于物联网转型的生物科技综合解决方案服务商。公司主要为生物样本库、药品与试剂安全、血液安全、疫苗安全、生命科学实验室等五大应用场景提供低温存储解决方案。公司打破国外垄断，突破生物医疗低温技术，荣获行业内唯一的国家科技进步奖。市场份额位居国产品牌公司首位，并成为世界卫生组织(WHO)、联合国儿童基金会(UNICEF)的长期采购供应商。公司的销售模式包括经销和直销，公司盈利模式为向客户提供综合解决方案，既包括销售公司自产的低温存储设备，也会根据客户需求从第三方采购器材和用品。公司具有行业领先的技术实力与产业化经验，建立了覆盖全国的经销网络和售后服务体系。公司致力于低温存储设备制造与物联网平台的融合，在行业内占据了先发优势。
300253.SZ,卫宁健康,2912212.414580369,279855.6733432203,236,378174115.45,公共卫生信息管理系统、医技信息管理系统、医院信息管理系统,行业专用软件,公司是国内第一家专注于医疗健康信息化的上市公司，致力于提供医疗健康卫生信息化解决方案，不断提升人们的就医体验和健康水平。公司通过持续的技术创新，自主研发适应不同应用场景的产品与解决方案，业务覆盖智慧医院、区域卫生、基层卫生、公共卫生、医疗保险、健康服务等领域，是中国医疗健康信息行业最具竞争力的整体产品、解决方案与服务供应商。多年来，公司产品获得了“国家级火炬计划项目”、“国家重点新产品”、“上海市火炬计划项目”、“上海市高新技术成果转化认定项目”、“上海市重点新产品”等诸多殊荣，并获得国家及上海市科技创新基金的资助。
688029.SH,南微医学,2893732.5926750205,189377.54452697092,241,324750539.99,FNA穿刺活检针1、FNB穿刺活检针2、斑马导丝、鼻胆引流管、肠道支架/TTS肠道支架、胆道支架/TTS胆道支架、靛胭脂粘膜染色剂、高频电刀、活检钳、可携带125I放射粒子支架、可旋转重复开闭软组织夹、扩张球囊、南京微创ERCP、南京微创活检钳、南京微创其他手术辅助耗材、南京微创清洁刷、南京微创细胞刷、南京微创支架及置入器、南京微创止血夹、气管支架、切开刀、取石球囊、取石网篮、圈套器、三级扩张球囊、食道支架、塑料支架、套扎器、微波消融仪、微波消融针、细胞刷、一次性内窥镜用注射针,手术与注射器械,公司是一家主要从事微创医疗器械研发、制造和销售的企业。公司主要产品包括内镜诊疗器械和肿瘤消融设备及耗材。公司作为我国内镜诊疗器械行业的重要生产商，部分产品已经具备与国外主要竞争对手竞争的能力。公司子公司微创美国是美国最大的采购组织之一HPG的合格供应商，公司子公司康友医疗是我国领先的肿瘤消融设备及耗材制造商，产销规模占据行业突出位置。公司主要销售模式有经销、直销及贴牌销售。公司重视研发，建立了内镜诊疗、肿瘤消融、光学相干断层扫描成像(OTC)三大技术平台，形成了多项行业领先的核心技术。此外，公司建立起了覆盖国内外的营销网络，形成了广阔的市场覆盖，产品已销售至50多个国家和地区。
688301.SH,奕瑞科技,2792451.314783917,193386.4822987552,241,484039540.68,齿科系列、放疗系列、工业安防系列、普放无线系列、普放有线系列、乳腺系列,电子测试和测量仪器、诊断治疗设备,公司是一家以全产业链技术发展趋势为导向、技术水平与国际接轨的数字化X线探测器生产商，主要从事数字化X线探测器研发、生产、销售与服务，产品广泛应用于医学诊断与治疗、工业无损检测、安防检查等领域。公司为全球少数几家同时掌握非晶硅、IGZO、CMOS和柔性基板四大传感器技术并具备量产能力的X线探测器公司之一。公司产品在图像性能、质量稳定性和可靠性等方面已达到全球领先水平，并通过在高性能闪烁体制备、高灵敏度低噪声传感器和电子电源设计、嵌入式智能系统和图像算法等领域的技术突破，成功实现了差异化布局，提升了公司的核心竞争力。公司经过多年发展，已成为全球数字化X线探测器行业知名企业，产品远销亚洲、美洲、欧洲等地共计70余个国家和地区，得到柯尼卡、锐珂、富士、西门子、飞利浦、安科锐、DRGEM、上海联影、万东医疗、普爱医疗、蓝韵影像、东软医疗及深圳安科等国内外知名影像设备厂商的认可。
002030.SZ,达安基因,2756257.361725145,668306.7411244813,241,3618186564.12,达安EB病毒（EBV）核酸扩增PCR荧光检测试剂盒、达安SARS病毒检测试剂盒、达安丙肝病毒检测试剂盒、达安单纯疱疹病毒通用型（HSV）核酸扩增PCR荧光检测试剂盒、达安肺炎支原体（MP）核酸扩增PCR荧光定量检测试剂盒、达安分子生物学仪器、达安弓形虫（TOX）核酸扩增PCR荧光检测试剂盒、达安呼吸道合胞病毒(RSV)核酸扩增荧光检测试剂盒、达安甲型肝炎病毒（HAV）核酸扩增PCR荧光检测试剂盒、达安结核杆菌检测试剂盒、达安解脲脲原体（UU）核酸扩增PCR荧光定量检测试剂盒、达安巨细胞病毒（HCMV）核酸扩增PCR荧光检测试剂盒、达安淋球菌（NGH）核酸扩增PCR荧光检测试剂盒、达安梅毒螺旋体（TP）核酸扩增PCR荧光检测试剂盒、达安人类免疫缺陷病毒1型（HIV-1）核酸扩增PCR荧光定量检测试剂盒、达安人乳头瘤病毒核酸扩增PCR荧光定量检测试剂盒、达安沙眼衣原体种检测试剂盒、达安炭疽杆菌（BA）核酸扩增（PCR）荧光检测试剂盒、达安腺病毒（ADV）核酸扩增PCR荧光检测试剂盒、达安血液筛查NAT系统、达安乙肝病毒检测试剂盒、达安荧光分光光度计、达安荧光基因探针PCR、达安幽门螺旋菌（HP）核酸扩增PCR荧光检测试剂盒,生物诊断试剂、诊断治疗设备,公司是以分子诊断技术为主导的，集临床检验试剂和仪器的研发、生产、销售以及全国连锁医学独立实验室临床检验服务为一体的生物医药高科技企业。公司在分子生物学技术方面，尤其是基因诊断技术及其试剂产品的研制、开发和应用上始终处于领先地位，目前主要从事荧光PCR检测技术研究、开发和应用，以及荧光PCR检测试剂盒的生产和销售。公司不断完善创新机制，以全面的技术创新、管理创新、经营模式创新，探索生命的奥秘，以一流的产品和服务推动公司的不断成长。
688289.SH,圣湘生物,2666082.987551867,166883.64927800832,241,2242696395.58,POCT移动分子诊断系统系列仪器、病毒性肝炎系列试剂、第三方医学检验服务、儿科感染系列试剂、核酸提取系列试剂、核酸血液筛查系列试剂、呼吸道感染系列试剂、科研、公共卫生、动物疫病系列试剂、科研服务、全自动核酸检测反应体系构建系列仪器、生化系列试剂、生殖道感染与遗传系列试剂、荧光PCR检测分析软件,行业专用软件、生物诊断试剂、医院、诊断治疗设备,"公司是一家以自主创新基因技术为核心，集诊断试剂和仪器的研发、生产、销售，以及第三方医学检验服务于一体的体外诊断整体解决方案提供商，是国内技术先进、产品齐全的体外诊断领军企业之一，致力于成为全球领先的创新型高端分子诊断企业和基因科技的普惠者，服务于各类疾病防控、突发疫情防控等全民健康事业，助力国家精准医疗体系和分级诊疗体系建设，公司建立了完善的全流程质控体系和营销服务体系，产品已在全国2,000多家标杆医院、第三方医学检验机构及其他医疗机构广泛使用，并远销全球40多个国家，公司自主研发的创新型技术和产品，填补了国内多项空白，获得国家科技进步二等奖、中国专利优秀奖等国家级重大奖项20余项，被评为国家知识产权示范企业、国家高新技术企业。"
688050.SH,爱博医疗,2509263.4633278674,249440.11847302903,241,171344218.27,动物用晶体、角膜塑形用硬性透气接触镜、可折叠一件式人工晶状体、泪液分泌检测滤纸、囊袋张力环、人工晶状体、人工晶状体(含预装式)III类医疗器械、人工晶状体(含预装式)欧盟认证IIb类、眼科手术器械、一次性人工晶状体植入系统、一次性使用眼科手术用刀、医用透明质酸钠凝胶、硬性透气角膜接触镜,手术与注射器械、医疗器械用制剂、医用辅助设备、医用耗材,"公司是由国家“千人计划”和北京市“海聚工程”特聘专家解江冰博士创办的高新技术企业，专注于眼科医疗器械的自主研发、生产、销售及相关服务。目前公司主要产品覆盖手术和视光两大领域，主要针对白内障和屈光不正这两大类造成致盲和视力障碍的主要眼科疾病，其中手术领域的核心产品为人工晶状体，视光领域的核心产品为角膜塑形镜，以及围绕这两项核心产品研发生产的一系列配套产品。公司中长期发展目标是开发眼科全系列医疗产品，包括植入类眼科耗材、手术器械、手术设备、视光产品、眼科制剂等产品，覆盖白内障、屈光不正、青光眼、眼底病变等诸多领域，成为国内眼科医疗领域的创新型领军企业。公司专利ZL201210017055.4后房型人工晶状体获得“第二十一届中国专利优秀奖”。公司人工晶状体产品上市以来，已覆盖国内30多个省、自治区和直辖市的1,000多家医院，并且已出口至德国、法国、荷兰、意大利、奥地利、卢森堡、泰国、巴基斯坦等国家，累计销售近100万片。2015年至今，公司产品密集入选中国政府对非洲和“一带一路”国家“光明行”医疗援助项目，为20多个国家的患者带来光明，打破了中国白内障医疗援外项目主要使用进口人工晶状体的局面。"
688298.SH,东方生物,2442564.6473029046,711094.702493776,241,4920188146.66,癌胚抗原检测试剂盒、丙型肝炎病毒抗体检测试剂盒、促黄体生成素检测试剂盒、大便隐血检测试剂盒、大麻联检试剂盒、低密度脂蛋白胆固醇（LDLC）测定试剂盒、多项尿液分析试纸条、甘油三酯（TG）测定试剂盒、高密度脂蛋白胆固醇(HDLC)测定试剂盒、肌红蛋白/肌酸激酶同工媚/心肌肌钙蛋白三合一检测试剂盒、甲胎蛋白检测试剂盒、可卡因联检试剂盒、吗啡联检试剂盒、疟疾检测试剂盒、前列腺特异抗原检测试剂盒、人类免疫缺陷病毒抗体检测试剂盒、人绒毛膜促性腺激素检测试剂盒、同型半胱氨酸测定试剂盒、唾液酒精检测试纸条、心肌肌钙蛋白I检测试剂盒、幽门螺旋杆菌检测试剂盒,生物诊断试剂,公司是一家专业从事体外诊断产品研发、生产与销售的公司，目前已完成从抗原抗体等生物原料，到体外诊断试剂以及体外诊断仪器的全产业链布局，形成了以POCT即时诊断试剂为主导产品，重点发展分子诊断、生物原料、诊断仪器和液态生物芯片等产品的业务格局。发行人一直秉承全球化发展战略，已取得CFDA产品证书及备案凭证66项，FDA(510K)产品认证31项，欧盟CE产品认证225项，加拿大MDL产品认证67项，墨西哥医疗器械产品认证3项，产品远销北美洲、亚洲、非洲、欧洲、南美洲和大洋洲，客户遍布全球一百多个国家，并在美国、加拿大设立了全资子公司，外销占比约95%，是国内少有的全面打开海外市场的医疗器械生产企业。发行人依托全球化的研发团队，建立了“体外诊断试剂省级高新技术企业研究开发中心”和“院士专家工作站”，与比尔及梅琳达・盖茨基金会、上海交通大学、浙江大学、浙江省生物治疗重点实验室等国内外机构展开了合作，先后承担了国家火炬计划、湖州南太湖精英计划等多项科研项目，成功研发了多项体外诊断产品，获得了国家火炬计划产业化示范项目证书、浙江省重点高新技术产品、湖州市科学技术进步奖、浙江省级科学技术成果登记证书等多项荣誉。
002901.SZ,大博医疗,2165231.406983569,85936.74815767635,241,673309413.17,骨针、线缆、脊柱接骨板（前路）、脊柱内固定器（后路）、空心钉、颅骨修复钛网系列、普通钉板、髓内钉、锁定钉板、外固定器、硬脑膜、椎间融合器,医用耗材,公司是一家以骨科、神经外科、微创外科为主的综合性医疗集团，是国家火炬计划重点高新技术企业，也是国内具有竞争力的骨科植入物生产企业之一。公司主营业务系医用高值耗材的生产、研发与销售，主要产品包括骨科创伤类植入耗材、脊柱类植入耗材及神经外科类植入耗材、微创外科耗材等。公司先后通过了FDA、CE、ISO13485、GMP等专业认证，产品品质不断超越国际标准，得到国内外用户的一致认可。
300482.SZ,万孚生物,2161195.271489195,604199.7925020747,241,634433145.2,多通道免疫荧光检测仪、检测试剂杯型、检测试剂笔形、检测试剂卡型、检测试剂条形、免疫荧光检测仪、全自动免疫荧光检测仪、血糖仪,电子测试和测量仪器、生物诊断试剂,"公司致力于生物医药体外诊断(in vitro diagnosis,IVD)行业中快速检测(point-of-care testing,POCT)产品(包括试剂和仪器)的研发、生产和销售，为顾客提供专业的快速诊断与慢病管理的产品和服务。万孚生物构建了完善的胶体金与胶乳标记层析技术平台、荧光标记定量检测技术平台、干式生化以及电化学定量检测、分子诊断等技术平台，产品涵盖传染病、妊娠、心血管疾病、毒品、肿瘤疾病、代谢疾病等业务领域。百余种产品应用于各级医院、社区门诊、卫生院、OTC药房以及疾病控制中心、公安、军队等特殊渠道。公司在美国成立了子公司和研发中心，在德国、肯尼亚、印尼成立了营销中心，并与欧洲零售巨头BOOTS、亚洲零售巨头WATSONS、南欧零售连锁著名品牌SONAE，以及国内海王星辰、金象、老百姓大药房等建立了稳定的合作关系，为全球180多个国家和地区客户提供产品解决方案和技术支持。"
688366.SH,昊海生科,2046050.3975103733,227332.31893361,241,352235233.39,玻璃酸钠注射液、玻尿酸、人工晶状体、润眼液、视光材料、眼科粘弹剂、医用几丁糖（防粘连用）、医用几丁糖（关节腔内注射用）、医用胶原蛋白海绵、医用透明质酸钠凝胶、重组人表皮生长因子,化学试剂、生物诊断试剂、医疗器械用制剂,公司是一家应用生物医用材料技术和基因工程技术进行医疗器械和药品研发、生产和销售的科技创新型企业，致力于通过技术创新及转化、国内外资源整合及规模化生产，为市场提供创新医疗产品，逐步实现相关医药产品的进口替代，成为有关生物医用材料领域的领军企业。经过十余年不断自主创新和产业整合，公司完成了以医用透明质酸钠/玻璃酸钠和医用几丁糖为代表的可吸收生物医用材料的行业重组，实现了创新基因工程药物重组人表皮生长因子的产业化，进而在眼科、整形美容与创面护理、骨科和防粘连及止血四个主要业务领域取得了行业领先优势。此基础之上，公司通过一系列并购，构建了从原料制备、光学设计、创新工艺研发到规模化生产和专业市场营销的人工晶状体全产业链。
600529.SH,山东药玻,2031306.294362336,371916.9120705394,241,591088499.35,沂蒙安瓿、沂蒙丁基胶塞、沂蒙管瓶、沂蒙管制药用玻璃瓶、沂蒙铝塑盖、沂蒙铝塑盖塑料瓶、沂蒙模制药用玻璃瓶、沂蒙输液瓶、沂蒙塑料瓶、沂蒙药用玻璃管、沂蒙棕色瓶,玻璃容器、塑料包装制品,"公司以医药、食品、日用品行业为服务对象，生产各种药用、食品、日用品包装材料,产品市场覆盖32个省、市、自治区，并远销欧、美、俄、日、韩、东南亚等60多个国家和地区，每年为制药、食品、化妆工业提供百亿支各种规格的包装产品，这些产品中有模制抗生素瓶系列产品、管制瓶系列产品、棕色瓶系列产品、中性硼硅玻璃系列产品、输液瓶系列产品、日化瓶系列产品、食品瓶系列产品、丁基橡胶塞系列产品、预灌封注射器系列产品、铝塑盖系列产品、塑料瓶系列产品等，适用于制药工业粉针、水针、输液、口服液、冻干、生物制剂、片剂等不同药品制剂及食品、化妆品的包装需要。其中公司的主导产品模制抗生素瓶销往国内外各制药企业，与上药集团、广药集团、哈药集团、华北制药集团、东瑞制药、辉瑞制药、中美上海施贵宝等1200多家中外制药厂家建立了长期稳定的供货关系。公司已成为中国最大的医药玻璃专业制造商，生产规模位居亚洲前列。"
