code,name,mv_mean,amount_mean,num_days,profit,主营产品名称,主营产品类型,公司简介
300244.SZ,迪安诊断,2022006.649254473,271391.9400041494,241,1162884346.85,Cobas 4000系列产品、Cobas 6000分析仪系列、LightCycler480高通量实时荧光定量PCR系统、MagNA Pure Compact 全自动快速核酸纯化系统、MagNA Pure LC 2.0 全自动核酸纯化与加样系统、Modular Analytics EVO血清工作站(SWA)、PCR 试剂、PyroMark Q24、PyroMarkID焦磷酸测序仪、QIAcube 全自动核酸和蛋白纯化工作站、法国SEBIA电泳试剂、广州康润TORCH试剂、科宝XS全自动尿有形成分分析仪、罗氏ECL试剂、罗氏荧光定量PCR仪,生物诊断试剂、诊断治疗设备,公司是一家独立的第三方医学诊断服务平台，主要向各级医疗卫生机构提供以医学诊断服务外包为核心业务的医学诊断服务整体解决方案。经过多年的发展，公司现已形成具有迪安特色的“服务+产品”的一体化商业模式，公司不仅可以向各级医疗卫生机构提供医学诊断服务外包业务，还可以向其提供国内外知名的诊断产品。公司已在全国布局20余家连锁化实验室，并相继通过ISO15189与CAP国际质量认证认可体系，为全国12000多家医疗机构提供以服务外包为核心的医学诊断服务整体解决方案。
688198.SH,佰仁医疗,1998612.56345283,56423.49520331951,241,51198204.92,瓣膜成形环、涤纶补片、动脉导管未闭封堵器、房缺封堵器、肺动脉带瓣管道、人工生物心脏瓣膜（牛心包瓣）、人工生物心脏瓣膜（猪主动脉瓣）、神经外科生物补片、生物疝补片、心胸外科生物补片、心血管病封堵器输送系统,医疗美容器械,公司是国内技术领先的、专注于动物源性植介入医疗器械研发与生产的高新技术企业，产品应用于心脏瓣膜置换与修复、先天性心脏病植介入治疗以及外科软组织修复。公司已获准注册10个Ⅲ类医疗器械产品，其中人工生物心脏瓣膜(牛心包瓣、猪主动脉瓣)、肺动脉带瓣管道、瓣膜成形环、心胸外科生物补片等5项产品为国内首个获准注册的同类产品，填补了国内空白。公司产品已在北京安贞医院、解放军301医院、复旦大学附属中山医院、广东省人民医院、河南省人民医院、四川大学华西医院、沈阳军区总医院、上海儿童医学中心等300余家国内三甲医院里临床应用。公司具备较强的自主创新能力。公司曾先后荣获“中关村国家自主创新示范区创新型试点企业”、“首届中国创新创业大赛企业组第一名”、“北京市科学技术奖三等奖”等奖项及荣誉称号。公司产品肺动脉带瓣管道入选科技部《创新医疗器械产品目录(2018)》，并荣获“北京市新技术新产品(服务)证书”，公司产品心包补片、人工心脏瓣膜、瓣膜成形环、涤纶补片、封堵器(动脉导管未闭封堵器和房缺封堵器)及输送系统曾先后获得“北京市自主创新产品证书”。
688016.SH,心脉医疗,1942953.0122991288,230524.4472738589,241,315855662.84,Aegis分叉型大动脉覆膜支架及输送系统、Castor分支型主动脉覆膜支架及输送系统、CRONUS术中支架系统、CROWNUS外周血管支架系统、Hercules Low Profile直管型覆膜支架及输送系统、Hercules分叉型覆膜支架及输送系统、Hercules球囊扩张导管、Minos腹主动脉覆膜支架及输送系统、Reewarm外周球囊扩张导管,医用辅助设备,"公司是一家从事主动脉及外周血管介入医疗器械研发,生产及销售的高新技术企业,在主动脉介入医疗器械领域，公司是国内产品种类齐全、规模领先、具有市场竞争力的企业之一，公司在该领域的主要产品为主动脉覆膜支架系统；在外周血管介入医疗器械领域，公司深耕多年，目前拥有外周血管支架系统、外周血管球囊扩张导管等产品；公司掌握了涉及治疗主动脉疾病的覆膜支架系统的核心设计及制造技术，成功开发出第一个国产腹主动脉覆膜支架、国内唯一获批上市的可在胸主动脉夹层外科手术中使用的术中支架系统,根据弗若斯特沙利文公司的相关研究报告，按照产品应用的手术量排名，公司在我国主动脉血管介入医疗器械市场份额排名第二，国产品牌中市场份额排名第一。"
300869.SZ,康泰医学,1916560.732760166,261639.60656846472,241,352353389.5,康泰医学B超系列、康泰医学肺功能仪系列、康泰医学分析测试仪系列、康泰医学监护系列、康泰医学模拟仪系列、康泰医学脑电系列、康泰医学输液辅助系列、康泰医学胎监系列、康泰医学胎心系列、康泰医学心电系列、康泰医学血压系列、康泰医学血氧系列、康泰医学制氧机、康泰医学组合产品,诊断治疗设备,"公司属于医疗器械行业，是一家专业从事医疗诊断、监护设备的研发、生产和销售的高新技术企业。公司自设立以来始终致力于医疗诊断、监护设备的研发、生产和销售，产品涵盖血氧类、心电类、超声类、监护类、血压类等多个大类，建立了完善的研发、生产和销售体系。公司产品凭借良好的性能和较高的品牌知名度，已经累计销售至全球130多个国家和地区。公司位于重点发展医疗器械产业的秦皇岛经济技术开发区，占地一百余亩，建筑面积超过10万平方米，是全国最大的医疗器械研发生产基地之一,拥有完整、科学的质量管理体系，企业的诚信、实力和产品质量获得业界的认可。"
300463.SZ,迈克生物,1795205.4307479667,249846.7735228216,241,956604404.94,体外诊断产品,诊断用制剂,公司一直以来专注于体外诊断产品的研究、生产、销售和服务，是体外诊断产品系统的研发、生产、销售、服务企业，拥有国际一流的诊断产品研发团队，在数名科学家的带领下，建立了临床生化、发光免疫、快速诊断、血栓与止血、分子诊断的产品技术开发平台。公司是国际临床化学与检验医学联合会(IFCC)在中国的第一家企业会员，是中国首批建立酶学参考实验室的体外诊断产品生产企业，迈克诊断产品的溯源成果达到国际先进水平。公司是经国家相关部门认证的“高新技术企业”，先后通过了CMDISO13485、CQCISO14001、TUVISO13485认证和部分产品CE认证并于2013年获得CNAS医学参考实验室认可。公司拥有国际一流的产品生产条件及生产管理水平，能向市场提供涵盖临床生化、发光免疫、快速诊断、血栓与止血等专业项目多达几百种高品质产品。
002382.SZ,蓝帆医疗,1730621.4331094355,322709.6431410788,241,1155709191.19,PVC手套,高分子聚合物,公司是中低值耗材和高值耗材完整布局的医疗器械龙头企业。主要产品为医疗手套、健康防护手套、急救包、医用敷料等为主的医疗防护产品线，主打产品PVC手套的全球市场份额占比高。高值耗材板块的主要产品为心脏支架及介入性心脏手术相关器械产品，其业务通过新加坡柏盛国际集团来运营，在全球多个国家拥有业务。公司立足自身基因，拓展产业的领域及成长模式，发展方向为“防护”+“医疗”双领域，其中健康防护领域的目标，是要由现在的全球PVC手套大王，发展成为中国健康防护领域龙头企业；医疗健康领域的目标，是通过并购，进入医疗器械领域，实现公司由低值耗材向高值耗材的跨越，进而在该领域打造平台，构建出全新的产业链条和商业生态。
300685.SZ,艾德生物,1654021.141026971,133212.7178879668,241,239573622.91,BRAF 基因V600E 突变检测试剂盒、EGFR 基因突变检测试剂盒、EGFR/ALK/ROS1 基因突变联合检测试剂盒、EML4-ALK 基因融合和 ROS1基因融合联合检测试剂盒、EML4-ALK 融合基因检测试剂盒、ERCC1 基因表达水平检测试剂盒、HER-2 基因扩增检测试剂盒、KRAS 基因突变检测试剂盒、KRAS/NRAS 基因突变检测试剂盒、KRAS/NRAS/BRAF 基因突变联合检测试剂盒、KRAS/NRAS/PIK3CA/BRAF 基因突变联合检测试剂盒、NRAS 基因突变检测试剂盒、PIK3CA 基因突变检测试剂盒、ROS1 基因融合检测试剂盒,生物诊断试剂,公司是我国首家专业化的肿瘤精准医疗分子诊断试剂研发生产企业，公司主营业务系肿瘤精准医疗分子诊断产品的研发、生产及销售，并提供相关的检测服务。公司产品主要用于检测肿瘤患者相关基因状态，为肿瘤靶向药物的选择和个体化治疗方案的制定提供科学依据。公司是我国首家专业化的肿瘤精准医疗分子诊断试剂研发生产企业，公司具有自主知识产权的核酸分子检测技术(ADx-ARMS)是目前国际上肿瘤精准医疗分子诊断领域领先的技术之一，在肿瘤相关基因突变检测方面具有敏感、特异、简便、快捷的优点，适合于各种检测样本，并可用于多重基因高通量检测，达到行业公认的国际先进水平。基于核心技术的优势，公司成功研发出20余种肿瘤精准医疗分子诊断试剂，是同行业产品种类最为齐全的企业之一。针对目前肿瘤精准医疗最重要的EGFR、KRAS、BRAF、EML4-ALK、PIK3CA、ROS1、NRAS、Her-2等基因位点，公司陆续研发了13种独立或联合检测试剂，均为我国首批取得国家药监局医疗器械注册证书和通过欧盟CE认证的产品。基于上述产品，公司同时为患者和医疗机构提供专业的肿瘤精准医疗分子检测服务。
300981.SZ,中红医疗,1495668.9169294606,207900.54620746887,241,2341903879.36,中红医疗PE手套、中红医疗PVC手套、中红医疗丁腈手套、中红医疗乳胶手套,高分子聚合物,公司主要从事高品质丁腈手套、PVC手套等医用及工业用一次性防护手套的研发、生产与销售。公司是国内最早生产销售PVC手套和丁腈手套的企业之一，自成立以来，始终专注于一次性健康防护领域，致力于为医疗、防护、食品、电子等行业客户提供性能稳定、品质卓越的防护手套产品，在国内外一次性健康防护手套市场拥有较高的知名度。公司被河北省科学技术厅认定为“河北省科技型中小企业”，被中国出口信用保险公司评为AAA+级客户。经过多年的经营积累及自主创新，公司现拥有26项专利技术，累计开发多种规格的一次性健康防护手套，可满足客户对手套性能、尺码、颜色、克重、长短等多种规格要求。公司先后通过了ISO9001国际质量体系认证、美国FDA认证、欧盟CE认证、ISO13485国际质量体系认证等，产品出口到北美、欧洲、日本等国外发达国家和地区的医疗、防护、食品、电子加工市场，远销美国、加拿大、德国、英国、法国、意大利、西班牙、荷兰、挪威、瑞典、澳大利亚、新西兰、日本等全球众多国家和地区。
300298.SZ,三诺生物,1491785.5082470125,70416.15384647303,241,107569179.71,安稳血糖仪、安准血糖仪、尿微量白蛋白检测试条、血糖/尿酸双功能检测仪、智能血糖仪,诊断用制剂、诊断治疗设备,公司是国内最早的生产血糖监测系统产品的厂商之一，也是国家生物医学工程高技术产业化示范项目的承担单位。主营业务是利用生物传感技术研发、生产、销售即时检测(POCT)产品，主要产品为微量血快速血糖测试仪及配套血糖检测试条。公司通过了德国技术集团质量体系认证与欧盟CE认证，同时公司作为国家生物医学工程高技术产业化示范项目，多次获得国家创新基金支持，并率先通过了ISO13485质量管理体系认证及欧盟CE认证。公司生产的“三诺”系列血糖仪及配套试纸，以其“准确、简单、经济”的特点，获得广大消费者的认可。
300451.SZ,创业慧康,1320807.5730046355,184005.68013559323,236,413039235.38,公共卫生信息化应用软件、医院信息化应用软件,行业专用软件,公司是国家级高新技术企业、国家规划布局内重点软件企业、国家火炬计划软件产业基地骨干企业、华东医疗行业十佳系统集成商等，是我国医疗卫生行业应用软件发展的重点企业。公司一直专注于医疗卫生行业的信息化建设业务，主要业务分为医疗卫生信息化应用软件和基于信息技术的系统集成业务。公司拥有一支由医疗卫生行业专家领衔，众多相关专业技术人员组成的团队，具有强大的技术研发能力和丰富的项目实施经验。先后承担了国家电子发展基金项目、国家高新技术产业化项目、国家火炬计划项目、国家创新基金项目等40多项国家、省、市级重大技术研发项目。
300143.SZ,盈康生命,1038557.2537411618,146571.01026970954,241,-364080340.52,第二代头部伽玛刀、第一代头部伽玛刀、体部伽玛刀、医疗服务,医疗美容器械、专业咨询服务,公司原主营鲜品食用菌的研发、生产和销售，主要产品包括金针菇、真姬菇和白玉菇等鲜品食用菌。2016年公司通过收购玛西普100%股权将进入放射外科设备领域，注入盈利能力较强，发展前景广阔的医疗器械业务。玛西普便专注于伽玛刀的研发、销售和服务，目前已成为领先的大型立体定向放射外科治疗设备供应商。玛西普自成立以来，专注于伽玛刀产品的生产、研发、销售和服务，目前生产拥有自主知识产权的伽玛刀包括：第一代头部伽玛刀、第二代头部伽玛刀和体部伽玛刀三种产品，并先后获得中国CFDA认证、美国FDA认证和欧盟CE认证等权威认证资质，已出口至多个国家，为国内大型医疗设备真正进入国际市场，特别是美国等发达国家市场并实现临床应用树立了标杆。
688277.SH,天智航-U,1033191.3230758174,87783.87308713693,241,-79933159.39,天智航多功能骨科复位器（GQ-B型）、天智航骨科机器人导航定位系统、天智航数字化手术室系统、天智航智能化全透X光手术平台（TC-6型）、天智航智能微创手术中心解决方案,医用辅助设备、诊断治疗设备、专业咨询服务,公司是国内骨科手术机器人行业的领军企业，始终专注于骨科手术机器人的研发、生产、销售和服务。以骨科手术机器人为核心产品，为医疗机构提供的产品和服务主要涵盖骨科手术机器人、手术中心专业工程、配套设备与耗材、技术服务四个方面，公司是我国骨科手术机器人产业化的先行者，创始团队成功研制出拥有我国自主知识产权的骨科手术机器人产品，是首家获得CFDA核发的第三类医疗器械注册证的“骨科机器人导航定位系统”。公司第三代产品于2016年11月获得CFDA核发的第三类医疗器械注册证，该产品各项性能指标达到国际同类产品水平，国家卫健委认定“天智航已研发生产出第三代骨科手术机器人产品，在高难骨科手术自动导航技术上成功实现从跟跑并跑迈向领跑”；公司的产品是经国家科技部认定的《创新医疗器械产品目录(2018)》中治疗设备及器械类唯一的“国际原创”产品，在国际范围内，发行人参与编制了关于手术机器人性能与安全基本要求的国际标准；在我国，发行人是“国家机器人标准化总体组”成员单位，参与编制了骨科机器人手术临床指南和诊疗规范，并参与制定了相关国家标准。
688222.SH,成都先导,964026.1045643152,68094.21086721992,241,63383837.59,DEL库定制的后续技术培训、DEL库定制服务、DEL筛选服务、化学合成服务、新药研发项目转让,专业咨询服务,公司是一家高科技创新药物研发企业，由英国皇家化学学会会士JIN LI(李进)博士归国后携国内外多位生物、化学等领域专家共同创建，公司设立至今一直围绕着DNA编码化合物库(DNA Encoded compound Library，简称DEL)技术潜心研究与创造，专注于原创新药的早期链段研发――苗头化合物和先导化合物的发现。目前，已建立合作关系的客户主要包括：全球跨国制药企业(辉瑞、强生、默沙东、赛诺菲、武田制药、勃林格殷格翰、利奥制药、LG化学等)，国际知名生物技术公司(基因泰克、Aduro、Forma等)，国内大型医药企业(扬子江药业、天士力集团、先声药业等)，支持新药研发的基金会(盖茨基金会)以及其他领域公司(巴斯夫)。
