code,name,mv_mean,amount_mean,num_days,profit,主营产品名称,主营产品类型,公司简介
300037.SZ,新宙邦,4373840.288839631,742005.5767344398,241,1306639758.89,常规锂离子电池电解液、超级电容器化学品、动力锂离子电池电解液、固态高分子电容器化学品、铝电解电容器化学品,其他化学品,公司是一家专业从事新型电子化学品的研发、生产、销售和服务的高新技术企业。主要产品铝电解电容器化学品、固态高分子电容器化学品、超级电容器电解液及锂离子电池电解液，生产规模、产品质量和技术开发能力居国内同行领先。公司产品先后通过了ISO9001:2000质量管理体系认证和ISO14001:2004环境管理体系认证，已成为国内外著名行业用户的长期合作伙伴。公司产品批量出口日本、美国、东南亚等国家和地区，逐渐成为全球电子化学品一流的供应商。“CAPCHEM”、“宙邦”被评为“广东省著名商标”；“新宙邦”被评为“深圳市知名品牌”。
000009.SZ,中国宝安,4229129.646917656,1601079.0391037343,241,1035599088.75,宝安・山水江南、北京恒丰花园出售、北京恒丰花园物业出租、北京京门大厦、布吉华浩源、达芬拉露、达芬霖、大安血液制品系列产品、肝乐宁注射液、贵阳宝安・松景阁、贵阳市西路商场、贵州骏晟商场、贵州玉田坝商场、海口宝安・江南城、海口国贸中心区宝安・滨海豪庭、红安的宝安・商业街、湖北鄂州红莲湖旅游度假区、湖北红安天台山风景区、湖北荆州宾馆、湖北武汉青龙山风景区、荆州宝安・宝安坊、荆州宝安・商业街、连云港宝安商业广场、马应龙麝香痔疮膏、马应龙麝香痔疮栓、强灵助长晶、上海宝安大酒店、上海陆家嘴宝安大厦、深圳宝安・碧海名园、深圳宝安・恒安花园、深圳宝安・世纪春城、深圳华浩源・绿谷、深圳森林王天然高级三层实木地板、斯普林注射液、天门宝安商业广场、文昌宝安・商业广场、武汉宝安・江南村、武汉宝安・山水龙城、武汉宝安・时代广场、武汉宝安创新科技园、武汉马应龙大药房、咸阳宝安购物广场、盐酸关附甲素、粤北农副产品批发市场,百货商场、大型购物中心、动物类中药制剂、度假村、酒店、开发区园区、连锁药店、旅游景点、木地板、农副产品批发市场、商业地产、五官科用制剂、物业出租和管理、消化系统用制剂、血液系统用制剂、营养补充类制剂、原料药、住宅楼盘,公司是一家综合类股份制集团公司，主营业务是高新技术产业、房地产业、生物医药业，曾连创“新中国第一家股份制企业、发行新中国第一张股票、第一张可转换债券、第一张中长期认股权证、成功策划武汉商场成为深交所第一家异地上市公司、首次通过证券二级市场收购上市公司上海延中实业、分拆马应龙并在上海证券交易所上市，成为中国境内首例分拆企业上市的上市公司、开办新中国第一个财务顾问公司安信财务，协助川盐化、甘长风等20多家国企改制上市”等多项新中国第一。公司连年获得资本市场各种荣誉：中国资本市场高峰论坛“最佳持续投资价值奖”、中国证券市场年会“金凤凰奖”、“金鼎奖”；在广东省企业联合会组织的评选活动中，中国宝安集团连续多年分别获评“推动广东发展杰出贡献企业”、“广东上市公司最具竞争力10强”“广东上市公司综合实力10强”、“广东上市公司最具投资价值10强”、“中国上市公司百佳行业领军企业”、“中国上市公司诚信示范标杆企业”等荣誉称号。
600563.SH,法拉电子,4103527.593360996,479611.0637427386,241,830619056.16,法拉变压器、法拉交流电容器、法拉金属化膜、法拉精密电容器、法拉聚丙烯膜电容器、法拉聚酯膜电容器、法拉直流电容器,变电设备、电子元器件、高分子聚合物,公司是一家专业从事薄膜电容器和薄膜电容器用金属化膜制造与研发的上市公司。公司通过了IATF16949、ISO9001、ISO14001、OHSAS18001等标准认证，拥有实力雄厚的研发中心和经验丰富的技术服务团队，年产45亿只薄膜电容器及2500吨金属化膜。公司以技术、质量和服务等竞争优势获得了客户的认可，为各类整机客户如照明、通讯、家电、工业控制、新能源汽车等提供薄膜电容器“一站式”解决方案。
002240.SZ,盛新锂能,4097439.422545075,1991629.16919917,241,850648190.52,金属锂、金属钕、锂辉石、氯化锂、氢氧化锂、碳酸锂、威华股份林木、威利邦强化木地板、威利邦三聚氢氨贴面板、威利邦水泥模板、威利邦中(高)密度纤维板、氧化镝、氧化铒、氧化钆、氧化钬、氧化镥、氧化钕、氧化镨钕、氧化铽、氧化钇,矿物类非金属矿产、木材及木材加工、木地板、人造板、重有色金属,公司致力于成为全球锂电新能源材料领先企业，主要产品为碳酸锂、氢氧化锂、氯化锂、锂精矿、金属锂和稀土产品。公司锂盐产品主要应用于新能源汽车动力电池、储能等领域；稀土产品主要应用于永磁材料、催化剂、玻璃、陶瓷、硬质合金等领域。公司目前已经成为上游在国内有资源保障、中游有优质产能、下游有一流客户的国内一线锂产品供应商。未来，公司一方面将继续聚焦新能源锂电材料领域，紧紧围绕“资源、规模、品质、客户”开展各项工作，增强资源储备、扩大产能规模、提升产品品质、服务核心客户；另一方面将通过不断加强研发和技术创新，扩大优质锂盐产能，保障战略客户的供应链安全，力争成为全球领先的锂产品供应商。
300769.SZ,德方纳米,3867849.753094988,832454.6301825726,241,800592881.91,德方纳米(挂牌终止)布袋石墨烯、德方纳米(挂牌终止)纳米磷酸铁锂、德方纳米(挂牌终止)碳纳米管、德方纳米(挂牌终止)碳纳米管导电液,催化剂及化学助剂,公司是一家致力于纳米材料制备技术开发直至产业化，集研发、生产和销售纳米材料及其应用产品为一体的企业。公司总部位于深圳市南山区，先后在广东佛山和山东肥城建立研发和生产基地。德方纳米公司自主研发的“自热蒸发液相法合成纳米磷酸铁锂正极材料”技术和生产工艺经过了国家纳米科学中心组织(以师昌绪、黄学杰为正、副组长)的专家组鉴定为国际领先水平。公司的产品有纳米磷酸铁锂、纳米磷酸铁锰锂、碳纳米管、碳纳米管导电液及多层布袋石墨烯。主产品纳米磷酸铁锂现已实现千吨级规模生产能力。德方纳米公司对其产品和技术拥有完全自主的知识产权，申请PCT专利2项，国家发明专利23项，其中已获授权13项，制定国际标准1项，国家标准3项。是全国纳米储能技术标准化工作组(TC279/WG7)挂靠单位，承担国家工信部重大科技成果转换项目；财政部、工信部、科技部联合项目新能源汽车创新工程项目；国家科技部创新基金项目；是深圳市市级工程实验室“深圳纳米电极材料工程实验室”的依托单位。
603026.SH,石大胜华,3811126.5993361,1390999.1577634856,241,1178405919.29,MTBE、环氧丙烷、混合芳烃、燃料油、液化气,成品油、高分子聚合物、液化气,公司是教育部直属全国重点大学，国家“211工程'重点建设高校--中国石油大学(华东)的校办企业，是以基本有机化工产品的生产、销售为主的国家重点高新技术企业。主要产品有碳酸二甲酯、碳酸丙烯酯、碳酸乙烯酯、碳酸甲乙酯等碳酸酯类产品，六氟磷酸锂，电解液特种添加剂和MTBE等产品。凭借独特的技术和质量优势，公司已成为国内外多家锂离子电池电解液生产厂家的高品质溶剂原料供应商，为推动新能源行业的发展贡献了智慧和力量。公司生产的MTBE作为高品质汽油添加剂，能很好地满足未来清洁能源的需求。公司自成立以来，先后获得山东省管理创新优秀企业，东营市市长质量奖、安全生产工作先进单位、外经贸工作先进企业等多项荣誉称号。公司秉承“引领绿色化工潮流，提升健康生活品质”的使命，致力于成为全球优秀的碳酸酯类产品和锂离子电池材料供应商及具有持续盈利能力和行业影响力的上市公司。
300073.SZ,当升科技,3644577.426983079,1060121.8747012448,241,1090983029.97,电子级氧化钴、多元材料ME-4、多元材料ME-5、多元材料ME-9A、钴酸锂LCO-12#、钴酸锂LCO-12B、钴酸锂LCO-18B、钴酸锂LCO-5#、钴酸锂LCO-8#、锰酸锂MSL-15R、锰酸锂MSL-15T、碳酸锰、氧化铋,重有色金属,公司是一家新能源材料研发和生产的北京市高新技术企业，国内锂电正极材料的龙头企业，主要从事钴酸锂、多元材料及锰酸锂等小型锂电、动力锂电正极材料的研发、生产和销售。公司在湿法和火法两项技术方面的集成创新能力使得公司成为国内外少数几家能快速推出系列化多元材料的公司之一，部分锂电正极材料产品的质量达到了国际先进水平。公司是国内率先出口锂电正极材料的供应商，国际前6大锂电巨头中拥有5家客户，包括三星SDI、LG化学、三洋能源、深圳比克和比亚迪等。此外，在电子陶瓷业，氧化钴、氧化铋的市场份额连续多年在国内居于领先地位。
688006.SH,杭可科技,3626345.753298755,228956.72017842325,241,235117881.75,常规软包/聚合物电池充放电设备、方形电池充放电设备、分档机、高温加压充放电设备、内阻电压自动测试设备、圆柱电池充放电设备、自动上下料机,专用设备与零部件,"公司是一家从事可充电电池设计、研发生产的高新技术企业,在充放电机、内阻测试仪等后处理系统核心设备的研发、生产方面拥有核心技术和能力，并能提供锂离子电池生产线后处理系统整体解决方案。公司依托专业技术、精细化管理和贴身服务，公司凭借自身的研发实力及自主创新能力，在产品的功能、性能、质量和安全等方面实现自主研发，公司拥有发明专利12项，实用新型专利49项,为韩国三星、韩国LG、日本索尼(现为日本村田)、宁德新能源、比亚迪、国轩高科、比克动力、天津力神等国内外知名锂离子电池制造商配套供应各类锂离子电池生产线后处理系统设备。"
002407.SZ,多氟多,3343414.3464516345,2233272.628510373,241,1259706825.21,白炭黑、低分子比冰晶石、氟硅酸钠、氟化钡、氟化钾、氟化铝、氟化镁、氟化钠、氟化氢铵、氟铝酸钾、氟硼酸钾、氟钛酸钾、高分子比冰晶石、工业氢氟酸、无水氟化氢,无机化工原料,公司产品布局高性能无机氟化物、电子化学品、锂离子电池及材料、新能源汽车生产研发四大板块，是国家高新技术企业，国家创新型试点企业，国家技术创新示范企业。公司坚持科技创新，走出一条“技术专利化、专利标准化、标准国际化”的发展路线。公司主持制、修订了数十余项国家、行业标准，拥有国家认定企业技术中心、国家认可实验室、河南省含氟精细化学品工程实验室、河南省无机氟化学工程技术研究中心等研发平台，是全国有色金属标准样品定点研制单位、全国化学标准化委员会无机分会氟化盐工作组召集单位、国际ISO/TC226氟化盐工作组召集单位。
600549.SH,厦门钨业,3234407.8242589217,886410.8607634855,241,1180534108.37,海峡国际社区、厦门钨业高性能超细晶硬质合金棒材、厦门钨业蓝色氧化钨、厦门钨业碳化钨粉、厦门钨业碳酸钴、厦门钨业钨粉、厦门钨业钨钼材、厦门钨业仲钨酸铵,重有色金属、住宅建筑,公司是国家级重点高新技术企业、国家火炬计划钨材料产业基地、国家首批发展循环经济示范企业，是国家六大稀土集团之一。公司主要从事钨精矿、钨钼中间制品、粉末产品、丝材板材、硬质合金、切削刀具、各种稀土氧化物、稀土金属、稀土发光材料、磁性材料、贮氢合金粉、锂电池材料及其他能源新材料的研发、生产和销售，兼营房地产开发与经营。钨产业经过多年的发展已形成从钨矿山、冶炼、深加工到钨二次资源回收的完整钨产业链，其中灯用钨丝占世界市场的50%以上份额，钨冶炼和粉末产品、超细晶硬质合金处于国内领先水平，在国际上也有一定的影响力。稀土产业形成了从稀土矿山开发、冶炼分离、稀土功能材料(稀土永磁材料、储能材料、发光材料等)和科研应用等较为完整的产业体系。能源新材料领域建设了锂电正极材料和镍氢电池负极材料(贮氢合金)两大产品线，其中锂电正极材料包括了钴酸锂、三元材料、锰酸锂和磷酸铁锂等产品。
688116.SH,天奈科技,3181198.4242945565,400281.7262738589,241,295883218.86,单壁碳纳米管、多壁碳纳米管、石墨烯复合导电浆料、碳纳米管导电浆料、碳纳米管导电母粒、碳纳米管粉体,半导体材料,公司是一家从事纳米级材料及相关产品的研发、生产及销售的高新技术企业。公司主要通过研发、制造与销售三元正极材料及其前驱体实现盈利。公司产品包括碳纳米管粉体、碳纳米管导电浆料、石墨烯复合导电浆料、碳纳米管导电母粒等，产品广泛应用于锂电池领域，并有望在导电塑料领域有所突破。公司目前是国内最大的碳纳米管生产企业，在碳纳米管及其相关复合材料领域处于全球领先水平。公司掌握的碳纳米管制备技术已通过技术授权的方式授予SABIC公司使用相关技术并收取技术授权费。公司的产品目前主要应用于锂电池领域，公司客户为比亚迪、ATL、CATL等锂电池生产企业。公司拥有较强的自主创新能力，在所在行业领域已经形成了丰富的产品体系和技术储备，公司的碳纳米管导电浆料在多个核心指标均处于行业领先水平。
002850.SZ,科达利,3043057.368569979,435498.4167095436,241,541611743.45,动力电池结构件、锂电池结构件、汽车结构件,电子元器件,公司系以锂电池精密结构件业务为核心、汽车结构件业务为重要构成的国内领先精密结构件产品研发及制造商。凭借着强大的技术优势和深厚的优质客户资源积累，公司成功先发进入新能源汽车动力锂电池精密结构件领域，并已占据了有利的市场地位。公司产品主要分为便携式锂电池精密结构件、动力及储能锂电池精密结构件、汽车结构件三大类，广泛应用于便携式通讯及电子产品、汽车及新能源汽车、电动工具、储能电站等众多行业领域。
002192.SZ,融捷股份,2970818.608641208,1358827.8779170124,241,68289424.55,单水氢氧化锂、电池级碳酸锂、电子书包、动力电池全自动分组机、动力电池全自动极耳焊接机、动力电池全自动卷绕机、动力电池全自动注液机、工业级碳酸锂、聚合物电池高柔性全自动抽气机、聚合物电池高柔性全自动夹具化成机、聚合物电池全自动包装机、锂电池系统、锂精矿、锂矿、锂盐,电子设备及加工、轻有色金属、无机化工原料、系统集成服务、专用设备与零部件,公司从事新能源材料和光电显示材料。公司新能源材料产业以锂产业链为主体，最上游是锂矿资源的采选，中游是锂盐及深加工，下游应用端分化为锂电池等行业；光电显示材料产业主要包括智能电子书包、柔性电子显示屏及模组等。智能电子书包属于国家数字化教育的一部分，终端使用者是全国在校的中小学生，目前还处于推广应用阶段。智能电子书包从材料到应用是个系统工程，柔性电子显示屏及模组属于电子书包的上游，主要包括显示材料、柔性基板以及显示技术等方面。公司涉足新能源锂产业锂矿采选业务、锂电设备生产装备业务领域、锂业及深加工业务、锂离子电池正极材料领域等。公司的愿景是“打造成为国内新能源材料和光电显示材料的高科技领军企业”。
300568.SZ,星源材质,2946095.843317847,950374.4526431536,241,282895244.91,SD系列干法隔膜、SH系列陶瓷涂覆隔膜、SJ系列聚合物涂覆隔膜、SQ高强度系列干法隔膜、SW系列湿法隔膜,无机化工原料,"公司是中国战略新兴产业新能源材料领域的国家级高新技术企业，是全球第一家提出“动力锂电池隔膜”概念的国家火炬计划重点高新技术企业，是中国第一家打破国外垄断的锂电池隔膜干法单拉技术的企业，是中国第一家产品批量出口海外市场的锂电池隔膜制造企业，是中国第一家同时拥有锂电池隔膜干法、湿法和涂覆制备技术的企业，是中国拥有隔膜制备专利技术最多的锂电池隔膜企业，是中国第一家以隔膜为主营业务登陆资本市场的企业。公司专业从事锂离子电池隔膜研发,生产及销售的新能源,新材料和新能源汽车领域的国家级高新技术企业.公司锂离子电池隔膜包括单层隔膜,双层隔膜和多层隔膜等规格较为齐全的产品系列。公司先后完成了ISO9001质量管理体系认证、ISO14001环境管理体系认证、汽车行业ISO/TS16949质量标准体系认证，并正在建立德国汽车工业协会VDA6.3的过程审核标准以及日本索尼有害物质管理体系(GP),持续打造国际一流品质。"
600699.SH,均胜电子,2686191.5839763647,845632.4707302905,241,-3753291036.22,48V轻混系统BMS产品、被动安全、车身清洗系统、传感器系统、电子控制单元、发动机进气系统、方向盘总成、加油小门、驾驶员控制系统、空气管理系统、空调控制系统、汽车电器集成系统、汽车风窗洗涤系统、汽车内外后视镜、汽车内外饰塑料功能件、汽车视镜视觉系统、前散热格栅、无线充电技术、新能源车BMS解决方案、智能车联电子系统、主动安全（无人驾驶）,车身及外观设备、电子元器件、系统集成服务、专业咨询服务,公司是一家全球化的汽车零部件顶级供应商，主要致力于智能驾驶系统、汽车安全系统、新能源汽车动力管理系统以及高端汽车功能件总成等的研发与制造。2011年至今，公司先后收购了汽车电子公司德国PREH、德国机器人公司IMA、德国QUIN、汽车安全系统全球供应商美国KSS以及智能车联领域的德国TS。通过企业创新产品升级和多次国际并购，公司实现了全球化和转型升级的战略目标。凭靠领先的创新设计、生产制造、品质管理及优秀服务，公司成为宝马、奔驰、奥迪、大众、通用和福特等全球汽车制造商的长期合作伙伴，并屡获保时捷、大众、通用等汽车制造商优秀供应商奖。
300001.SZ,特锐德,2685793.6606416097,568966.9208962655,241,187174232.5,10/0.4kV智能箱式变电站、10kV智能箱式环网柜、10kV智能箱式开闭所、35/10kV移动箱式变电站、35/10kV智能箱式变电站、电缆分接箱、户内10kV高压开关柜、户内35kV高压开关柜、户外箱式变电站、户外箱式开关站、配电防火墙、牵引供电智能箱式分区所、铁路电力远动箱变、铁路客运专线电力远动箱变、箱式开关站,变电设备,公司是中国最大的户外箱式电力产品系统集成商、中国最大的箱变研发生产企业之一，先后承担了多项国家重点研发专项，是科技部“安全可控、能源互联、开放互通的智能充电网研究与应用示范”重点项目，是工信部第一批制造业单项冠军培育企业、第一批绿色制造体系建设“绿色工厂”示范企业。公司自成立以来一直专注于箱式电力设备的研发与制造，基于在箱式电力设备的技术积累和创新延伸，成功开拓了新能源汽车充电网和新能源微网两个全新业务板块。在新能源汽车充电领域，公司不断通过技术和商业模式创新引领行业发展，成为中国规模最大的汽车充电运营公司，公司首创了世界领先的汽车群智能充电系统。在新能源微网领域，公司于2017年成功研发了新能源微网系统，成为国内极少数拥有相关技术和产品的企业，也是国内唯一一家将电动汽车充放电融入微电网的企业，产品获得业内专家的高度认可，综合技术性能达到国际领先水平。同时，公司还是中国电力产品技术标准的参与者和制定者、中国杰出的箱式电力产品系统集成商、电力系统集成解决方案的专家，多款产品被鉴定为“产品国际首创、技术水平世界领先”。
688388.SH,嘉元科技,2587349.022900237,539481.8667842323,241,549959098.02,嘉元科技6～18μm各类高性能超薄电解铜箔、嘉元科技极薄铜箔双面光6μm、嘉元科技极薄铜箔双面光7-8μm,铜,"公司是一家从事各类高性能电解铜箔的研究生产和销售的高新技术企业，主要产品为超薄锂电铜箔和极薄锂电铜箔，主要用于锂离子电池的负极集流体，是锂离子电池行业重要基础材料。最终应用在新能源汽车、3C数码产品、储能系统、通讯设备、汽车电子等终端应用领域。同时，公司生产少量PCB用标准铜箔产品,公司是国内高性能锂电铜箔行业领先企业之一，已与宁德时代、宁德新能源、比亚迪等知名电池厂商建立了长期合作关系，并成为其锂电铜箔的核心供应商，并于2018年度荣获宁德时代锂电铜箔优秀供应商称号。先后获评为高新技术企业、国家知识产权优势企业、广东省创新型企业、广东省战略性新兴产业骨干企业，是GB/T31471-2015《印制电路用金属箔通用规范》国家标准主导起草单位,公司被中国电子信息材料行业协会电子铜箔分会认定为“国内锂离子动力电池用电子铜箔细分行业的骨干企业”、“高成长性电子铜箔制造企业”。公司荣获“创新驱动发展先进企业”、“最具投资价值企业”和“梅州市政府质量奖”等荣誉。"
600066.SH,宇通客车,2521590.834618178,187674.60873443983,241,613785285.74,新能源客车、宇通城市客车、宇通公交车、宇通莱茵系列客车、宇通旅游车、宇通前置车、宇通学生接送车,客车,公司是一家集客车产品研发、制造与销售为一体的大型现代化制造企业，拥有底盘车架电泳、车身电泳、机器人喷涂等国际先进的客车电泳涂装生产线，是目前世界单厂规模最大、工艺技术条件最先进的大中型客车生产基地，主要经济指标连续十余年快速增长，并连续十余年获得中国工商银行AAA级信用等级。照国家纯电驱动的技术转型战略，坚持电动化、智能化、网联化的产业发展方向，开发插电式、纯电动、燃料电池三大动力系统，重点突破系统集成、车载能源、电驱动系统、整车控制、电附件等共性核心技术，自主研发的新能源客车综合技术处于国际先进水平，其中整车节能与控制技术、高压隔离电源变换技术、高密度电驱动控制技术等方面处于国际领先水平。
300618.SZ,寒锐钴业,2444138.250760705,827871.3986058092,241,663166173.38,电解铜、钴粉、钴精矿、钴盐（碳酸钴、草酸钴）、钴中间品、氢氧化钴,有色金属矿产,公司是拥有三家实业公司、两家国际贸易公司的跨国企业集团。业务涵盖钴铜矿开采、冶炼、钴粉及其他钴基粉体研发、生产和销售，具有自主研发和创新能力，并持有自主品牌的高新技术企业。公司积极践行“走出去”的国家战略，在非洲刚果(金)投资设立了迈特矿业子公司，从事钴、铜矿资源的开发和产品深加工，形成了从矿产开发、冶炼，直至钴中间产品和钴粉生产的完整产业链。公司在包括韩国、日本、德国、瑞士、以色列、印度、美国等多个国家和地区建立了营销网络，自主商标在全球多个主要工业国家注册，已经成为中国和世界钴粉产品的主要供应商之一。
