code,name,mv_mean,amount_mean,num_days,profit,主营产品名称,主营产品类型,公司简介
002472.SZ,双环传动,1679187.5358740208,351488.9072074689,241,326329133.99,电动工具及工业缝纫机齿轮、轿车齿轮、轿工程机械齿轮、卡车齿轮、摩托车齿轮,传动设备,公司始终专注于机械传动齿轮的研发、设计、制造与销售，形成涵盖传统汽车、电动汽车、高铁轨道交通、非道路机械、摩托车及沙滩车、电动工具及工业机器人等多个领域门类齐全的产品结构，已经成为全球具有相当生产规模和实力的主要齿轮散件专业制造企业之一。公司与众多国内外优质客户建立起深厚的技术与产品合作关系，形成一批本行业“巨头”客户群，如博世、采埃孚、利勃海尔、卡特彼勒、康明斯、博格华纳、伊顿、西门子等以及国内的比亚迪、上汽、玉柴集团等。
603876.SH,鼎胜新材,1649406.78079783,339790.0401286307,241,430047928.99,PS版基、单零箔、电池箔、电池外壳、高铁隔音板、空调箔、铝箔毛料、普板带、钎焊箔、双零箔,专用设备与零部件,公司主导产品为铝板、带、箔及涂层材，以及深加工产品氧化铝板、电缆箔、空调箔、装饰建材用铝箔、空调冰箱用蒸发器、冷凝器等多种系列铝产品。广泛用于绿色包装、家用、家电、电子通讯、交通运输、印刷、化工、建材、装饰等行业。公司主要生产、检测设备从意大利、日本、德国等国引进，采用国内外先进的技术、工艺组织生产，通过严格的检测保证质量，能满足客户对产品厚度、精度及性能的需求。公司已于2001年通过了ISO9002认证，目前正在实施ERP管理。
002249.SZ,大洋电机,1613546.7742723315,630638.902539419,241,250385655.69,Y5S(L)空调用风机负载类电机、Y6S(L)柜式空调用风机负载类电机、Y7S(L)中央空调用风机负载类电机、大洋电机风机负载类电机、大洋电机高效节能智能电机、大洋电机洗衣机电机、大洋电机直流无刷电机,动力机械,公司致力于成为全球电机及驱动系统行业领袖，为全球客户提供安全、环保、高效的驱动系统解决方案，是一家拥有“建筑及家居电器电机、新能源汽车动力总成系统、氢燃料电池系统及氢能发动机系统以及车辆旋转电器”等产品，集“高度自主研发、精益制造、智慧营销”为一体的高新技术企业。公司在发展过程中荣获“国家火炬计划项目”、“省知识产权示范企业”、“省创新型企业”和“出口产品免验企业”等荣誉上百项，自有品牌“大洋电机”成为广东省著名商标及出口品牌，同时通过并购，公司拥有了百年国际品牌“佩特来”的永久免费使用权以及“上海电驱动”、“杰诺瑞”等多个行业知名品牌。通过开展氢燃料电池模组生产及氢能储运等一系列的业务拓展，公司已初步形成新能源汽车产业链完善的产业战略布局。在全球新能源汽车及氢燃料电池产业链的精准布局，有效提升了大洋电机在全球新能源汽车行业及氢燃料电池行业的重要性。
300438.SZ,鹏辉能源,1552179.3712685443,695455.9552911393,237,182431718.4,锂离子电池、锂锰电池、锂铁电池、镍氢电池,电子设备及加工,公司是中国较大的电池生产厂家之一，主营绿色高性能电池的研发、生产及销售。主要生产聚合物锂离子、锂离子、镍氢等二次充电电池，锂铁、锂锰、锂亚硫酰氯、锌空等一次电池，产品广泛应用于移动电源、航模、新能源汽车动力电池、汽车启动电源、通信基站后备电源、风光储能及家庭储能电池系统解决方案，并实现规模化生产，拥有自主知识产权，主要技术指标处于国内、国际先进水平。公司拥有较强的技术研发能力、高效的品质管控能力、生产技术与规模优势。公司通过多年对电芯材料体系的深入理解，持续技术创新和改造，导入新材料、新工艺、新设备，开发新产品，不断强化公司的市场竞争力，先后成立了“博士后科研工作站”、“广州市鹏辉二次电池工程技术研究开发中心”，多次被评为“国家火炬计划重点高新技术企业”、“高新技术企业”、“广东省省级企业技术中心”、“广东省战略性新兴产业骨干企业”。公司拥有各项专利，均已转化入公司的核心产品。未来，公司将继续坚持“以工业品发展为主，辅以民用品牌市场建设”的发展思路，立足国内、面向世界，全力打造成为具有国际竞争力的国内专业的电池制造企业。
601311.SH,骆驼股份,1527104.722898137,338440.795593361,241,831789107.64,纯铅薄极板卷绕式蓄电池、电动车电池、阀控密封式电池、干式电池、锂离子电池、免维护电池、摩托车电池、牵引用铅酸蓄电池,低压电器类,公司为一家专业从事先进电池研发、生产、销售、回收的综合性高新技术企业。多年来，公司面向市场，奋力拼搏，已成长为一个大型企业集团，逐渐发展壮大为国内最大的蓄电池制造公司之一。主要从事蓄电池的制造和销售，主要产品是用于汽车起动、电动道路车辆牵引、电动助力车动力用的铅酸蓄电池。公司拥有省级技术中心和研发中心，多项产品与技术为行业内首创，在技术上处于领先地位。公司已建立了完善的销售与服务网络，已成为东风汽车、神龙汽车、一汽大众、上海大众、福特、通用、北京现代、江淮汽车、重庆长安等家国内汽车生产厂商的主要供应商之一。在出口市场方面，公司海外市场的拓展和销售已初见成效，产品出口至俄罗斯、澳大利亚、意大利、沙特及南非等40多个国家。公司是国家重点支持的高新技术企业，“骆驼”商标已被国家工商总局认定为“驰名商标”。另外，公司还先后获得“国家权威检测合格产品证书”、“中国电器工业最具影响力品牌”、“中国市场品牌质量信誉竞争力调查”十佳品牌、“全国守合同重信用企业”、“质量信誉AAA等级”等多项荣誉或称号。
600006.SH,东风汽车,1419095.4356846474,390588.126307054,241,371747475.83,东风多利卡轻卡、东风福瑞卡系列、东风后置底盘、东风金霸轻卡、东风金刚轻卡、东风康明斯发动机、东风力拓系列、东风皮卡轻卡、东风前置底盘、东风日产帕拉丁SUV、东风日产皮卡、东风洒水车、东风吸粪车、东风小霸王轻卡、东风油罐车、东风御风系列、东风之星轻卡、新能源乘用车、新能源物客车、新能源物流车,发动机设备、行驶底盘设备、轿车、客车、轻型卡车、商务车、重型卡车与专用车,公司作为东风汽车集团有限公司轻型商用车事业的承担者，主营业务为全系列轻型商用车整车和动力总成的设计、制造和销售。事业单元涉及轻卡事业、工程车事业、客车事业、新能源事业和发动机事业。公司涵盖全系列汽车品种从轻卡、工程车、特种车、皮卡到SUV、MPV、客车、轻型客车及底盘等，从传统汽车到新能源汽车，多方位满足全国客户的不同货物运输类型需要和行业集团客户的差异化需求。公司立足客户和市场的需求进行商品规划，以客户为中心研发和投放市场，打造工特事业的黄金车型，在市场上奠定了坚实的基础。
600577.SH,精达股份,1392935.0561526264,457453.40711618256,241,549139404.49,精达股份HFC134a压缩机用漆包铜圆线、精达股份HFC空调压缩机多层复合漆包铜圆线、精达股份变频电机用抗电晕漆包线铜圆线、精达股份家电销售、精达股份聚酯亚胺复合聚酯胺酰亚胺漆包铜圆线、精达股份聚酯亚胺漆包铜圆线、精达股份拉丝模具、精达股份软圆铜线、精达股份硬圆铜线、精达股份直焊性聚氨酯微细漆包铜圆线,家电零售与连锁、输电设备、冶金机械,公司为国家重点高新技术企业，是特种电磁线行业的龙头企业、位列全球前三位的特种电磁线制造商。公司在质量、品牌、技术、规模、战略布局等方面具有明显的优势。主要生产设备、检测仪器从意大利、德国、奥地利、美国、丹麦等国家和中国台湾地区引进，自动化程度高，具有当代国际先进水平。公司主要产品广泛适用于家用电器、电子材料、电力设备、通讯仪器、汽车电机、电动工具等行业产品配套。形成了安徽、广东、天津、江苏四大生产基地，产品覆盖长三角、珠三角和环渤海地区，并有部分产品销往欧美、南亚地区。公司是电磁线行业国家标准起草单位，并参与了电线电缆行业“十二五”规划的编制工作。公司通过了ISO9001标准认证、TS16949、ISO14001环境管理体系认证、OHSAS18001职业健康安全管理体系等管理认证。
603179.SH,新泉股份,1323250.5403046017,124971.92773858922,241,284014410.9,保险杠总成、乘用车仪表板总成、顶置文件柜总成、立柱护板总成、流水槽盖板总成、门内护板总成、商用车仪表板总成,汽车及零配件经销,公司专业从事汽车内、外饰件系统零部件及模具的设计、制造及销售；自营和代理各类商品及技术的进出口业务。公司是全国百家优秀汽车零部件供应商之一，是众多汽车品牌的一级配套商，与合资广菲克、上海大众、一汽大众，自主上海汽车、吉利汽车、奇瑞汽车、宝沃汽车及北汽等乘用车配套；和一汽解放、东风、福田戴姆勒、中国重汽、陕重汽等大中型商用车汽车企业也建立了长期稳定的合作关系。　　公司恪守“追求卓越、超越期望”的质量方针，竭力为客户提供优质的产品和服务。2002年通过QS9000认证，2005通过TSl6949认证，2010年通过国家环境体系ISO14000认证，2009年新泉实验室通过国家CNAS认证。
000970.SZ,中科三环,1295195.7535767916,520745.0073148936,235,398881468.51,SANMAG烧结钕铁硼磁体、SANMAG粘结钕铁硼磁体、大陆鸽电动自行车、中科三环软磁铁氧体,磁性材料、自行车及配件,公司是目前中国稀土永磁材料产业的代表企业，全球最大的钕铁硼永磁体制造商之一。公司主要从事磁性材料及其应用产品研发、生产和销售，以烧结钕铁硼磁体、粘结钕铁硼磁体、软磁铁氧体和电动自行车为主要产品。公司有NEOMAX和麦格昆磁的钕铁硼专利许可，其专利产品通过北京中科三环国际贸易公司以“SANMAG”商标远销世界各地。公司还参股上游原料企业，确保了稀土原材料的稳定供应；在下游产业生产由钕铁硼稀土永磁电机驱动的绿色环保电动自行车。公司的主打产品钕铁硼广泛应用于能源、交通、机械、信息、家电、消费电子等方方面面，尤其是近年来全球节能环保产业的快速发展，推动了在混合动力汽车、电动汽车、节能家电、机器人、风力发电等新兴领域的应用。公司是中国稀土永磁产业的代表企业，全球最大的钕铁硼永磁体制造商之一。
300655.SZ,晶瑞电材,1291778.4975450663,643648.0440165976,241,200996573.6,超净高纯试剂、功能性材料、光刻胶、锂电池粘结剂、食品级消毒剂过氧乙酸,有机化工原料,苏州晶瑞化学股份有限公司(SCCC)2001.11.29注册成立，位于苏州市吴中经济开发区澄湖东路，是一家生产销售微电子业用超纯化学材料和其他精细化工产品的上市企业。品种包括氢氟酸、过氧化氢、氨水、盐酸、硫酸、硝酸、异丙醇、冰醋酸、混合酸(硅腐蚀液、铝腐蚀液、铬腐蚀液、BOE、金蚀刻液)氢氧化钾、氢氧化钠、配套试剂等。目前主要产品的纯度为，单项金属杂质含量小于0.1ppb。产品广泛应用于超大规模集成电路、LED、TFT-LCD面板制造过程、太阳能硅片的蚀刻与清洗。
000049.SZ,德赛电池,1286157.9461853693,499198.377219917,241,793765412.59,德赛锂聚合物电池、德赛镍氢电池、德赛燃料电池、德赛无汞碱锰电池、德赛锌空气电池、德赛一次锂电池,低压电器类,公司为控股型企业，主要围绕锂电池产业链进行业务布局，其中惠州电池主营中小型锂电池封装集成业务，惠州蓝微主营中小型移动电源管理系统业务，二级子公司惠州市蓝微新源技术有限公司主营大型动力电池、储能电池等电源管理系统及封装集成业务。公司已经成为全球中小型移动电源领域的领导厂商之一，与全球主要电芯厂开展合作，服务于全球顶级消费电子厂商。作为国内锂电池制造领域的先行者，经过多年的发展，尤其是近年来，通过持续加大研发投入、打造高效制造平台、搭建品质控制预防体系、优化业务结构等举措，公司积累了雄厚的技术优势，品质保证及技术开发能力处于国际领先地位，拥有了优质的高端客户资源、先进的自动化水平和领先的制造水平，具有较强的综合竞争优势。在智能手机、电动工具等中小型移动电源管理系统暨封装领域处于全球领先地位。公司的电池产品获得了“国家免检产品”、“中国名牌产品”、“广东省名牌产品”等称号。
600869.SH,远东股份,1237081.9549124895,198792.6234605809,241,530897516.25,储能电池组、储能电芯、电线电缆、裸导线、智能设备,专用设备与零部件,公司致力于成为全球领先的智慧能源、智慧城市服务商，主营智慧能源和智慧城市技术、产品与服务及其互联网、物联网应用的研发、制造与销售；智慧能源和智慧城市项目规划设计、投资建设及能效管理与服务；智慧能源和智慧城市工程总承包；包括智能分布式电源技术和产品、数码电芯、高性能动力锂电池组、新能源汽车等。公司拥有博士后科研工作站、院士专家工作站、江苏省企业研究生工作站、国家级企业技术中心、国家级认可实验室、江西省锂电池工程研究中心等科研基地。公司以“创造价值，服务社会”为使命，秉持“诚信务实、创新创优、和灵共赢”的价值理念，致力成为备受员工热爱、备受社会尊敬的全球领先的智慧能源、智慧城市服务商。
002239.SZ,奥特佳,1168554.0855642352,234470.1455042017,238,-133914415.88,汽车空调系统、汽车空调压缩机,汽车及零配件经销,公司主要从事各类汽车空调压缩机及汽车空调系统的研发、生产和销售，是国内最大的汽车空调压缩机生产企业，产品主要销往国内外知名整车制造厂。南京奥特佳和富通空调是国内汽车空调压缩机行业的领先企业。南京奥特佳是中国汽车工业协会认定的“中国汽车零部件(空调)行业龙头企业”，是全球最大的涡旋式汽车空调压缩机生产企业，并连续多年获得“全国百佳优秀汽车零部件供应商”称号，奥特佳商标被评定为“中国驰名商标”。
300080.SZ,易成新能,1168062.4685651371,126835.00430705394,241,-185266807.92,白刚玉微粉、高级耐火材料专用微粉、工程陶瓷专用微粉、黑碳化硅微粉、晶片研磨、抛光专用微粉、绿碳化硅微粉、太阳能、半导体切割刃料、涂附、固结磨具专用微粉、棕刚玉微粉,半导体材料,公司是一家专业从事太阳能晶硅片、半导体线切割刃料研发、生产、销售的高新技术企业，太阳能光伏行业重要的功能性材料供应商。公司产品占有率一直位居国内晶硅片切割刃料生产企业前列，主导产品太阳能晶硅片切割刃料、半导体晶圆片切割刃料是太阳能光伏产业、半导体芯片制备产业的专用切割材料，还广泛应用于工程陶瓷、研磨材料等领域。公司提供晶硅片切割废砂浆的回收再利用服务，是河南省第一批资源综合利用型企业。“晶硅电池片切磨专用刃料”被认定为“高新技术产品”，“新大新”品牌的切割刃料在业内具有较高的知名度和产品美誉度。
000413.SZ,东旭光电,1148574.4711589047,124751.31707053944,241,-2800338882.78,TFT-LCD液晶玻璃基板、宝石L-35玻管、宝石彩色显示器玻壳、宝石彩色显像管玻壳、宝石电真空玻璃管、宝石销钉、宝石阳极帽,半导体材料、半导体分立器件、电子设备及加工、电子元器件,公司是国内领先的集液晶玻璃基板装备制造、技术研发及生产销售于一体的高新技术企业，也是全球领先的光电显示材料供应商。，公司从光电显示产业起步，逐渐发展成为集液晶玻璃基板、盖板玻璃、偏光片、彩色滤光片、蓝宝石等光电显示材料、高端装备制造及系统集成、石墨烯产业化应用、新能源汽车研发及制造、智慧城市建设等业务为一体的综合性高新技术企业，产业上下游纵向布局及横向联动不断深化，逐渐形成了具有综合竞争力的新兴产业集群。
300224.SZ,正海磁材,1119816.819172946,415551.7500788381,241,265041297.54,高性能钕铁硼磁性材料、新能源汽车驱动电机、新能源汽车驱动电机控制系统,磁性材料、发电机及附属设备,公司是国内新能源和节能环保领域高性能钕铁硼永磁材料的主要供应商，国内高性能钕铁硼永磁材料的龙头企业。公司秉承“高性能钕铁硼永磁材料+新能源汽车电机驱动系统”的双主营业务的发展模式。公司控股子公司上海大郡是国内专业从事新能源汽车驱动电机及其控制系统的研发、生产和销售的高新技术企业。公司是国家发改委、科技部、财政部、海关总署以及国家税务总局的联合认定的国家级企业技术中心。
300068.SZ,南都电源,1052851.970694349,456004.58760995854,241,-1370219224.42,“Narada南都”Acme中密系列电池、“Narada南都”GEL2V/12V聚合物胶体电池、“Narada南都”LSA大密系列电池、“Narada南都”LSE(EOS)大密系列电池、“Narada南都”MP中密系列电池,低压电器类,公司是国家高新技术企业，一直专注于高端工业电池及新能源领域。公司提供以先进阀控密封电池、锂离子电池、燃料电池为核心的系统化产品、解决方案及运营服务，主营业务包含通信及数据、智慧储能、新能源动力全系列产品和系统的研发、制造、销售、服务及环保型资源再生，已形成“原材料－产品应用－系统解决方案－运营服务－资源再生－原材料”的全封闭产业链，并成为储能及资源再生等多个领域的领导者。目前公司已建有国家企业技术中心、国家认可实验室、国家级博士后科研工作站、院士专家工作站等，配备了国际最先进的研发试验和综合测试设备，拥有以院士为首，国内外教授、专家作为技术带头人的具有丰富理论与实践经验的研发团队。“Narada南都”为浙江省著名商标及浙江省出口名牌，在国内同行中享有较高的知名度和美誉度，是国内同行中海外市场知名度最高的企业。公司在成为中国市场通信电源主要供应商的同时，产品远销欧美、东南亚、非洲等几十个国家和地区。
300082.SZ,奥克股份,1022393.5994489628,366386.1904190871,241,352237905.21,甲基烯基聚氧乙烯、晶硅切割液系列产品、聚氧丙烯醚、聚乙二醇单甲醚、聚乙二醇系列产品、烯丙基聚氧乙烯醚,无机化工原料,"公司是国家首批创新型企业、国家级企业技术中心、国家重点高新技术企业、国家博士后科研工作站和全国模范劳动关系和谐企业。公司自创立以来始终坚持“共同创造、共同分享”和“立足环氧创造价值”的发展战略与“大趋势、大市场、少竞争”的开发经营策略,始终致力于环氧乙烷衍生精细化工新材料的技术创新和产业发展。奥克已经发展成为国内环氧乙烷精深加工规模最大和最具竞争力的龙头企业，成为了全球最大的高性能混凝土减水剂聚醚的制造商和太阳能电池硅切割液的制造商。"
002108.SZ,沧州明珠,1017116.4474121328,452522.6340539419,241,365966108.96,沧州明珠给排水塑料管件、沧州明珠工程服务、沧州明珠聚酰胺薄膜、沧州明珠排污双壁波纹管、沧州明珠燃气塑料管件、沧州明珠通信塑料管件、沧州明珠土木格栅、沧州明珠压力塑料管件、沧洲明珠硅胶管管材、沧洲明珠聚酰亚胺保鲜膜,高分子聚合物、构筑物、塑胶机械,公司是由河北沧州东塑集团股份公司与钜鸿(香港)有限公司共同出资兴建的股份制企业，属中外合资企业。公司所处行业为橡胶和塑料制品业，主要产品是PE管道、BOPA薄膜和锂离子电池隔膜产品。目前，公司在PE管道产品和BOPA薄膜产品方面凭借其规模和技术优势已成为细分行业的领军企业，在锂离子电池隔膜产品方面随着生产技术和生产工艺的不断提高和完善，以及生产规模的不断扩大，也已经确立了在锂离子电池隔膜行业的领先地位。公司产品“陆通”、“东鸿”商标品牌在行业内拥有较高的知名度，其中“陆通”商标被评为中国驰名商标。企业通过了99001国际质量体系认证、1914001环境言理体系认证、OHSAS18000职业健康安全理体系认证和rs16949质量管理体系。
300116.SZ,保力新,1005947.8508232904,284925.1725767635,241,-133322924.74,离网储能储电系统、锂离子单体电池（电芯）、锂离子动力电池组、消防工程、新能源汽车租售及运营,出租汽车、公共服务、专用设备与零部件,公司是国内最早成功研发磷酸铁锂新能源汽车动力电池、汽车启动电源、储能系统解决方案并率先实现规模化生产和批量应用的动力锂电池企业之一，被中国化学与物理电源行业协会确认为中国动力锂离子电池20强企业前三强。公司主要业务是锂离子动力电池、新能源汽车租售及运营以及消防工程，主要产品为32650型圆柱锂电池、电池管理系统(BMS)、动力电池组及储能电池组。产品主要应用领域包括：纯电动大巴车、通勤车、城市物流车、移动补电车。此外，产品也应用于启动电源、储能应用、通信基站和家用电动工具等领域。公司根据公司战略发展需要，整合研发团队成立沃特玛技术研发中心，依托公司强大的资本实力和产业化能力，通过产学研合作，组织专职科研队伍开展工程化技术研发，实现基础研究与产业化的无缝对接。
000550.SZ,江铃汽车,937278.2186721992,135570.01321991702,241,574165944.0,江铃JMC轻型卡车、江铃宝典皮卡、江铃汽车宝典皮卡车、江铃汽车宝威皮卡车、江铃汽车车架、江铃汽车车桥、江铃汽车车身覆盖件、江铃汽车发动机、江铃汽车缸体、江铃汽车凯运卡车、江铃汽车轻卡、江铃汽车全顺商务车、江铃汽车运霸、江铃汽车铸件,车身及外观设备、发动机设备、行驶底盘设备、客车、轻型卡车,公司是一家集汽车研发、制造和销售的现代化中外合资股份制企业，是依托轻型商用车市场领导地位及领先技术，为智慧物流领域提供优秀产品及解决方案的中国汽车行业先锋，是国家高新技术企业、国家创新型试点企业、国家认定企业技术中心、国家级工业设计中心、国家知识产权示范企业、国家整车出口基地，连续多年位列全球最具价值的汽车品牌100强。依托福特汽车先进技术及管理经验支持，公司在业内的影响力稳步提升，无论在产品研发还是技术设备等方面都取得了长足的进步。公司首批中国自主研发的全球卫星定位系统北斗系统的车联网产品认证示范企业，发明专利“一种分析整车和零部件RE值关系的方法”获得第十九届中国专利优秀奖，公司首款JMC品牌重卡“江铃威龙”荣获“2018中国年度卡车”大奖及“最具潜力重卡”奖，充分展示公司在商用车领域的技术领先水平和自主创新能力。在持续巩固传统优势的同时，顺应国际国内行业发展新态势，公司不断开拓新的业务领域、创新业务模式。
