code,name,mv_mean,amount_mean,num_days,profit,主营产品名称,主营产品类型,公司简介
002045.SZ,国光电器,547002.4443223071,274410.5841286307,241,40136849.48,国光电子零配件、国光扬声器、国光音箱,电声器件、其他消费电子产品,公司是全球知名的电声制造厂商，成立至今一直从事电声、电子产品的设计、生产、销售，目前产品覆盖了电声配件、扬声器单元、音响系统、数字功放、聚合物锂电池等。公司具有从扬声器关键零部件，到扬声器单元、音箱系统及电子功放一体化的综合配套能力，多年的历史积淀凝聚了一批优秀的电声行业管理及研发人才，形成了自己独特、有效的科研攻关体系，建立了一支技术专业齐全、综合实力雄厚的研发队伍。在质量管理系统方面公司采用国际标准，通过了ISO/TS16949质量体系及ISO14001环境管理体系认证，公司检测中心还通过了CNAS的ISO/IEC17025认可，在生产中采用与国际同步的工艺、设备及控制流程，产品各项质量指标得到可靠保证，公司从设计到采购、进料检验、仓储物流、生产、成品检验、销售和售后服务形成了全过程质量控制系统。
300510.SZ,金冠股份,546376.0072676764,241896.81306639005,241,31614083.91,C-GIS智能环网柜、充电站系统运营、充电桩、固体绝缘环网柜、锂电池隔膜生产业务、锂电池隔膜销售业务、锂电池隔膜研发业务、真空断路器、智能电表、智能高压开关柜、智能用电信息采集系统,电气仪器仪表、输电设备、系统集成服务、专用设备与零部件,公司是聚焦“智能电网+新能源”领域的高新技术企业，覆盖智能电网设备、新能源汽车充电设施、锂电池隔膜等三大业务板块。在智能电网设备行业，公司是国内坚强智能电网、泛在电力物联网的主流供应商。核心产品包括智能电气成套开关设备及其配套元器件、智能电表、用电信息采集系统等，主要服务国家电网、南方电网、轨道交通、城市公共基础设施等领域的客户。新能源充电设施业务包括充电桩运营与充电桩设备制造销售业务。其中，充电桩运营业务方面，公司致力于成为全国领先的“新能源集中式快充网运营商”，重点面向公交、物流、工业园区、大型居民小区等提供大功率直流快速充电服务。锂电池隔膜业务板块，子公司辽源鸿图是国内主流的中高端锂电池隔膜供应商，已经研发出20余种规格产品，覆盖5微米厚度至20微米厚度的高低孔隙率的产品以及涂覆2-4微米的单双面涂覆产品，其中，单双面涂覆技术方面处于国内领先地位，产品广泛应用在3C消费类电池、动力电池等产品中。
600468.SH,百利电气,522183.9506123403,54608.813755186726,241,104714052.41,百利观光梯、百利双电源自动转换开关、百利塑壳式断路器、百利万能式断路器、百利无飞弧低压断路器、特精齿轮泵、特精齿轮马达、特精带换向阀齿轮泵、特精电动液压源、特精恒流泵、特精黄色氧化钨、特精静液压传动装置、特精蓝色氧化钨、特精钼粉、特精钼杆、特精钼丝、特精钼酸铵、特精气动振动器、特精气控分配阀、特精气控液压阀、特精气液压转换器、特精气液阻尼缸、特精气增压缸、特精三氧化钼、特精碳化钨粉、特精钨粉、特精钨杆、特精钨丝、特精钨酸钠、特精液压阀、特精仲钨酸铵,低压电器类、动力机械、风泵机械、轻型工程机械、重有色金属,公司是一家以输配电设备为主营产品的上市公司，是天津装备制造业主体天津百利机械装备集团有限公司旗下唯一控股上市企业。公司主营业务为输配电及控制设备、泵、钨钼制品。“百利、BENEFO、低字”牌塑料外壳式断路器、万能式断路器、“NTK”(图形)牌互感器等被授予“天津市名牌产品”。“百利”、“BENEFO”、“低”、“NTK”(图形)商标被认定为“天津市著名商标”。企业连续多年被评为中国电气工业100强企业，AAA级信用企业，中国电气工业最具影响力品牌，中国电气工业最具竞争力企业。
002364.SZ,中恒电气,510660.0070745229,114870.73936099584,241,89301472.08,ZHCIS型综合电源系统、ZHEPS系列智能型应急电源系统、ZHIV系列正弦波逆变电源、ZHPDS系列智能所用电系统、ZHR系列整流模块、壁挂电源系统、高压直流电源、户外电源系统、监控模块、配电屏、一体化电源系统、整流器系统产品、智能高频开关电力操作电源系统、中恒组合电源系统、主监控器,变电设备,公司是国内市场电力电子设备及电力软件与咨询服务的主流供应商。公司一直专注于主营业务，一方面持续为电网、发电(含新能源)与工业企业的“自动化、信息化、智能化”建设与运营提供整体性解决方案；另一方面专注为客户提供通信电源、高压直流电源(HVDC)、电力操作电源、新能源电动汽车充换电系统、智慧照明、储能等产品及电源一体化解决方案。公司始终以市场为导向，不断发掘客户的需求，坚持技术驱动，持续创新，以专业定制产品与服务，为客户创造新的价值，已成为行业的领军企业。产品畅销海外至亚洲、非洲、欧美、大洋洲等多个国家和地区；在国内各省市拥有多个销售中心，是目前国内市场电力电子设备及电力软件与咨询服务的主流供应商。国家电网、南方电网、中国移动、中国电信、中国铁塔、腾讯、阿里巴巴、百度、戴尔等都是公司长期合作的核心客户。
002805.SZ,丰元股份,509378.2544365768,272066.299186722,241,53090239.1,草酸生产、硝酸钠生产,有机化工原料,公司是由枣庄丰元化工有限公司整体变更而来，是亚洲草酸行业最大的生产企业之一。公司主要致力于草酸系列产品、硝酸、硝酸钠的生产和销售，草酸系列产品包括工业草酸、精制草酸及草酸盐三大子系列产品，其中工业草酸与精制草酸为公司主导产品。公司已形成完整的上下游产业链和行业内最完整的草酸系列产品结构，并具备循环经济优势，具有很强的市场应变能力，同时公司具备了显著的行业地位优势、技术领先优势、完整的产业链和循环经济优势、节能减排和环保优势、成本优势和区位优势。公司已建立完善的质量保证体系和质量评估体系，被评为山东省“重合同、守信用”企业。
002334.SZ,英威腾,506761.5779693776,198003.99300414935,241,182307855.13,CHE系列开环型矢量变频器、CHF系列V/F控制变频器、CHV110系列矢量一体化节能柜、CHV130系列工程型变频器、CHV160系列多泵恒压供水专用变频器、CHV170系列张力控制型变频器、CHV180系列电梯专用变频器、CHV190系列起重机专用矢量变频器、CHV系列高性能矢量变频器、I/O扩展卡、INVT-690V/1140V中压矢量变频器、INVT-CHH系列高压变频器、INVT-DBU能耗式制动器、INVT-RBU回馈性制动单元、串行通讯接口卡、供水扩展卡、英威腾CHS100交流伺服系统、张力控制卡、注塑机控制卡,变电设备、集成电路,公司是国家火炬计划重点高新技术企业，依托于电力电子、自动控制、信息技术，业务覆盖工业自动化、新能源汽车、网络能源及轨道交通。全国共有多处研发中心，拥有各类专利多件，实验室拥有国内工控行业首家TUV SUD颁发的ACT资质，并通过UL目击实验室及CNAS国家实验室认证。深圳公明科技产业园和苏州工业产业园，能为客户提供先进的集成产品开发设计管理、全面的产品研发测试与自动化信息化的作业生产。分布在全球各地的分支机构和联保中心为用户提供解决方案、技术培训与服务支持的专业后勤保障，可以更加便捷快速地服务客户。公司秉承“众诚德厚、业精志远”的经营理念，立足于工业自动化和能源电力领域，以三大技术为基础，做大做强工业自动化、新能源汽车、网络能源、轨道交通等核心业务。
300040.SZ,九洲集团,492720.1796650788,327524.48029045644,241,182259476.84,GCK系抽出式开关设备、GCS型抽出式开关设备、GGD交流低压配电柜、GHT型低压开关柜、HVC(MSC)型高压自动无功补偿装置、KYN28-12(GZS1)铠装中置式金属封闭开关设备、KYN28A-12(等同于GZS1)户内金属铠装抽出式开关柜、MNS型抽屉式开关设备、TCR+FC型SVC高压动态无功补偿装置、TSC型动态无功补偿装置、XGN2-12箱型固定式金属封闭开关柜、电缆桥架、电力系统专用UPS、电力用直流和交流一体化电源、高低压电器元件、高频开关电源、高压变频器(3000 -10000型)、高压电力滤波器(FC)装置、各类低压壳体、各类高压壳体、各类直流继电器、固体电蓄热解决方案、光储充系统解决方案、光伏发电用并网变流器、化学储能削峰填谷解决方案、环网柜、可控硅控制高压电机固态软起动器、框架、型材、冷热电三联供解决方案、离网型分布式发电解决方案、能效管理和能源设施管理解决方案、气体绝缘柜、全功率兆瓦级风力发电并网变流器、手车柜、双馈型兆瓦级风力发电变流器、微机控制可控硅逆变电源(100-500A/22O、380V)、预装式箱式变电站、智能电池巡检装置、智能放电装置、智能绝缘监察装置、智能配电网解决方案、智能微网解决方案,变电设备、继电保护及调度自动化、建筑钢结构、专业咨询服务,公司是中国知名的智能成套电气设备供应商和配用电能效管理解决方案提供商，是中国电力电子和电气成套行业的领军企业。公司的业务集中在电压等级0.4kV～72.5kV之间的配、用电一次和二次系统电气成套设备及解决方案。产品涵盖：高中低压成套开关电器、变压器、封闭母线、电缆桥架、控制元器件、智能仪表、智能化终端、电气传动、谐波治理、新能源发电装备、电能储能等产品和技术。公司更致力于帮助客户提高生产力和电能效率，为客户的流程工业过程自动化，电源及配用电自动化系统，新能源发电装备制造与微电网建设，电能质量管理与谐波治理，电气传动与节能，城市住宅、楼宇与基础设施提供电气设备整体解决方案和能效管理解决方案。公司是国家创新型试点企业、国家火炬计划项目重点高新技术企业、国家高技术产业化示范工程基地。公司领衔、参与了数十项国家或行业标准的制订和修订。公司还拥有国家认定的100MW发电厂和110KV以下变电站工程建设和安装总承包资质。公司先后获得了国家免检产品、国家守合同重信用、国家3A级信用企业、中国民营科技百强企业、优秀中国特色社会主义建设者、全国诚信守法企业称号。
002441.SZ,众业达,472017.6307357593,76357.60860165975,241,415584368.91,ABB低压产品分销、常熟开关产品分销、其他低压产品及设备分销、上海人民电器低压产品分销、施耐德低压产品分销、西门子低压产品分销,低压电器类,公司是工业电气产品的专业分销商，主营业务为通过自有的销售网络分销签约供应商的工业电气元器件产品，以及进行系统集成产品和成套制造产品的生产和销售。公司自成立以来，一直从事工业电气产品的分销业务和系统集成、成套制造业务。公司定位为行业领先的“工业电气服务商”，致力于为电力、石化、工业、交通、能源和各类基础设施等终端用户提供工业电气产品，涵盖了从制造商到用户的工业电气产品供应链的主要环节。公司已成为ABB、施耐德、西门子等跨国公司，以及常熟开关、上海人民电器厂等国内电气行业知名企业的战略合作伙伴，在中、低压输配电产品和工业自动化控制产品的分销领域，多年来一直位居行业前列。
002519.SZ,银河电子,467524.9105155436,56808.0702033195,241,14353506.01,ATM柜员机机体、地面数字电视接收机、电动汽车智能充电机系列、电动涡旋压缩机总成、电脑机箱、高清数字电视接收机、交互数字电视接收机、精密钣金、军工特种装备、平板电视机支架、网络机柜类产品机体、卫星数字电视接收机、有线数字电视接收机、自助类产品机体,电脑配件、发电机及附属设备、其他消费电子产品、输电设备、五金加工机械、专用设备与零部件,公司是国内最早从事数字电视终端研发、生产、销售的国家重点企业之一，旗下业务涵盖新能源电动汽车关键零部件、国防军工特种装备以及数字电视智能终端设备等多个领域，市场覆盖全球多个国家和地区。公司在张家港、合肥、福州、洛阳等地拥有多个产业基地，成功打造了围绕新能源汽车关键零部件、军工装备和数字电视智能终端等业务为主的多个高端装备制造产业园集群近几年，公司积极对各产业基地进行智能化改造，提升现代化制造能力，整体智能制造水平在国内居于领先地位，先后通过ISO9001/TS16949质量管理体系、ISO14001环境管理体系、OHSAS18000职业健康安全管理体系等多项认证，具有系统完善的生产管理流程和优良的品质保障。
000973.SZ,佛塑科技,458699.0801950166,97283.08273443984,241,121920883.3,汾江双向拉伸聚炳烯薄膜、汾江双向拉伸尼龙薄膜、佛塑股份PVC人造革、佛塑股份PVC装饰片材、佛塑股份彩色电化铝膜、佛塑股份辐照高分子材料、佛塑股份聚偏二氯乙烯涂布薄膜（PVDC）、佛塑股份聚酯流延硬片、佛塑股份塑料复合编织布、佛塑股份通用型CPP薄膜、佛塑股份真空镀铝薄膜,高分子聚合物,公司是中国塑料新材料行业的龙头企业、国家火炬计划重点高新技术企业、广东省战略新兴产业骨干企业。公司专注于面向新能源、新能源汽车、高端电子信息和节能环保等战略性新兴产业的高分子功能薄膜等新型材料的研发与生产，现已逐步形成以渗析材料、光电材料和阻隔材料为框架的产业布局，确定了“专注于新能源、新材料和节能环保产业的研发与生产，定位于产业高端化、经营国际化、依托技术创新和精细化管理，建设优秀企业文化和团队，打造卓越运营能力，成为新能源、新材料和节能环保产业的领跑者”的发展战略。公司拥有“汾江牌”、“鸿基牌”、“双象牌”、“双龙牌”、“HG牌”等多个广东省名牌产品、著名商标，体现了多年来专注积累的良好商誉，被评为“国家知识产权运用标杆企业”和“广东省知识产权优势企业”。
600686.SH,金龙汽车,454655.6671857676,55423.95954356847,241,-595219624.26,厦门金龙客车,客车,公司创立于1988年，以大、中、轻型客车的制造与销售为主导产业，系目前全球领先的客车制造集团。公司在中国厦门、苏州、绍兴、西安、上海等地布局有厦门金龙联合汽车工业有限公司――金龙客车、厦门金龙旅行车有限公司――金旅客车、金龙联合汽车工业(苏州)有限公司――海格客车、厦门金龙礼宾车有限公司――金龙礼宾车、金龙汽车(西安)有限公司等客车整车制造企业以及金龙汽车车身、车架、空调、座椅、电器、互联网、充电站(桩)等汽车零部件生产企业，形成集整车与零部件制造为一体的客车产业集群。公司整车产品涵盖4.3米至18米各型客车，销往全球五大洲140多个国家和地区，广泛应用于客运、旅游、公交、团体和特种车等市场，并获得客户的一致认可。
300173.SZ,福能东方,454618.3851097842,144849.77380497925,241,-323231592.62,机器人自动化生产线、智能专用设备、专用自动化设备,专用设备与零部件,公司是一家集研发、制造、销售和服务于一体的新材料装备生产企业，经过多年的技术创新和经验积累，为各行业的定制化要求提供多样化的设备；产品应用领域涉及多个行业：新能源材料行业、光电材料行业、功能纸材料行业、功能性包装材料行业，工厂生产信息化管理行业等。该公司的主要业务为全资子公司大宇精雕关于“3C自动化设备及机器人自动化生产线”的业务。目前大宇精雕已发展成为工业自动化领域内集研发创新、生产销售于一体的方案供应商。
002632.SZ,道明光学,440645.5870538589,59209.4057219917,241,54943444.5,反光布、反光膜、反光制品,高分子聚合物,公司是专业从事研发、生产和销售各种反光材料及反光制品的高新技术企业，亚洲最大的反光材料生产基地。主要产品包括各规格、各等级的反光膜、反光布及以反光膜和反光布为原材料制造的反光制品。公司拥有的“DM”商标已被国家工商管理总局商标局认定为中国驰名商标。公司拥有十多项自主知识产权，并有多项高新技术及产品填补了国内空白，“海事反光膜”产品被列为国家火炬计划项目。公司产品获得欧洲EN471、EN533、EN12899、美国ANSI/107、瑞士环保、澳标等多种证书；通过国家交通部、交通工程监理检测中心、公安部交通安全产品质量监督检测中心等检测。公司享有自营进出口权，系列反光产品远销世界各地多个国家及地区。
300100.SZ,双林股份,393731.7866504855,121916.33616182572,241,128869736.89,冲压级进模具、大型汽车注塑模具、电位器、精密汽车注塑模具、空调结构件、空调壳体、控制盒、门板、前后保险杠、驱动器、释放器、仪表盘、座椅侧板,车身及外观设备、传动设备、专用设备与零部件,"公司是一家专业从事汽车零部件及配件、模具设计、开发及制造的现代化企业,具有一流的汽车零部件及模具的生产制造能力和完善的营销网络。公司为世界上为数不多的开发汽车座椅驱动器(HDM)、位置记忆电位器产品的企业之一，是国内少数具有此类产品自主开发能力的企业，在业内具有较高的知名度。公司现拥有多项专利和专有技术，优质的产品和良好的信誉赢得了客户的一致好评，产品远销欧美、日韩等国家和地区。公司通过重大资产收购双林投资100%股权，进一步丰富了上市公司汽车零部件产品线，形成新的利润增长点。"
300403.SZ,汉宇集团,384961.70539419085,73716.12607053942,241,229792423.62,地尔汉宇冷凝泵、地尔汉宇通用排水泵、地尔汉宇专用排水泵,风泵机械,公司是专用排水泵供应商。主营业务为高效节能家用电器排水泵的研发、生产和销售。公司产品包括家用电器排水泵和少量气泡泵、进水阀、水洗机、迷你洗衣机等相关产品。产品获得了包括三星、LG、海尔、美的，东芝、夏普、伊莱克斯等国内外著名的家电制造企业的认可。公司铝漆包线代替铜漆包线技术及线圈塑封技术、叶轮启动机构技术和水冷技术创新均已获得专利。公司被认定为高新技术企业和广东省省级企业技术中心，高效全塑封铝漆包线永磁电机式排水泵产品被认定为广东省高新技术产品。
688529.SH,豪森股份,362839.6348547718,54048.14353112033,241,70166835.44,白车身焊装智能生产线、变速箱智能装配线、动力锂电池智能生产线、发动机智能装配线、氢燃料电池智能生产线、新能源汽车驱动电机智能生产线,专用设备与零部件,公司立足于国内领先的智能化装配技术和工艺，可为全球客户提供领先、可靠的智能化装备、装配技术及成套定制化产品的综合解决方案，满足全球制造业精益、高效和柔性作业需求，公司不断为客户提供高品质的自动化、柔性化、信息化和智能化的产品及服务。凭借多年积累的技术优势和品牌优势，公司获得了国内外一流客户的认可，公司的主要客户包括上汽通用、特斯拉、采埃孚、北京奔驰、长安福特、华晨宝马、标致雪铁龙、康明斯、格特拉克、卡特彼勒、上汽集团、一汽大众和盛瑞传动等国内外知名品牌企业。公司深耕于汽车智能生产线领域，在汽车发动机智能装配线和变速箱智能装配线等动力总成领域居于国内领先地位，并在服务传统燃油汽车的基础上逐步开拓在新能源汽车领域的市场，在混合动力变速箱智能装配线、动力锂电池智能生产线、氢燃料电池智能生产线以及新能源汽车驱动电机智能生产线等细分领域取得重大突破。公司在智能生产线领域的技术积累和沉淀结合下游客户的具体工艺需求，可以大大扩展公司产品应用领域和范围，可以广泛用于航空航天、OLED显示材料、3C电子、光伏、食品医疗等产业。
600405.SH,动力源,361661.44796834857,261898.1776514523,241,-142384471.44,动力源UPS电源、动力源高压变频器、动力源逆变电源、动力源逆变焊机、动力源嵌入式电源、动力源通信电源、动力源应急电源、合同能源管理服务、新能源汽车配套产品业务,变电设备、低压电器类、电子元器件、专业咨询服务,公司致力于电力电子技术领域相关产品的研发、制造、销售以及相关技术服务并为客户提供系统集成解决方案。公司业务核心为使用电子元器件与软件控制技术对电能进行变换和控制，目前主要产品按技术方向分为直流电源、交流电源、高压变频器及综合节能服务、新能源汽车配套产品业务等。公司产品坚持以自主研发、制造为主，在产品销售方面以直接销售方式为主，部分产品采用直销+代理商销售；在综合节能服务领域以EPC模式开展合同能源管理业务；公司也在积极探索不同的销售业务模式以满足市场差异化需求，大力推进代理分销渠道建设、大客户营销及专网市场推广力度，培育基站(机房)动力环境系统集成能力以推动公司业务增长。
300499.SZ,高澜股份,357212.27248997096,238430.313439834,241,64548093.97,备品备件及技改维护服务、纯水冷却设备,专用设备与零部件,公司是目前国内领先的电力电子装置用纯水冷却设备专业供应商，致力于为全球客户提供专业的节能产品和整体解决方案，成为新能源和节能技术应用的先行者。公司目前开发和销售的主要产品包括直流输电换流阀纯水冷却设备、新能源发电变流器纯水冷却设备、柔性交流输配电晶闸管阀纯水冷却设备、大功率电气传动变频器纯水冷却设备以及各类水冷设备的控制系统。公司是国家火炬计划重点高新技术企业。产品技术达到国内先进水平，其中±800kV直流输电工程换流阀纯水冷却设备产品被国家能源局认定为国际先进水平。公司在电力电子装置用纯水冷却设备领域已形成了集研究开发、设计、制造、营销、售后服务的完整业务体系，公司综合竞争力在业内处于领先地位。公司目前已通过了ISO9001:2008、ISO14001：2004、OHSAS18001：2007、机械制造企业安全标准化企业(二级)资质认证，被授予广州市创新型企业、广州开发区知识产权示范企业、A级纳税人、软件企业、银行AAA级信用企业等荣誉称号。
