code,name,mv_mean,amount_mean,num_days,profit,主营产品名称,主营产品类型,公司简介
002497.SZ,雅化集团,3299504.3321513687,1925105.078290456,241,936626263.32,2号岩石乳化炸药、导爆管雷管(毫秒、半秒、秒系列)、二级煤矿许用乳化炸药、粉状乳化炸药、铝酸酯偶联剂、煤矿许用毫秒电雷管、煤矿许用瞬发电雷管、普通导爆索、普通延期电雷管(毫秒、半秒、秒系列)、三级煤矿许用乳化炸药、十八烷基三甲基氯化铵、十二烷基二甲基苄氯化铵、十二烷基二甲基甜菜碱、十二烷基三甲基氯化铵、十六烷基三甲基氯化铵、斯盘-80、塑料导爆管、岩石膨化硝铵炸药、炸药专用复合油相,高分子聚合物、火工产品,公司专注于锂矿和锂盐产品生产，是国内最早生产锂盐产品的企业之一，是全球锂盐产品的主要供应商。公司以锂产业和民爆产业为主业。集民爆生产、爆破服务、锂盐生产、锂矿开采、危险品运输、军工业务为一体，资源协同、联动发展。公司拥有中国民爆行业唯一的国家级企业技术中心以及国家认可监测和校准实验室，建有两个“博士后创新实践基地”、四川省民用爆炸物品与装备工程技术研究中心等多个创新平台，具有国内领先的技术研发能力。在智能装备、电子雷管、工程爆破、炸药技术等领域处于国内领先水平；雅化锂业在锂行业中技术领先，拥有磷酸二氢锂的制备装置、磷酸二氢锂的生产方法、钛酸锂晶须的制备、一步清洁法电池极碳酸锂的生产方法等发明专利，国内领先的氢氧化锂矿石一步冷冻法生产中核心环节冷冻、浓缩分离生产技术均为雅化锂业所首创。
002028.SZ,思源电气,2880558.3823617594,505423.9306846473,241,1197669571.59,110kV-500kVGIS及SF6开关耐压试验系统、110kV-500kV交联电缆耐压试验系统、BKSC系列环氧浇注铁心并联电抗器、BKS系列油浸式铁心并联电抗器、CI―2000型电容电流测试仪、CKSC系列环氧浇注铁心串联电抗器、DWKN―I型动态无功补偿及电能质量监控装置、GZF-I型GIS工频耐压及局放测试系统、JC1MOA在线监测仪、LP―I移频线路参数测试仪、M―8000I型变频介质测试仪、OSM―1000高压设备绝缘在线监测系统、TROM―600变压器油色谱在线监测系统、磁控电抗器(MCR)型SVC、思源电气变频串联谐振成套试验装置、思源电气变压器感应耐压及局放测试系统、思源电气便携式高电压变频谐振耐压试验装置、思源电气电容式电压互感器、思源电气干式互感器、思源电气高压并联电容器、思源电气户外高压交流隔离开关、思源电气户外高压交流接地开关、思源电气户外高压交流中性点隔离开关、思源电气集合式高压并联电容器、思源电气交流高压六氟化硫断路器、思源电气交流高压真空断路器、思源电气接地变压器、思源电气耦合电容器、思源电气微机小电流接地选线成套设备、思源电气消弧线圈自动调谐及接地选线成套装置、思源电气自能式高压六氟化硫断路器,变电设备、低压电器类、电气仪器仪表、电子元器件、施工及检测设备、输电设备,公司是国内知名专业从事电力技术研发、设备制造、工程服务的上市公司，荣膺国家重点火炬计划高新技术企业、中国能源装备十佳民企、上海市创新型企业等荣誉称号。公司致力于向全球客户提供一流的电气设备与服务，帮助客户安全、可靠、高效地使用和维护电力，产品线覆盖输配电一次、二次设备专业领域，公司主导产品及核心技术处于世界先进水平。公司业务涉及电力、冶金、铁路、石化、煤炭、港口等多个行业，为上海磁悬浮、上海世博会、秦山核电站、云广800千伏特高压直流输电工程、溪浙±800千伏特高压直流输电工程、晋东南-南阳-荆门1000千伏特高压扩建工程、北京奥运会、巴西世界杯、中石油新疆独山子千万吨炼油工程等国内外重大工程提供了优质的电力设备和可靠的技术保障。
600418.SH,江淮汽车,2775841.8190481453,1448843.507672199,241,199999353.78,彩色之旅轿车、江淮汽车--村村通汽车底盘、江淮汽车--都市通汽车底盘、江淮汽车-路路通汽车底盘、瑞风标准型轿车、瑞风道路清障车、瑞风高空作业车、瑞风机场用车、瑞风警备车、瑞风救护车、瑞风冷藏车、瑞风洒水车、瑞风商务车、瑞风通讯指挥车、瑞风厢式车、瑞风邮政车、瑞风油罐车、瑞风自卸车、瑞鹰SRV,行驶底盘设备、轿车、轻型卡车、商务车、重型卡车与专用车、专用车,"公司是一家集全系列商用车、乘用车及动力总成等研产销和服务于一体,“先进节能汽车、新能源汽车、智能网联汽车”并举的综合型汽车企业集团。公司现有主导产品包括：重、中、轻、微型卡车、多功能商用车、MPV、SUV、轿车、客车、专用底盘及变速箱、发动机、车桥等核心零部件。现拥有瑞风、江淮iEV、帅铃、骏铃、康铃、格尔发、和悦、星锐、锐捷特等知名品牌。公司坚持“安全、节能、环保、智能、舒适”的关键技术研发路线，已形成整车、核心动力总成、自动变速箱及软件系统等关键零部件研发、试验验证和标定开发等完整的正向研发体系。在节能减排技术、智能安全技术、噪音技术、轻量化技术、新能源技术、制造工艺技术等方面取得了全面突破，持续打造企业的核心竞争力。公司与德国大众汽车、康明斯发动机、西班牙桑坦德银行等知名企业分别建有合资公司。已经与南美、欧洲、非洲、中东、东南亚等全球130多个国家和地区建立合作关系，拥有JAC日本、JAC意大利两家海外研发中心；在俄罗斯、越南、肯尼亚建有子公司。"
300682.SZ,朗新科技,2724844.171548361,172095.76088381745,241,846881629.38,AMI&MDM、SG186 工程、电动汽车、高清视频会议系统、公用事业互联网业务、管理应用、海外电力计费、基建管理、计费&费控、家庭互联网业务、客户服务体系、能效管理、生产管理、收入保障、输电线路塔上一体化通信装置、输电线路在线监测系统、统一视频通信平台、网络报文记录分析仪、物资管理、业扩&服务品质评价、营配&培训、营销数据综合服务（大数据）、运监中心、智慧教育视频云平台系统、智能计量,行业专用软件、互联网服务,公司是一家专注于公用事业领域业务信息化系统的技术与服务提供商。公司业务主要集中于电力信息化行业的用电领域，产品主要包括用电信息采集、远程实时费控、营销业务应用、客户服务管理、服务品质评价、计量生产调度、电能服务管理、营销稽查监控、农电生产管理等，纵向上覆盖输电、配电及电力调度智能化业务领域；横向上已进入燃气、水务及其他公用事业领域。此外，公司通过与支付宝等第三方支付平台合作，建设基于互联网的公用事业电子账单处理与支付(EBPP)平台，为消费者提供便捷的能源及其他公用事业缴费服务、消费信息服务，致力于成为能源互联网及其他公用事业服务提供商。
002056.SZ,横店东磁,2476311.209199096,678497.788340249,241,1120444284.34,DMEGC软磁铁氧体、DMEGC永磁铁氧体、横店东磁碱性锌锰无汞电池、横店东磁永磁烧结磁粉,磁性材料、低压电器类,公司是一家拥有磁性材料、太阳能光伏、新能源电池等多个产业群的高新技术民营企业。公司是国内规模最大的磁性材料生产企业，也是太阳能光伏产业链比较齐全、规模较大的生产企业。公司拥有雄厚的研发力量，是国际磁性材料技术交流的平台，设有国家级企业博士后工作站、国家级科技兴贸创新基地、国家磁性材料技术中心、浙江省磁性材料重点实验室、省级重点企业研究院、省级院士专家工作站、省级企业技术中心、浙江省科技文献共建共享平台、省级高新技术企业研发中心等创新平台。公司磁性材料产业的核心客户以全球500强企业或行业领先企业为主，如苹果、华为、特斯拉、博世、三星、法雷奥、松下、飞利浦等；太阳能产业的客户亦大多为行业内领先企业。
000762.SZ,西藏矿业,2353878.2129287967,2445198.1391286305,241,140158748.67,西藏矿业电解铜、西藏矿业高岭土、西藏矿业铬矿、西藏矿业铬铁合金、西藏矿业铬盐、西藏矿业金矿、西藏矿业锂矿、西藏矿业锂盐、西藏矿业硼矿、西藏矿业锡矿,半金属、合金、黄金、黏土类非金属矿产、轻有色金属、铜、无机化工原料、有色金属矿产,公司是西藏最大的综合型矿产品开发公司，主要从事铬铁矿、锂矿、铜矿、金矿和硼矿资源的开采及深加工。其产品分别是：铬铁矿；高、中、低碳铬铁(含低钛铬铁)等。公司所属铬铁矿产于西藏山南地区曲松县罗布萨乡境内，是我国储量最丰富、Cr2O3含量最高，Cr/Fe最高的铬铁矿生产基地。公司是西藏自治区纳税大户，是西藏首批授信企业之一，也是中国检验认证集团质量认证有限公ISO9001:2000;ISO14001:2004；GB/T28001-2001质量、环境和职业健康安全认证企业。
002245.SZ,蔚蓝锂芯,2297258.734009618,822454.514186722,241,670122145.07,澳洋顺昌冷轧钢板配送、澳洋顺昌铝合金板配送、澳洋顺昌其他金属配送、澳洋顺昌热镀锌钢板配送、澳洋顺昌热轧钢板配送,其他物流,"公司是金属物流配送行业的领导者，为超过1000家知名企业提供金属材料的仓储、分拣、套裁、包装、配送以及来料加工等完整供应链服务。公司主要从事LED芯片业务、锂电池及金属物流配送三大业务，拥有10多家控股子公司,遍布于长三角及珠三角的苏州、上海、淮安、扬州、东莞等地区。公司下属的江苏天鹏电源有限公司是专业从事锂离子电池研发、生产、销售的高新技术企业，作为国内较早选定三元体系用于电动工具用锂离子电池的企业，在三元材料动力型圆柱电池领域具有将近10年的研发和制造经验的积累，拥有先进的圆柱型锂电池生产线，具有较大规模的圆柱型动力锂离子电池生产能力，在工具型动力锂电池领域处于领先地位。公司凭借着规模化的运营、精细化的管理体制及专业的服务，在金属物流行业得到客户的普遍认可，作为规模化企业在金属物流配送市场中具有领先优势与竞争力。公司以先进成熟的技术工艺为基础，结合业内领先的核心装备和公司优秀的管理理念，成为LED外延芯片行业技术水平、营运效率、盈利最好的企业之一，LED芯片凭借稳定的性能和高性价比获得市场的高度认可。"
600166.SH,福田汽车,2281809.903945415,433480.009120332,241,-5060921170.81,福田MP-X、福田奥铃超运、福田奥铃捷运、福田奥铃皮卡、福田冲浪皮卡、福田传奇、福田风景爱尔法轻客、福田风景快运、福田欧V全景无限、福田欧V先锋、福田欧V新干线、福田欧马可、福田欧曼昆仑、福田欧曼奇兵、福田欧曼神舟、福田欧曼雄师、福田萨普、福田时代金刚、福田时代汽车、福田时代轻卡、福田时代中重卡,客车、轻型卡车、商务车、重型卡车与专用车、专用车,公司是一家跨地区、跨行业、跨所有制的国有控股上市公司，目前拥有欧曼、欧辉、欧马可、奥铃、时代、萨瓦纳、拓陆者、萨普、图雅诺、风景、蒙派克、伽途、瑞沃等业务品牌，生产车型涵盖轻型卡车、中型卡车、重型卡车、轻型客车、大中型客车、乘用车以及核心零部件发动机。公司通过与世界知名企业戴姆勒、康明斯、采埃孚的横向一体化战略合作，完成了商用车全系列发动机、变速箱等核心零部件的布局，产品性能得到提升的同时创造了新的利润增长点，形成福田汽车核心竞争优势。
600500.SH,中化国际,2237042.763011585,305058.34928215767,241,2175432016.18,中化化工、医药、农药产品出口、中化煤炭钢铁进出口、中化石油及天然气下游产品贸易、中化塑料原料进口、中化橡胶轮胎进出口,进出口贸易,公司是在中间体及新材料、农用化学品、聚合物添加剂、天然橡胶等领域具有核心竞争力的国际化经营大型国有控股上市公司。公司专注于化工新材料、农药原药及剂型、电子化学品、汽车用材料及化学品等方面的研究，其中农药原药研究、橡胶化学品研究属行业领先。公司将商业实践与社会价值共融，追求可持续发展，注重环境保护，致力于建设资源节约型、环境友好型社会，实现“精细化学绿色生活”的企业发展愿景。荣获“中国上市公司治理百强”榜首、“中国最佳董事会”、“中国最受尊敬的上市公司”、“中国最具责任感上市公司”、“中国最佳治理上市公司”等诸多荣誉。
300376.SZ,易事特,2141806.884304066,733597.1012863071,241,515403900.76,易事特“E机房”系统、易事特“E智”系统、易事特EPS应急电源、易事特OR系列电源、易事特UPSmart2000监控软件、易事特UPS不间断电源、易事特壁挂电源系统、易事特变频电源、易事特便携式充电机、易事特电力UPS系统、易事特电梯专用电源、易事特电站型并网逆变器、易事特高频开关电源系统、易事特高频整流模块、易事特挂墙式电源系统、易事特光伏阵列智能汇流箱、易事特户外电源系统、易事特环境动力监控系统、易事特机房精密配电、易事特机房专用精密空调、易事特机柜集成系统、易事特集成式光伏电站、易事特监控模块、易事特免维护铅酸蓄电池、易事特配电单元（PDU）、易事特嵌入式电源系统、易事特手动调压器、易事特太阳能充电控制器、易事特太阳能离网逆变器、易事特网络服务器机柜、易事特稳压电源、易事特一体化电源系统、易事特整流模块电源、易事特智能电池巡检仪、易事特专用逆变电源、易事特组串型并网逆变器、易事特组合式电源系统,变电设备、低压电器类、电子元器件、行业专用软件、监控器材及系统、空调器具、专用设备与零部件,公司长期致力于现代电力电子产业技术领域，积累了丰富的高频电能变换与控制等关键核心技术，系统布局高端UPS电源、大数据、云计算、逆变器、储能、充电桩等相关产业。公司主要产品有：UPS、高压直流电源、逆变器、充电桩、储能设备、精密空调、智能配电等产品的研发、制造、销售与服务；围绕智慧城市&大数据、智慧能源(含储能系统、微电网、充电桩、云计算、逆变器)及轨道交通(含监控、通信、供电)等战略新兴产业，为全球用户提供优质IDC数据中心、量子通信云计算系统、光储充一体化智慧能源系统、轨道交通智能供电系统等全方位解决方案，致力于成为电力电子技术及能效管理专家、全球智慧城市和智慧能源系统解决方案卓越供应商。公司已发展成为国家火炬计划重点高新技术企业、国家技术创新示范企业、国家级知识产权示范企业，是全球新能源500强企业，2018年荣获全国“五一劳动奖状”。公司先后荣获“国家级知识产权示范企业”、“中国专利优秀奖”、“广东省企业专利创新百强企业”等多项殊荣。
000400.SZ,许继电气,1919164.847763448,828833.7232531119,241,724373048.45,顺特干式变压器、许继EMS加工服务、许继WGL-800故障录波分析装置、许继电力系统线路保护成套装置、许继电铁二次设备及城市轻轨控制设备、许继电子式、感应式电能表、许继电子式电度表、许继继电保护测试设备、许继继电保护及故障信息系统、许继继电器、许继母线保护及其他、许继全数字化变电站、许继微机综合保护装置、许继箱式变电站、许继中、低压开关设备,变电设备、低压电器类、电气仪器仪表、施工及检测设备,公司是国家电网公司直属产业单位，是专注于电力、自动化和智能制造的高科技现代产业集团。公司作为中国电力装备行业的领先企业，致力于为国民经济和社会发展提供高端能源和电力技术装备，为清洁能源生产、传输、配送以及高效使用提供全面的技术、产品和服务支撑。公司聚焦特高压、智能电网、新能源、电动汽车充换电、轨道交通及工业智能化五大核心业务，综合能源服务、智能制造、智能运检、先进储能等新兴业务，产品可广泛应用于电力系统各环节。公司产品主要分为智能变配电系统、直流输电系统、智能中压供用电设备、智能电表、电动汽车智能充换电系统、EMS加工服务等六类。公司拥有国家认定的企业技术中心、国家高压直流输变电设备工程技术研究中心、国家能源主动配电网技术研发中心、国家工业设计中心，以及国家电工仪器仪表质量监督检验中心，是和IEC/TC85技术委员会秘书处和全国电工仪器仪表标准化技术委员会秘书处承担单位。
000559.SZ,万向钱潮,1897472.9256780744,152478.17067634856,241,686493962.08,万向半轴、万向等速驱动轴、万向第二代轮毂单元、万向第三代轮毂单元、万向第一代轮毂单元、万向电动摩托车用聚合物锂动力电池组、万向电动汽车用聚合物锂动力电池组、万向防尘罩、万向工程机械转动轴、万向刮水器电机、万向刮水器电机总成、万向减速器、万向轿车减震器、万向某传动轴中间支架、万向某系列轿车转向轴、万向内呼吸式弹簧气室、万向钱潮万向节十字轴、万向双膜片弹簧气室、万向水泵轴连轴承、万向物资贸易、万向橡胶密封件、万向圆锥轮毂单元、万向中重型卡车传动轴、万向转向管柱,车身及外观设备、传动设备、低压电器类、发动机设备、工控机械、国内贸易、行驶底盘设备、横向附件、专用设备与零部件、转向设备,公司是目前国内主要的独立汽车零部件专业生产基地之一，专业生产底盘及悬架系统、汽车制动系统、汽车传动系统、汽车燃油排气系统、轮毂单元、轴承、精密件、工程机械零部件等汽车系统零部件及总成。公司围绕汽车零部件新能源化、模块化、轻量化、电子化、互联化、智能化等前沿技术加速发展，积极拓展业务及提高主导产品细分市场份额，不断提升公司活力、创新力和竞争力，实现市场的转型升级，使公司的核心竞争力不断得到提升。同时，公司不断完善公司体系治理，提高规范运作能力，加快人才引进、储备和培育，为公司发展奠定了坚实基础，确保公司的长期稳健快速发展。公司万向节、传动轴、制动器、燃油箱、排气系统等产品被认定为中国名牌产品，钱潮商标被认定为驰名商标，先后荣获中国世界名牌、中国工业大奖表彰奖、浙江省政府质量奖、首届中国质量奖提名奖、制造业单项冠军示范企业等。
002139.SZ,拓邦股份,1879656.4188770333,561246.2201244814,241,564964282.18,拓邦电子TD视频采集卡、拓邦电子车辆监控专用彩色摄像机、拓邦电子电池保护板、拓邦电子电磁炉电脑控制板、拓邦电子电饭锅模糊控制器、拓邦电子高效照明产品控制器、拓邦电子空调电控板、拓邦电子锂电电池保护板、拓邦电子摄像机系列、拓邦电子数字超级宽动态摄像机、拓邦电子微波炉微电脑控制器、拓邦电子卫浴类电控板、拓邦电子洗碗机电控板、拓邦电子洗衣机电控板,电子元器件、光学设备,拓邦股份是国内智能控制行业开创者和领导者，1996年在深圳南山科技园成立后，专注为家用电器、电动工具、工业设备、个人护理、商业设备、医疗器械、汽车电子等领域厂商提供智能控制解决方案，已成为全球领先的智能控制方案提供商。公司研发人员超过1000人，在感知检测、控制处理、智能物联和人机交互等领域拥有一系列核心技术，并拥有业界领先的体系化管理能力。在智能时代，公司依托智能控制器核心技术优势和丰富的行业经验，成立了一站式智能电器解决方案平台T-SMART，秉承专业让智能更简单的理念，为客户提供从智能控制器、通讯模块、云服务到应用软件开发的全方位服务，以及从客户需求到产品量产的一站式智能电器解决方案。
300487.SZ,蓝晓科技,1824506.5275848424,417549.44471369294,241,310856595.18,化工专用树脂、环保专用树脂、湿法冶金专用树脂、食品加工专用树脂、应用系统装置、制药专用树脂,其他化学品、专用设备与零部件,公司的主营业务是研发、生产和销售吸附分离树脂并提供应用解决方案。公司提供的吸附分离树脂在下游用户的工艺流程中发挥独特的选择性吸附、分离和纯化等功能，广泛应用于湿法冶金、制药、食品加工、环保、化工和工业水处理等领域。依托强大的技术创新能力，公司以产业化应用为核心，深入细致地研究下游应用领域的技术、工艺发展状况，结合重点应用领域用户的需求，研发和提供吸附分离树脂、工艺和应用技术。公司提供的吸附分离树脂产品和应用解决方案在多个重点应用领域实现了对国外进口材料的替代及原创技术的产业化，推动了相关产业的技术升级。公司产品和服务对于提升下游用户的产品品质、促进工艺革新、降低生产成本起到至关重要的作用，提升了下游用户的核心竞争力，为用户创造了核心价值。
002091.SZ,江苏国泰,1796319.1292109624,489111.96666804975,241,1236168613.1,硅烷偶联剂、国泰纺织品进出口、国泰服装进出口、国泰化工进出口、国泰机电进出口、国泰轻工进出口、国泰玩具进出口、锂离子电池电解液,进出口贸易、其他化学品,公司目前的主要业务有供应链服务和化工新能源业务。公司供应链服务主要涉及消费品进出口贸易以及电商平台，以消费品进出口贸易为主，面向国际国内两个市场，聚焦生活消费品，致力于提供全供应链一站式增值服务。公司控股子公司张家港市国泰华荣化工新材料有限公司主要生产锂离子电池电解液和硅烷偶联剂，作为国内锂离子电池电解液行业的先入者，在研发、生产、销售等方面具有一定的优势，锂离子电池电解液销量连续多年在国内和国际上名列前茅。公司控股子公司江苏国泰超威新材料有限公司是超级电容器电解液产品行业标准的主起草单位。
300343.SZ,联创股份,1698377.6600123404,1611408.408821577,241,287729234.7,ZLC-1001 家电专用系列、ZLC-1002热水器专用系列、ZLC-1003管道专用系列、ZLC-1004浇铸系列、ZLC-1005仿木系列、ZLC-1006喷涂系列、ZLC-1007板材系列、ZLC-2000汽车、家具系列、ZLC-SPU聚脲喷涂系列、公关社会化营销、广告效果监测、互联网媒介购买、精准和移动营销、品牌整合传播、数字平台建设,高分子聚合物、互联网服务、运营平台系统、专业咨询服务,公司致力于互联网营销传媒及绿色化学品的研发、生产与推广，产品涵盖：互联网创意及策略制定、媒介购买、数字公关、社会化营销、电商创新应用、数据分析循环利用、聚氨酯组合聚醚多元醇、聚氨酯弹性体预聚物、单体聚醚、聚脲防水防腐材料、聚氨酯防火保温板等。通过利用自身开发的数据系统持续的对客户及媒体数据进行收集和优化，并以其出色的策略策划、内容营销、创意制作和优秀的项目执行能力，为客户提供全面、优质的整合营销服务；凭借日臻成熟的媒介采购与管理经验，与主流互联网媒体形成了长期稳定的合作关系。公司作为清华大学院士工作站，始终坚持技术创新价值体系，拥有亚洲一流的“技术研发中心”和专业的科研团队以及一流的生产装置，确保了产业的可持续发展，志在打造中国创新化学品旗舰型企业，振兴民族产业。
