code,name,mv_mean,amount_mean,num_days,profit,主营产品名称,主营产品类型,公司简介
600110.SH,诺德股份,2201069.014600581,1029719.1075020748,241,405084585.88,"""CIAC""热缩电力电缆接续产品、""CIAC""热缩套管产品、CIAC钢质管道防腐材料、中科英华10微米铜箔、中科英华12微米铜箔、中科英华18微米铜箔、中科英华400微米铜箔、中科英华9微米铜箔、中科英华电线电缆、中科英华贸易、中科英华普通热缩细管、中科英华石油开采、中科英华天然气开采、中科英华粘性内表面热缩细管",进出口贸易、热缩产品、输电设备、天然气勘探与生产、铜、涂料与油漆、原油勘探与生产,公司前身为中国科学院长春应用化学研究所于1987年创办的长春热缩材料厂，为国家级高新技术企业。1997年10月7日在上海交易所上市，成为中国科学院系统首家上市公司。经多年技术研发与市场积累，形成了公司的核心产业为锂离子电池基础材料电解铜箔的生产、销售，作为中国大陆第一家电解铜箔的生产商，公司自主研发生产的高档电解铜箔产品、动力电池材料等系列产品具备有较为明显的技术与成本优势，已经成为国内知名的新能源锂电池材料龙头供应商。诺德股份依托产业基础和实业优势，积极布局金融服务业，通过创新投融资模式和产品，推动产业链和供应链金融服务模式的转变。公司将积极把握产融结合的发展趋势及金融业的战略投资机会，努力打造并逐步形成金融投资控股平台。
300432.SZ,富临精工,2092465.0903619584,829466.356560166,241,399091674.57,VVT系列、活塞冷却喷嘴、机械挺柱、精密零部件、磷酸铁锂系列、三元材料系列、摇臂、液压挺柱、液压张紧器、自动张紧器,低压电器类、机床机械,公司为专业从事汽车发动机精密零部件的研发、生产和销售的高新技术企业。公司在发动机零部件领域形成了以液压挺柱、机械挺柱、液压张紧器、摇臂、喷嘴、发动机可变气门系统(VVT、VVL)、缸内直喷系统用高压油泵挺柱和泵壳、自动变速器及燃油喷射器精密零部件等产品系列，产销量已经位居国内市场前列，具有较高的市场知名度。公司产品系列核心技术国内领先，部分技术已达到国际同行业先进水平，实现了替代进口、填补了国内空白，已成为国内具有较高影响力和知名度的汽车发动机精密零部件供应商之一。
600580.SH,卧龙电驱,1883210.875634448,447049.8230414938,241,987816331.02,卧龙MVE系列振动电机、卧龙大功率电机、卧龙电动自行车、卧龙电梯用电机、卧龙发电机、卧龙风电设备、卧龙高压变频器、卧龙隔爆异步电动机、卧龙混凝土搅拌机、卧龙家用电机、卧龙气动振动器、卧龙特种变压器、卧龙系统集成、卧龙小功率异步电动机、卧龙蓄电池、卧龙中小型电机、卧龙中小型异步电动机,变电设备、低压电器类、电动车、动力机械、发电机及附属设备、系统集成服务,公司属国家重点高新技术企业，集电机与控制、输变电、电源电池三大产品链，产品涵盖各类微特电机及控制、低压电机及控制、高压电机及控制、电源电池及输变设备等40大系列3000多个品种，主导产品引领国际国内主流市场并配套诸多国家重点工程项目，各项经济指标连续多年居国内同行首位。生产基地遍布中国上虞、绍兴、杭州、上海、淮安、北京、银川、武汉、济南、青岛、烟台、芜湖、南阳、郴州；奥地利努斯特瑙、斯皮尔伯格；英国伯明翰、哈德斯菲尔德、诺维奇、利兹市；德国诺登汉姆、门兴格拉德巴赫、韦尔茨海姆；塞尔维亚博尔、苏博蒂察；波兰塔尔努夫；意大利摩德纳。公司在杭州、日本大阪、荷兰埃因霍温三地建有三个电机及驱动控制技术研究机构。是国家重点高新技术企业，设有博士后科研工作站和国家重点实验室，建立了省级电气研究院和国家级企业技术中心。
300035.SZ,中科电气,1806405.3943668632,724399.5616887967,241,365454791.95,除铁器、电缆卷筒、高压变频器、连铸电磁搅拌装置、起重电磁铁、整流控制设备,变电设备,公司是国内电磁行业上市公司，是国内电磁冶金行业品牌企业；是致力于电磁冶金整体解决方案、现代物联网整体解决方案、节能减耗整体解决方案的研发和创新，集现代制造和现代服务于一体的高新技术企业和软件企业。公司磁力装备业务涵盖电磁冶金专用设备、工业磁力设备以及锂电专用设备的研发、制造、销售及服务。主要产品为中间包通道式感应加热与精炼系统、连铸电磁搅拌(EMS)成套系统、连轧电磁感应加热系统、起重磁力设备、除铁器、磁选机、卷筒、锂电自动化电气控制设备、锂电负极材料磁分离器成套设备、锂电正极材料磁分离器成套设备等，产品可广泛应用于钢铁、交通运输、造船、机械、矿山、锂电等行业。公司秉承“创新发展、追求卓越”的经营理念，始终把科技创新作为企业可持续发展的核心动力，把握行业发展趋势，研发了一批具有国际先进水平的，打破国外技术封锁和市场垄断乃至引领行业技术发展的新产品、新技术。
688339.SH,亿华通-U,1719583.783110199,266455.74615352694,241,-161924124.12,亿华通DC/DC直流变换器、亿华通动力系统构型分析以及系统集成、亿华通工程服务、亿华通控制系统、亿华通氢储能、亿华通氢基础设施、亿华通燃料电池发动机、亿华通新能源汽车智能交通信息管理平台,电子设备及加工、发动机设备、公共服务、互联网服务、系统集成服务、专业咨询服务、专用设备与零部件,公司是一家专注于氢燃料电池发动机系统研发及产业化的高新技术企业，致力于成为国际领先的氢燃料电池发动机供应商。公司具备自主核心知识产权，率先实现了发动机系统及燃料电池电堆的批量国产化，产品主要应用于客车、物流车等商用车型。公司及下属公司神力科技曾先后承担多项国家高技术研究发展计划(863计划)项目、科技部国家重点研发计划项目以及北京市科委、上海市科委项目等燃料电池领域重大专项课题，历经了中国燃料电池产业从技术研发为主向示范运营和产业化推进的重要转变。公司与国内知名的商用车企业宇通客车、北汽福田、中通客车、苏州金龙以及申龙客车等建立了深入的合作关系，搭载亿华通发动机系统的燃料电池客车先后在北京、张家口、上海、郑州、苏州等地上线运营。
300457.SZ,赢合科技,1715567.2143747553,414852.4272904564,241,311390993.43,叠片机、分条机、卷绕机、模切机、涂布机、制片机,专用设备与零部件,公司是我国动力电池智能自动化设备行业的龙头企业，也是目前全球唯一一家能够提供动力电池智能化数字工厂解决方案的企业。公司是行业内第一家推出锂电池智能生产线整线方案提供商，为客户提供自动化生产工艺实现、动力辅助、环境控制和工业建筑规划设计等全套解决方案，面向客户认可的子公司和合作伙伴定制相应设备，从方案设计、产品出图、设备生产到设备调试、生产运维的各个环节进行全程跟进和服务，充分满足客户自动化、信息化、智能化的生产需求。公司紧贴市场需求，抓住市场机遇，满足客户自动化、信息化、智能化的生产线要求，客户粘性提升，订单量持续增长。
002518.SZ,科士达,1365689.441777967,459550.7220456432,241,373200496.33,“金守护”系列一体化柜式机房、FMH密封电池系列、FML密封电池系列、FM固定型密封电池系列、FM小型密封电池系列、SM系列逆变电源、Stanchangel系列逆变电源、UPS、UPS输出模块、VP5800―RM系列逆变电源、VP5800系列逆变电源、插拔式电池箱、电池柜、机架式电池箱、机架折叠式KVM、科士达GFM密封电池系列、浪涌保护模块、市电分配模块、双电源切换模块、太阳能光伏逆变器、太阳能深循环电池系列、网点专用一体化柜式机房、友电HIPOWER系列、友电YDC9100系列、友电YDC9300系列、友电YDE2000系列、友电YDE9100系列、智能监控模块、主电源输入模块、综合配电模块,变电设备、低压电器类、电子元器件、输电设备,公司是国内领先的机房一体化系统集成制造商，领先的新能源电力转换技术创新厂商，UPS产业领导者，高品质阀控式密封铅酸蓄电池专业制造商。公司主要致力于电力电子及新能源领域，产品涵盖UPS不间断电源、逆变电源、阀控式铅酸蓄电池、机房一体化设备、太阳能光伏逆变器等。公司参与国家西气东输二线东段UPS集中采购等国家级重点信息化工程，品牌在国内市场已具有较高的知名度和美誉度。公司获得“UPS服务用户满意度金奖”、“UPS服务用户满意度第一”、“中国计算机用户服务优质企业”、“最佳服务承诺兑现企业”等荣誉称号。
300409.SZ,道氏技术,1349392.5629207925,514959.6504024896,241,561699962.81,道氏干粒抛晶釉、道氏基础釉、道氏金属釉、道氏全抛釉、道氏陶瓷墨水、道氏印刷釉、道氏釉用色料,涂料与油漆,公司是国家高新技术企业，致力于为国内外高端陶瓷生产企业提供“一揽子”产品整体解决方案，业务涵盖了标准化的陶瓷原材料研发、陶瓷产品设计、陶瓷生产技术服务、市场营销信息服务等领域，是国内唯一的陶瓷产品全业务链服务提供商。公司的研发实力、产品应用开发与技术服务能力，在业内处于领跑地位。公司客户涵盖了诸如东鹏、金意陶、新明珠、新中源、马可波罗等国内最知名的陶瓷墙地砖生产企业。公司始终坚持走自主研发的发展道路，以科技创新突破欧洲国家技术封锁壁垒，提升建陶产业的整体竞争力，推动中国建陶产品赶超世界先进水平为己任。
002759.SZ,天际股份,1297010.4445718755,777962.4789253112,241,745033544.91,电热水壶系列产品、其他厨房小家电、陶瓷烹饪电器,厨房器具,公司系专业研发、生产和销售家用小电器、电子产品、医疗器械的现代化企业。公司主要从事生产、销售六氟磷酸锂业务。六氟磷酸锂是锂电池的重要原材料。锂离子电池的原材料可分为正极、负极、隔膜和电解液四大类。锂离子电池主要依靠锂离子在正极和负极之间往返的嵌入和脱嵌来完成充放电的过程。作为四大材料之一的电解液，在电池正负极之间起到传导输送能量的作用。电解质是电解液的核心组成部分，六氟磷酸锂是主要电解质材料，目前从对电解质的性能要求来看，六氟磷酸锂综合性能最好。目前六氟磷酸锂主要应用于储能电池、动力电池及数码、照明系列锂电池等产品中。公司通过ISO9001质量管理体系认证和ISO14001环境管理体系认证。
002126.SZ,银轮股份,870091.2928106348,163434.2473112033,241,220374339.65,银轮EGR、银轮板翅式冷却器、银轮封条式冷却器、银轮管翅式冷却器、银轮管壳式冷却器、银轮机油冷却器、银轮冷却模块、银轮冷却器模块总成、银轮冷却器总成、银轮铝冷却器、银轮中冷器,发动机设备,公司是一家专业研发、制造和销售各种热交换器及尾气后处理等产品的国家级高新技术企业。目前公司是中国内燃机标准化技术委员会热交换器行业标准的牵头制订单位，建有国家级企业技术中心、省级重点企业研究院、省级工程实验室和国家级博士后科研工作站。公司在浙江、上海、湖北、山东等地建有生产基地和研发中心、并在北美、欧洲等地建有生产基地和研发分中心。公司主要产品有：新能源汽车热管理相关的高低温水箱、Chiller(电池深冷器)、电池冷却板、电机冷却器、电控冷却器、前端冷却模块、PTC加热器等，广泛应用于汽车、工程机械、农业机械、压缩机、风力发电、火车机车、轮船等热交换及尾气后处理领域。多年来，公司将自己的专业技术发展到新的应用领域，使其业务不断向农业机械、压缩机、船舶、风力发电、发电机组、火车机车及工业、民用等热交换领域市场拓展和延伸。公司已由简单的为客户提供产品发展到能以客户为中心提供换热解决方案，正被全球范围内越来越多的主机厂商肯定和认可，成为其在中国甚至全球热系统首选供应商。公司愿景是成为提供高效换热解决方案的世界级优秀企业。
688155.SH,先惠技术,845356.9080684647,92874.118406639,241,70063544.23,Dat@ IDLS室内定位系统、Dat@无线数据采集终端、MES系统(制造执行系统Manufacturing Execution System)、SCADA系统(数据采集与监视控制系统Supervisory Control And Data Acquisition)、测试和检测系统、电动车动力总成(EDS)生产线、动力电池模组/电池包(PACK)生产线、工艺参数分析系统、燃料电池电堆/系统生产线、燃油汽车智能自动化装备、智能预警系统、智能诊断系统,系统集成服务、专用设备与零部件,公司是国内较早进入新能源汽车智能制造装备领域的企业，在动力电池模组/电池包(PACK)、电动汽车动力总成(EDS)、动力电池测试和检测系统等新能源汽车关键部件制造及测试领域具有丰富的经验，是大众汽车(包括上汽大众、一汽大众)、华晨宝马的动力电池包(PACK)生产线主要供应商，是目前少数直接为欧洲当地主要汽车品牌(大众斯柯达(捷克))提供动力电池包(PACK)生产线的中国企业。同时，公司高度关注新能源汽车技术发展前沿，已成功开发并销售了燃料电池电堆/系统生产线。公司是国内变速器、底盘系统智能制造装备领先供应商，客户涵盖上汽集团系、采埃孚系等知名汽车及零部件生产企业，公司产品生产的变速器及底盘系统，广泛应用于大众、奔驰、宝马等知名品牌的主流车型。
002276.SZ,万马股份,778773.7344012281,166404.5586099585,241,271206596.57,110kV交联电缆、220kV交联电缆、6-35kV交联电缆、硅烷交联交联电缆、万马低压塑力缆、万马架空线、万马交联电缆,通信线缆,公司是专业从事电力电缆的研发、生产和销售，集科研、设计、制造、销售于一体的大型电缆专业生产企业，从硬件设施到技术实力在电线电缆、高分子材料、特种线缆、及光伏新能源等领域均处于先进水平。专业生产220kV、110kV超高压电缆，35kV及以下交联电缆、塑力电缆、控制电缆、特种电缆、铝绞线及钢芯铝绞线和布电线、计算机电缆、预制分支电缆等多个品种，35kV及以下交联聚乙烯绝缘电缆和聚氯乙烯绝缘电缆均采用国际标准，民用电线通过国家强制性产品认证。公司产品广泛应用于全国多省市的城、农网改造、全国各大电厂、铁路、石油化工系统以及各大城市地铁、轻轨、机场等重点工程。
300648.SZ,星云股份,733862.3273431038,321282.8003568464,241,76045638.81,动力电池模组/电池组 EOL检测系统、锂电池保护板检测系统、锂电池成品 检测系统、锂电池模组/锂电池组（PACK）自动化组装系统、锂电池组BMS检测系统、锂电池组充放电检测系统、锂电池组工况模拟检测系统,专用设备与零部件,公司是国内领先的锂电池检测系统服务商。公司高度融合锂电池检测、电力电子、自动化等行业技术，以高精度的锂电池检测系统为基础，辅以公司自主开发的MES系统，将锂电池组组装制造过程的电芯充放电、电芯分选、电池模组焊接、BMS检测、电池模组检测、电池组成品下线检测等工序设备，整合成锂电池组自动化组装生产线。公司产品广泛应用于3C产品及电动工具、电动自行车、新能源汽车等领域。
300681.SZ,英搏尔,580115.5044053112,145235.95846887966,241,46840731.85,DC-DC转换器、车载充电机、电机控制器、电子油门踏板,汽车及零配件经销,公司是一家专注于电动车辆电机控制系统技术自主创新与产品研发的高新技术企业，主营业务系以电机控制器为主，车载充电机、DC-DC转换器、电子油门踏板等为辅的电动车辆关键零部件的研发、生产与销售。公司产品广泛运用于新能源汽车、中低速电动车、场地电动车等领域。电机控制器是电动车辆的关键零部件之一，其主要功能为：车辆的运行工况需求通过电子油门的信息传输，电机控制器指挥电机工作，调整相应的电机工作电流、电压及转速，完成车辆的启动、加速、运行、制动等工况匹配；电机控制器同时管理动力电池组在车辆运行状态下的放电功率传输及能量回收。
300890.SZ,翔丰华,550185.0622406639,181677.4353153527,241,99839401.25,复合石墨、硅碳负极材料、人造石墨、石墨烯、石墨纤维、碳气凝胶、天然石墨,半导体材料、高分子聚合物,"公司是一家从事锂离子电池负极材料的研发、生产和销售的高新技术企业，是国内先进的锂电池负极材料供应商，主要产品分为天然石墨和人造石墨两大类，产品应用于包括动力(电动交通工具，如新能源汽车、电动自行车等)、3C消费电子和工业储能等锂离子电池领域。经过多年发展，公司建立了一支高素质的研发团队和专家顾问团队，主要成员来源于清华大学、中科院等高等院所，并成为清华大学、重庆大学等知名院校的研究生联合培养基地和产学研合作基地,公司“动力电池用新型高性能微膨石墨负极材料的研发项目”获得“深圳市科学技术奖――技术发明二等奖”；“动力电池长循环硅/碳复合负极材料的研发与产业化项目”被深圳市经信委列为2018年第一批战略性新兴产业和未来产业发展专项资金中的“创新链+产业链”融合专项扶持计划(直接资助类)；获批广东省科技型中小企业技术创新基金项目等多项荣誉。"
300745.SZ,欣锐科技,503274.1397579834,185707.31911618257,241,25468302.39,车载 DC/DC 变换器、车载充电机、车载电源集成产品,专用设备与零部件,公司是专注于新能源汽车车载电源的研发、生产、销售和技术服务的国家高新技术企业。目前公司主要为新能源汽车行业提供车载电源整体解决方案，产品包括车载DC/DC变换器、车载充电机及以车载DC/DC变换器、车载充电机为核心的车载电源集成产品等。公司车载电源产品可广泛应用于乘用车、客车、专用车等各类新能源汽车领域。公司具有较强的自主研发能力。公司自2006年初进入新能源汽车产业，专注新能源汽车高压“电控”解决方案(其主要技术集中在车载DC/DC变换器和车载充电机，统称为车载电源)，欣锐科技拥有车载电源原创性核心技术的全部自主知识产权，在车载电源和大功率充电领域积累了丰富的研发及产业经验，拥有业界领先的研发创新能力及工程制造能力，产品技术水平居行业前列。欣锐科技的车载电源配套了国内外众多主流车型，是车载电源细分领域的龙头企业，促进国内新能源汽车朝产业化方向发展。
002196.SZ,方正电机,479751.1792226971,209373.64501659755,241,25177034.9,方正电机电脑自动剪线缝纫机、方正电机工业缝纫机电机、方正电机工业缝纫机电机配件、方正电机家用缝纫机电机、方正电机家用缝纫机电机配件、方正电机汽车马达、方正电机伺服电机,动力机械、纺织机械,公司是专业生产缝制设备动力源的外贸出口企业，主要产品为缝纫机马达，其中工业缝纫机马达和家用缝纫机马达等系列产品远销欧美、中东、东南亚等多个国家和地区，家用缝纫机马达产量及出口量均全国领先。为了更好地和客户沟通、交流，更快更准地掌握市场行情、充分利用互联网优势，公司投资建设售后服务信息管理系统和发货查询系统，重点开发电子采购系统。公司获得浙江省“五个一批”重点骨干企业、浙江省名牌产品企业、浙江省著名商标企业、浙江省“五个一批”重点骨干企业等荣誉称号。
300340.SZ,科恒股份,366688.1873115353,249041.93471784232,241,13984267.23,LED荧光粉、常规单色粉、钴酸锂、混合粉、三元材料、特殊单色粉、添加剂,电子元器件、其他化学品,公司是国内新材料领域知名的国家级高新技术企业，自创办之日起，始终专注于产品技术创新，并与复旦大学、中山大学展开产学研合作，多项科研成果通过产品鉴定，获得国家、省、市、区的各级奖励，部分产品列入国家火炬计划项目、星火计划项目。公司主要产品包括锂离子电池正极材料、稀土发光材料。公司锂电产品主要是锂电正极材料，包括钴酸锂和三元材料，钴酸锂主要应用于消费类电子锂电池。公司一直将研发作为保持企业核心竞争力关键，不断保证企业有效的研发能力，拥有专业的研发团队、先进的研发设备，不断引进高端技术人才，积极与高校等研究机构合作，专注于稀土功能材料、锂电材料等领域的研发工作。不断的研发投入及优秀的研发创新能力为公司产品上拥有技术优势和竞争实力，将持续为公司带来稳定的经济效益。经过多年努力，公司被认定为“广东省省级企业技术中心”，拥有百项国家专利，主持制定和修订几十项国家和行业标准。
002227.SZ,奥特迅,364130.6741497096,74587.4445020747,241,-32707678.62,奥特讯电力用直流和交流一体化不间断电源、奥特讯电力专用UPS和逆变电源系统、奥特讯电力专用仪器、奥特讯微机集中监控器、奥特讯微机控制高频开关直流电源系统、奥特讯直流操作电源,变电设备、低压电器类、电气仪器仪表、施工及检测设备,公司是大功率直流设备整体方案解决商，是直流操作电源细分行业的龙头企业。国家级高新技术企业，公司销售额连续多年位居同业榜首并负责起草或参与制定了多项国家及电力行业标准。奥特迅秉持“拥有自主知识产权，独创行业换代产品”之理念，致力于新型安全、节能电源技术的研发，创新新型电源技术在多领域的应用，研究开发的多项技术填补国内空白，产品有直流操作电源系列，核电安全电源系列，电动汽车充电站完整解决方案，通信高压直流电源系列。主要应用在电动汽车、通信、核电、智能电网、太阳能储能、水电、风能等新能源领域。先后荣获“国家火炬计划项目”、“中国优秀民营科技企业”、“深圳市市级研究开发中心”、“深圳市优秀民营企业”、“深圳市高新技术十佳创业企业”、“深圳市守合同重信用企业”、“深圳市工业500强企业”、“国家重点新产品”、“广东省重点新产品”、“深圳市科技进步奖”等一系列荣誉。
300484.SZ,蓝海华腾,302729.7593360996,132988.41377178422,241,61912201.78,自动化控制产品,专用设备与零部件,深圳市蓝海华腾技术股份有限公司是一家拥有完全自主知识产权，专业致力于中低压变频器、伺服驱动器、电动汽车电机控制器、逆变器等电力电子产品的研发、制造、销售和服务的国家级高新技术企业和软件企业。
