code,name,mv_mean,amount_mean,num_days,profit,主营产品名称,主营产品类型,公司简介
601633.SH,长城汽车,28531534.42040414,1314991.2317551866,241,6726093883.72,风骏皮卡、哈弗SUV、教练车、腾翼轿车,轿车、轻型卡车,公司是全球知名的SUV制造企业，秉承“每天进步一点点”的企业理念，拥有先进的企业文化和管理团队，创建了独具特色的经营和管理模式，经营质量在国内汽车行业首屈一指。公司多次入选“中国企业500强”、“中国机械500强”、“中国制造500强”，连续多年上榜“福布斯亚太最佳上市公司”、“福布斯2000强”、“《财富》中国500强”、“BrandZ最具价值中国品牌100强”等，并被评为中国机电进出口商会的“推荐出口品牌”，也是商务部、发改委授予的“国家汽车整车出口基地企业”，首家成为国际氢能委员会成员的中国汽车企业。近年来，长城汽车的技术实力得到了社会的广泛肯定，被国家发改委、科技部等五部委联合认定为“国家认定企业技术中心”、“博士后科研工作站设站单位”、“国家创新型企业”。
600104.SH,上汽集团,22981707.858604606,846878.6680580913,241,24533097943.83,上海大众Fabia、上海大众GOL轿车、上海大众Octavia明锐、上海大众POLO劲情、上海大众POLO劲取、上海大众PSN微型双排座货车、上海大众Superb、上海大众别克GL8系列轿车、上海大众波罗、上海大众大众变速器、上海大众都市清风客车、上海大众君威系列轿车、上海大众凯越轿车、上海大众名爵轿车、上海大众帕萨特领驭、上海大众荣威轿车、上海大众赛宝多功能轻型客车、上海大众赛欧SRV轿车、上海大众赛欧轿车、上海大众桑塔纳3000型“超越者”、上海大众桑塔纳轿车、上海大众上海汇众、上海大众上汽PLN微型货车、上海大众上汽SPARK客车、上海大众上汽通用五菱6360客车、上海大众申沃、上海大众申沃城市客车、上海大众通用五菱、上海大众途安Touran、上海大众五菱变速器、上海大众五菱之光客车、上海大众幸福摩托、上海大众重庆红岩、上海汇众轿车底盘,传动设备、行驶底盘设备、轿车、客车、摩托车、轻型卡车、重型卡车与专用车,公司属于汽车制造行业，目前正努力把握产业发展趋势，加快创新转型，从传统的制造型企业，向为消费者提供移动出行服务与产品的综合供应商发展。公司主要业务包括整车(含乘用车、商用车)的研发、生产和销售，正积极推进新能源汽车、互联网汽车的商业化，并开展智能驾驶等技术研究和产业化探索；零部件(含动力驱动系统、底盘系统、内外饰系统，以及电池、电驱、电力电子等新能源汽车核心零部件和智能产品系统)的研发、生产、销售；物流、汽车电商、出行服务、节能和充电服务等汽车服务贸易业务；汽车相关金融、保险和投资业务；海外经营和国际商贸业务；并在产业大数据和人工智能领域积极布局。
600406.SH,国电南瑞,18172316.25676088,1039940.342746888,241,5642448311.81,国电南瑞AGC自动发电控制软件包、国电南瑞变电站自动化系统、国电南瑞电力市场、国电南瑞电网调度自动化、国电南瑞轨道交通自动化、国电南瑞能量管理系统、国电南瑞农电自动化、国电南瑞配网自动化、国电南瑞实时分布监控系统、国电南瑞市政及工业控制自动化,行业专用软件、继电保护及调度自动化,"公司作为专业从事电力自动化软硬件开发和系统集成服务的提供商，主要从事电网调度自动化、变电站自动化、火电厂及工业控制自动化系统的软硬件开发和系统集成服务。公司是国家火炬计划软件产业基地-南京软件园“骨干企业”、“江苏省首批软件企业”、“国家规划布局内重点软件企业”。公司建立了遍布全国的营销网络和精干的销售队伍，通过技术合作、共同开发等方式与重要客户构筑了以产品为纽带的合作关系，公司的自动化产品涉足电力、石化、市政、轨道交通等多个领域。2017年公司通过重大资产重组,拥有普瑞特高压、设计公司等100%股权，本公司将新增继电保护及柔性输电、电力信息通信等领域的业务，业务布局进一步完善，业务协同进一步加强，行业地位进一步巩固，整体价值得到有效提升。"
000792.SZ,盐湖股份,17178006.674564414,3828424.1835574713,174,4478386639.86,盐桥氯化钾,钾肥,公司是青海省国有资产监督管理委员会管理的省属大型上市国有企业，主要从事化学原料及化学制品制造。公司坚持“以钾为主、综合利用、循环经济”的发展思想，从单一的钾肥向化肥产业、无机到有机、化工到精细化工、石油化工、天然气化工、煤炭化工等多重跨越，公司产品由单一氯化钾发展到氢氧化钾、碳酸钾、硝酸钾、氢氧化钠、碳酸钠、金属镁、氧化镁、氢氧化镁、碳酸锂、PVC、甲醇、尿素、聚丙烯、焦炭、水泥、编织袋等多种产品，涉及工业、农业、航天航空、建材、医药等领域。
601238.SH,广汽集团,10453073.835729929,668635.0454854772,241,7334915288.0,HVAC系统、城市公交客车、发动机、广汽丰田CAMRY凯美瑞、广汽丰田YARIS雅力士、广州本田奥德赛、广州本田飞度、广州本田思迪、广州本田雅阁、减震器、金星系列轻型货车、骏铃系列轻型货车、银星系列轻型货车、转向器、座椅,车身及外观设备、发动机设备、行驶底盘设备、轿车、客车、轻型卡车、专用设备与零部件、转向设备,公司是由广州汽车工业集团有限公司、万向集团公司、中国机械工业集团公司、广州钢铁企业集团有限公司、广州市长隆酒店有限公司作为共同发起人，以发起方式设立的大型国有控股股份制企业集团。主要业务包括乘用车、商用车、摩托车、汽车零部件的研发、制造、销售及售后服务，以及汽车相关产品进出口贸易，汽车租赁、二手车、物流、拆解、资源再生，汽车信贷、融资租赁、商业保理、保险和保险经纪，股权投资等。经过多年的资源整合及产业重组，公司已经形成了立足华南，辐射华北、华中、华东和环渤海地区的产业布局和以整车制造为中心，覆盖上游汽车与零部件的研发和下游的汽车服务与金融投资的产业链闭环，是国内产业链最为完整、产业布局最为优化的汽车集团。通过引进、消化、吸收和再创新，积累了国际先进的制造和管理技术，形成了世界级水平的生产体系；整合全球优势资源，形成跨平台、模块化架构的正向开发体系，具备集成创新优势。
000625.SZ,长安汽车,10372251.09318211,2612765.768099585,241,3552463320.03,SC6360长安星韵客车、快乐王子轿车、羚羊OK款轿车、长安CM8都市多功能车、长安SC6372系列客车、长安城市彩虹货车、长安都市彩虹客车、长安福特嘉年华轿车、长安公安车、长安救护车、长安镭蒙客车、长安绿色新星客车、长安蒙迪欧2.5 V6旗舰轿车、长安双排微型货车、长安系列货车、长安雪虎客车、长安一排半微型货车、长安邮政车、长安运动系列客车,轿车、客车、轻型卡车、专用车,公司是中国汽车四大集团阵营企业、中国品牌领先汽车企业，两度入选央视“国家品牌计划”，成为中国品牌汽车行业领跑者。公司的主要业务涵盖整车研发、制造和销售以及发动机的研发、生产，并整合优势资源积极发展出行服务、新零售、金融投资等领域，进行多维度的产业布局。公司始终坚持以“引领汽车文明造福人类生活”为使命，秉承“节能环保、科技智能”的理念，大力发展新能源和智能汽车，致力于用科技创新引领汽车文明，努力为客户提供高品质的产品和服务。经过多年发展，现已形成轿车、SUV、MPV、交叉型乘用车、客车、货车等多档次、宽系列、多品种的产品谱系，覆盖传统燃油和新能源车型，拥有排量从1.0L到2.0L的发动机平台。公司旗下拥有长安乘用车、欧尚汽车、凯程汽车、长安福特、长安马自达、长安铃木、长安PSA等众多知名品牌。
601127.SH,小康股份,7948315.382018605,1493665.6912531122,241,-1823911349.24,汽车发动机、汽车零部件、汽车整车,汽车及零配件经销,公司是一家以发动机和新能源汽车为核心业务、汽车整车为主营业务的实体制造企业，现已形成集汽车整车、发动机、汽车零部件的自主研发、制造、销售及服务于一体的完整产业链。业务还涉及汽车租赁和互联网消费金融。公司及其子公司的主营产品包括超级都市SUV、紧凑型MPV、纯电动微型商用车等整车以及1.0-1.8升、1.5T缸内直喷涡轮增压等节能环保高性能发动机。公司入围中国企业500强，并先后荣获中国驰名商标、全国守合同重信用企业、全国就业先进企业、国家知识产权示范企业等荣誉。
300207.SZ,欣旺达,5944321.185746764,1583881.277120332,241,915654084.18,薄膜开关、笔记本类锂离子电池模组、储能电站电池、电动工具电池、电动汽车电池、电动自行车电池、电源管理系统、动力类锂离子电池模组、工业移动照明电池、手机数码类锂离子电池模组、医疗设备电池,低压电器类,公司是国内锂能源领域设计能力最强、配套能力最完善、产品系列最多的锂离子电池模组制造商之一。历经二十余年，公司发展成为全球锂离子电池领域的领军企业，形成了动力电池及动力总成、储能系统与能源互联网、3c消费类电池、智能硬件、自动化与智能制造、第三方检测六大产业群，致力于提供绿色、快速、高效的新能源一体化解决方案服务。公司主要从事锂离子电池模组研发制造业务，主要产品为锂离子电池模组，属于新能源领域。锂离子电池产业作为新能源领域的重要组成部分，广泛应用于手机、笔记本电脑、电动汽车动力总成、可穿戴设备、储能、能源互联网、动力工具、电动自行车等领域。公司产品还涵盖锂离子电芯、电源管理系统、精密结构件、智能制造类(含自动化设备)等多个领域。公司在锂离子电池模组领域，通过自主研发，拥有多项自主原始创新和集成创新的核心技术。通过多年努力，公司先后获评“世界能源500强”、“中国电子信息企业百强”、“中国电池百强企业”、“中国民营制造业500强”等荣誉。
601689.SH,拓普集团,5059934.801557859,688041.1918340249,241,1017253691.77,汽车隔音产品、汽车橡胶减震产品,专用设备与零部件,公司主要从事汽车NVH(即减震降噪及舒适性控制)领域橡胶减震产品和隔音产品的研发、生产与销售，致力于消除来自于汽车动力总成、路面及空气的振动与噪声，提升整车的舒适性及平顺性。公司在汽车NVH领域的技术及研发水平位居国内前列，是国内为数不多的具备整车同步研发能力的NVH零部件供应商之一，也是国内较早进入全球整车配套零部件采购体系的自主品牌汽车零部件生产企业。近年来，公司凭借一流的研发能力、生产工艺及制造水平已逐步获得国际汽车界的认可，先后进入通用汽车、克莱斯勒、奥迪、宝马等知名汽车制造商的全球研发体系及零部件采购体系，逐渐成长为面向国际、国内两个市场，专业化和规模化的汽车NVH零部件系统集成供应商。公司的同步研发及系统集成能力符合世界知名整车制造商全球采购的技术指标，具有较强的国际竞争力。研发中心被认定为“宁波市企业工程(技术)中心”，“省级高新技术企业研究开发中心”，研发中心下设的“产品测试中心”符合ISO/IEC17025实验室检测能力标准，成为“国家级测试中心”。
002080.SZ,中材科技,4905203.978210788,874506.209593361,241,3373402277.4,中材AGM隔板、中材MW级风机叶片、中材TXZ型陶瓷纤维纸、中材摆锤法岩棉生产技术及设备、中材玻璃微纤维纸、中材玻纤覆膜滤料、中材玻纤空气过滤纸、中材玻纤生产线设计与安装、中材玻纤湿法薄毡生产技术及设备、中材玻纤装备、中材池窑拉丝技术装备、中材低介电玻璃纤维、中材高硅氧玻璃纤维、中材高模量玻璃纤维、中材高强度玻璃纤维、中材空气净化过滤毡、中材离心喷吹法生产技术及设备、中材平面仿形织物、中材自动换筒拉丝机,玻璃纤维、风泵机械、工业建筑、轻型工程机械、人造板、人造纤维,公司是我国特种纤维复合材料的技术发源地，拥有完整的非金属矿物材料、玻璃纤维、纤维复合材料技术产业链，是我国特种纤维复合材料领域集研发、设计、产品制造与销售、技术装备集成于一体的国家级高新技术企业。业务产品紧扣新能源、航空航天、节能减排、国防军工等应用领域。承继了原南京玻璃纤维研究设计院、北京玻璃钢研究设计院和苏州非金属矿工业设计研究院三个国家级科研院所多年的核心技术资源和人才优势。公司是国家首批创新型企业、国家首批技术创新示范企业、国家高新技术企业，拥有国家重点实验室、国家级企业技术中心、国家级工程技术研究中心、博士后工作站，形成了稳定高效的高层次研发平台，拥有一支国内优秀的新材料研发人才队伍。
000800.SZ,一汽解放,4803338.136696232,148908.53022821576,241,3899854760.39,奥迪轿车、宝来轿车、高尔夫轿车、红旗轿车、花冠轿车、华西客车、佳宝客车、佳星・幸福使者轿车、捷达轿车、解放奥威重卡、解放中重卡、骏雅轿车、柯斯达客车、马自达轿车、普力马轿车、绅雅轿车、太湖客车、威驰轿车、威乐轿车、威姿轿车、小解放三吨王卡车、雅酷轿车、远征客车,轿车、客车、轻型卡车、重型卡车与专用车,公司自上市以来，始终致力于打造高品质乘用车产品以满足用户需求。公司主营业务为开发、制造和销售乘用车及其配件。公司现有一汽奔腾、Mazda等乘用车产品系列，随着后续车型的有序投放，企业产品的竞争力将会得到进一步提升。通过20余年的发展和积累，已具备了比较完整的汽车研发、制造、供应和营销体系，核心竞争力日益凸显。公司未来产品将通过红旗品牌、中国一汽品牌及合作品牌，满足高、中、低端各级别乘用车用户需求，依托中国一汽“品质、技术、创新”的品牌理念，塑造“品质、安全、科技”的伞品牌形象，努力将“一汽”品牌打造成为国民车第一品牌、将红旗品牌打造成为世界知名品牌。
002008.SZ,大族激光,4422778.702768444,946953.6013278008,241,1994492609.85,大族激光打标机、大族激光雕刻机、大族激光焊接机、大族激光激光制版及印刷设备、大族激光切割机、大族激光钻孔机、大族油墨喷码机,电子设备及加工,公司是中国激光装备行业的领军企业，也是世界知名的激光加工设备生产厂商，主要从事激光加工设备的研发、生产和销售。公司承担建设的主要科研项目被国家科技部火炬高新技术产业中心认定为“国家级火炬计划项目”。公司通过不断自主研发把“实验室装置”变成可以连续24小时稳定工作的激光技术装备，是世界上仅有的几家拥有“紫外激光专利”的公司之一。在强大的资本和技术平台支持下，公司实现了从小功率到大型高功率激光技术装备研发、生产的跨越发展，为国内外客户提供一整套激光加工解决方案及相关配套设施。公司还被评为深圳市高新技术企业，深圳市重点软件企业，广东省装备制造业重点企业，国家级创新型试点企业，国家科技成果推广示范基地重点推广示范企业，国家规划布局内重点软件企业，主要科研项目被认定为国家级火炬计划项目。
688819.SH,天能股份,4112108.041908714,192224.78963900416,241,1369365754.85,3C电池、备用电池、储能电池、电动二轮车电池、电动汽车电池、电动三轮车电池、电动特种车电池、起动启停电池、微型电动汽车电池,电子元器件,公司是一家以电动轻型车绿色动力电池业务为主，集电动特种车绿色动力电池、新能源汽车动力电池、汽车起动启停电池、储能电池、3C电池、备用电池等多品类电池的研发、生产、销售为一体的国内绿色电池行业领先企业之一。公司坚持科技创新驱动绿色发展理念，形成了“铅蓄电池+锂电池”为主的绿色电池产品体系，2019年11月，在中法两国元首的见证下，公司与世界500强企业法国道达尔集团旗下帅福得(SAFT)签订合作协议，双方将整合各自在技术、生产、市场等领域的优势，聚焦于电动轻型车、电动汽车和储能解决方案领域，为中国和全球市场开发、制造和销售先进的绿色锂电产品，公司系国家高新技术企业、国家技术创新示范企业、国家知识产权优势企业、制造业单项冠军示范企业、工业产品绿色设计示范企业、浙江省第一批雄鹰计划培育企业；公司先后建有国家认定企业技术中心、全国示范院士专家工作站、国家级博士后科研工作站、轻工业联合会国家重点实验室、中国轻工业工业设计中心。
600482.SH,中国动力,3819538.71267061,124660.5012406639,241,613048770.5,柴油机、海水电池、核电、锂离子电池、铅酸电池、铅碳电池、全电动力、燃料电池、燃气轮机、热气机、蒸汽轮机,低压电器类、动力机械,公司原是军用起动铅酸蓄电池的定点生产单位，多年来公司引进了多条蓄电池专用生产线和检测设备。公司是一汽大众、上海大众、上海通用、北京现代、东风汽车、长安汽车的常年合作方，是奥迪A6、帕萨特领驭、别克荣御等中高端车型的独家配套商，国内汽车起动电池市场占有率较高并连续多年跻身于“中国汽车零部件百强企业”、“中国机械工业百强企业”。2016年，公司收购多家公司股权和债权，业务范围涵盖燃气动力、蒸汽动力、化学动力、全电动力、民用核动力、柴油机动力、热气机动力等七大动力，成为多维度的高端动力装备研发、制造、系统集成、销售及服务的上市公司。
600499.SH,科达制造,3537872.461424428,1302313.60106639,241,1005757290.67,科达薄板、复合板磨机、科达玻璃双边直线磨边机、科达玻璃异形磨边机、科达玻璃直边磨边机、科达玻璃直线斜边磨边机、科达瓷质砖抛光后干燥器、科达粗磨机、科达大理石磨机、科达大理石排锯、科达单压带滚筒式磨边倒角线、科达电动辊棒台、科达防污打腊机、科达干法磨边机、科达刮平定厚机、科达花岗石磨机、科达花岗石砂锯、科达精细磨边机、科达快速干燥器、科达磨头、科达抛坯机、科达全自动液压压砖机、科达双压带滚筒磨边倒角线、科达陶瓷粗（精）抛光机、科达微晶玻璃抛光机、科达压轮式磨边倒角机、科达液压翻板车（吸盘式）、科达釉面墙地砖磨边后干燥器、科达釉面砖抛光机、科达圆盘定厚机,轻型工程机械,公司以建材机械、锂电材料为两大核心业务，清洁煤气化技术与装备、烟气治理技术与装备、液压泵、虎渡风机为四大种子业务。公司秉承“创新永无止境”的核心经营理念，坚持“以科技进步推动企业兴旺发达”、由“科”而“达”的创新发展道路，高度重视具有前瞻性及可持续性的技术、产品研发。公司设有“研发院”，拥有“国家认定企业技术中心”、“国家工程技术中心”、“博士后科研工作站”、“院士工作室”等多层次研发与合作平台，为公司产品研发积累了大量技术储备。公司曾获中国机械500强、国家级高新技术企业、国家知识产权优势企业、广东省政府质量奖等殊荣。
002326.SZ,永太科技,3414513.058183941,2050037.0740912864,241,280285674.06,"2,3,4-三氟苯胺、2,3,4-三氟硝基苯、2,3-二氟苯胺、2,4-二氟苯胺、2,4-二氟硝基苯、2,5-二氟苯胺、2,5-二氟硝基苯、3,4,5-三氟苯胺、3,4,5-三氟硝基苯、3,4-二氟苯胺、3,4-二氟硝基苯、3,5-二氟苯胺、3,5-二氟硝基苯、对氟苯胺、对氟硝基苯、对氟溴苯、二氟溴苯、间氟溴苯、邻氟苯胺、邻氟硝基苯",其他化学品,公司是国内产品链最完善、产能最大的氟精细化学品生产商之一，从事的氟精细化学品行业位于氟化工产业链的顶端，产品附加值高，应用范围广泛，涉及液晶材料、医药、农药、染料等，是国家重点支持和发展的行业。公司是国家第一批“高新技术企业”，“浙江省专利示范企业”，设有“国家级企业技术中心”、“博士后工作站”。
688567.SH,孚能科技,3410402.8148466595,301812.6552199169,241,-952720292.43,电池包、电芯、模组,专用设备与零部件,"公司是全球动力电池技术发展的引领者，是新能源汽车动力电池系统整体技术方案的提供商，也是高性能动力电池系统的生产商，一直专注于新能源车用锂离子动力电池及整车电池系统的研发、生产和销售，并为新能源汽车整车企业提供动力电池整体解决方案，目前已成为全球三元软包动力电池的领军企业之一,公司研发团队长期与全球锂离子动力电池行业科研院所、知名企业、顶尖专家展开战略合作，合作单位包括美国阿贡国家实验室、美国伯克利劳伦斯国家实验室、巴斯夫、杜邦、3M公司等，合作专家包括全球最具影响力的锂离子动力电池行业顶尖专家Michael M.Thackeray、Jeff Dahn等。通过整合全球锂离子动力电池领域的创新资源，公司的技术能力始终保持国际领先水平。公司其他客户包括广汽、长城、吉利、一汽、江铃、长安等国内知名整车企业，同时正在拓展大众、奥迪、保时捷、通用、雷诺、日产、本田、奇瑞、东风等国内外一线整车企业客户。"
601168.SH,西部矿业,3372043.87966805,1002533.6951369294,241,2932499835.0,西部矿业电解铝、西部矿业电解铅、西部矿业电解铜、西部矿业电解锌、西部矿业锰片、西部矿业铅精矿、西部矿业铁精粉、西部矿业铜精矿、西部矿业锌精矿,电解铝、黑色金属矿产、铅、铜、锌、有色金属矿产、重有色金属,西部矿业集团有限公司成立于2000年，总部位于青海省西宁市，前身为锡铁山矿务局。2007年公司旗下西部矿业股份有限公司在上海证券交易所挂牌上市。经过多年发展，公司由单一的铅锌资源开发企业拓展成为集矿山冶炼、盐湖化工、文化旅游、建筑地产、金融贸易、科技信息六大产业为一体的大型企业集团，在全国11个省市区拥有40余家分子公司。资产总额从2000年的10.91亿元到如今650亿元，增长60倍；营业收入从2000年的7.36亿元到如今400亿元，增长54倍。截止目前，公司保有有色金属资源储量1505万吨，贵金属资源储量黄金27吨，白银3900吨，黑色金属资源储量3.1亿吨，盐湖资源储量12亿吨，其中氯化锂储量285万吨，总资源量潜在价值突破1.2万亿元。是青海省唯一一家连续14年入围中国企业500强的企业。
